session,session_type,meeting_no,date,speech_order,speaker_name,speaker_position,speaker_area,data_mem_id,agenda_item_orders,agenda_item_titles,agenda_item_times,speech_text
426,임시회,제2호,2025년 7월 1일(화),1,신정훈,위원장,(전남 나주시화순군),6713,,,,"의석을 정돈해 주시기 바랍니다.
 성원이 되었으므로 제426회 국회(임시회) 제2차 행정안전위원회를 개회하겠습니다.
 바쁘신 와중에도 회의에 참석해 주신 위원님 여러분께 감사의 말씀 드립니다.
 오늘은 우리 위원회에 회부된 법률안 및 청원을 상정하여 소위에 회부하고 소위원회에서 심도 있게 심사해 주신 추경안을 의결코자 합니다."
426,임시회,제2호,2025년 7월 1일(화),2,신정훈,위원장,(전남 나주시화순군),6713,,o 소위원장(이달희) 인사,(14시06분),본격적인 의사일정에 앞서 어제 청원심사소위원장으로 선출되신 이달희 소위원장님의 인사말씀 먼저 듣겠습니다.
426,임시회,제2호,2025년 7월 1일(화),3,이달희,위원,(비례대표),6767,,o 소위원장(이달희) 인사,(14시06분),"이달희 위원입니다.
 청원에 담긴 국민의 뜻을 담아내는 일은 헌법에 부여된 국가의 의무입니다. 청원심사소위원장으로서 국민 안전과 행복한 지방 시대를 위해 국민 목소리에 더욱 귀 기울이고 민생 현장에 답이 있다는 생각으로 그 책무를 다하겠습니다.
 감사합니다."
426,임시회,제2호,2025년 7월 1일(화),4,신정훈,위원장,(전남 나주시화순군),6713,,o 소위원장(이달희) 인사,(14시06분),"고맙습니다.
 그러면 의사일정에 들어가겠습니다."
