session,session_type,meeting_no,date,speech_order,speaker_name,speaker_position,speaker_area,data_mem_id,agenda_item_orders,agenda_item_titles,agenda_item_times,speech_text
426,임시회,제2호,2025년 7월 1일(화),10,박주민,의원,(서울 은평구갑),6691,"1,2,3,4,5,6,7,8,9,10,11,12,13,14,15,16,17,18,19,20,21,22,23,24,25,26,27,28,29,30,31,32,33,34,35,36,37,38,39,40,41,42,43,44,45,46,47,48,49,50,51,52,53,54,55,56,57,58,59,60,61,62,63,64,65,66,67,68,69,70,71,72,73,74,75,76,77,78,79,80,81,82,83,84,85,86,87,88,89,90,91,92,93,94,95,96,97,98,99,100,101,102,103,104,105,106,107,108,109,110,111,112,113,114,115,116,117,118,119,120,121,122,123,124,125,126,127,128,129,130,131,132,133,134,135,136,137,138,139,140,141,142,143,144,145,146,147,148,149,150,151,152,153,154,155,156,157,158,159,160,161,162,163,164,165,166,167,168,169,170,171,172,173,174,175,176,177,178,179,180,181,182,183,184,185,186,187,188,189,190,191,192,193,194,195,196,197,198,199,200,201,202,203,204,205,206,207,208,209,210,211,212,213,214,215,216,217,218,219,220,221,222,223,224,225,226,227,228,229,230,231,232,233,234,235,236,237,238,239,240,241,242,243,244,245,246,247,248,249,250,251,252,253,254,255,256,257,258,259,260,261,262,263,264,265,266,267,268,269,270,271,272,273,274,275,276,277,278,279,280,281,282,283,284,285,286,287,288,289,290,291,292,293,294,295,296,297,298,299,300,301,302,303,304,305,306,307,308,309,310,311,312,313,314,315,316,317,318,319,320,321,322,323,324,325,326,327,328,329,330,331,332,333,334,335,336,337,338,339,340,341,342,343,344,345,346,347,348,349,350,351,352,353,354,355,356,357","고향사랑 기부금에 관한 법률 일부개정법률안(이만희 의원 대표발의)(의안번호 2209972) / 고향사랑 기부금에 관한 법률 일부개정법률안(이춘석 의원 대표발의)(의안번호 2210056) / 공공데이터의 제공 및 이용 활성화에 관한 법률 일부개정법률안(윤후덕 의원 대표발의)(의안번호 2208034) / 공유재산 및 물품 관리법 일부개정법률안(조승환 의원 대표발의)(의안번호 2209014) / 공유재산 및 물품 관리법 일부개정법률안(정동만 의원 대표발의)(의안번호 2209109) / 공중화장실 등에 관한 법률 일부개정법률안(한준호 의원 대표발의)(의안번호 2209056) / 국경일에 관한 법률 일부개정법률안(김상욱 의원 대표발의)(의안번호 2207419) / 국경일에 관한 법률 일부개정법률안(강경숙 의원 대표발의)(의안번호 2209027) / 국경일에 관한 법률 일부개정법률안(이해민 의원 대표발의)(의안번호 2209623) / 국경일에 관한 법률 일부개정법률안(문진석 의원 대표발의)(의안번호 2210105) / 대통령기록물 관리에 관한 법률 일부개정법률안(채현일 의원 대표발의)(의안번호 2208152) / 대통령기록물 관리에 관한 법률 일부개정법률안(김태선 의원 대표발의)(의안번호 2208861) / 대통령기록물 관리에 관한 법률 일부개정법률안(신정훈 의원 대표발의)(의안번호 2209448) / 대통령기록물 관리에 관한 법률 일부개정법률안(용혜인 의원 대표발의)(의안번호 2209612) / 대통령기록물 관리에 관한 법률 일부개정법률안(전현희 의원 대표발의)(의안번호 2209643) / 대통령기록물 관리에 관한 법률 일부개정법률안(이해식 의원 대표발의)(의안번호 2209644) / 대통령기록물 관리에 관한 법률 일부개정법률안(위성곤 의원 대표발의)(의안번호 2209871) / 대통령기록물 관리에 관한 법률 일부개정법률안(박주민 의원 대표발의)(의안번호 2210139) / 대통령의 권한대행에 관한 법률안(용혜인 의원 대표발의)(의안번호 2209525) / 대통령직 인수에 관한 법률 일부개정법률안(민형배 의원 대표발의)(의안번호 2209597) / 대통령직 인수에 관한 법률 일부개정법률안(한병도 의원 대표발의)(의안번호 2209839) / 대통령직 인수에 관한 법률 일부개정법률안(황명선 의원 대표발의)(의안번호 2209935) / 마을공동체 활성화 기본법안(박정현 의원 대표발의)(의안번호 2208551) / 민원 처리에 관한 법률 일부개정법률안(김태선 의원 대표발의)(의안번호 2210219) / 상훈법 일부개정법률안(민형배 의원 대표발의)(의안번호 2208958) / 새마을운동조직 육성법 일부개정법률안(이종배 의원 대표발의)(의안번호 2208006) / 옥외광고물 등의 관리와 옥외광고산업 진흥에 관한 법률 일부개정법률안(이만희 의원 대표발의)(의안번호 2208324) / 옥외광고물 등의 관리와 옥외광고산업 진흥에 관한 법률 일부개정법률안(이만희 의원 대표발의)(의안번호 2208365) / 옥외광고물 등의 관리와 옥외광고산업 진흥에 관한 법률 일부개정법률안(한병도 의원 대표발의)(의안번호 2208554) / 인구감소지역 지원 특별법 일부개정법률안(박상웅 의원 대표발의)(의안번호 2208649) / 인구감소지역 지원 특별법 일부개정법률안(박지원 의원 대표발의)(의안번호 2209111) / 인구감소지역 지원 특별법 일부개정법률안(이춘석 의원 대표발의)(의안번호 2209279) / 인구감소지역 지원 특별법 일부개정법률안(이춘석 의원 대표발의)(의안번호 2210059) / 자원봉사활동 기본법 일부개정법률안(박성훈 의원 대표발의)(의안번호 2207929) / 자전거 이용 활성화에 관한 법률 일부개정법률안(박성훈 의원 대표발의)(의안번호 2207885) / 자전거 이용 활성화에 관한 법률 일부개정법률안(김선교 의원 대표발의)(의안번호 2208805) / 전직대통령 예우에 관한 법률 일부개정법률안(복기왕 의원 대표발의)(의안번호 2209752) / 접경지역 지원 특별법 일부개정법률안(정부 제출)(의안번호 2209114) / 접경지역 지원 특별법 일부개정법률안(김용태 의원 대표발의)(의안번호 2209892) / 정부조직법 일부개정법률안(민형배 의원 대표발의)(의안번호 2207129) / 정부조직법 일부개정법률안(권향엽 의원 대표발의)(의안번호 2207133) / 정부조직법 일부개정법률안(민형배 의원 대표발의)(의안번호 2207269) / 정부조직법 일부개정법률안(신장식 의원 대표발의)(의안번호 2207305) / 정부조직법 일부개정법률안(황명선 의원 대표발의)(의안번호 2207312) / 정부조직법 일부개정법률안(박홍배 의원 대표발의)(의안번호 2207436) / 정부조직법 일부개정법률안(한민수 의원 대표발의)(의안번호 2207685) / 정부조직법 일부개정법률안(김정호 의원 대표발의)(의안번호 2207822) / 정부조직법 일부개정법률안(박범계 의원 대표발의)(의안번호 2207846) / 정부조직법 일부개정법률안(조인철 의원 대표발의)(의안번호 2207874) / 정부조직법 일부개정법률안(박홍배 의원 대표발의)(의안번호 2208263) / 정부조직법 일부개정법률안(조정훈 의원 대표발의)(의안번호 2208944) / 정부조직법 일부개정법률안(박정현 의원 대표발의)(의안번호 2209049) / 정부조직법 일부개정법률안(허성무 의원 대표발의)(의안번호 2209646) / 정부조직법 일부개정법률안(오기형 의원 대표발의)(의안번호 2209669) / 정부조직법 일부개정법률안(허영 의원 대표발의)(의안번호 2209755) / 정부조직법 일부개정법률안(이강일 의원 대표발의)(의안번호 2209821) / 정부조직법 일부개정법률안(김건 의원 대표발의)(의안번호 2209869) / 정부조직법 일부개정법률안(최민희 의원 대표발의)(의안번호 2209881) / 제주특별자치도 설치 및 국제자유도시 조성을 위한 특별법 일부개정법률안(위성곤 의원 대표발의)(의안번호 2207167) / 제주특별자치도 설치 및 국제자유도시 조성을 위한 특별법 일부개정법률안(위성곤 의원 대표발의)(의안번호 2207389) / 제주특별자치도 설치 및 국제자유도시 조성을 위한 특별법 일부개정법률안(위성곤 의원 대표발의)(의안번호 2209705) / 주민등록법 일부개정법률안(김정호 의원 대표발의)(의안번호 2207765) / 주민소환에 관한 법률 일부개정법률안(이인영 의원 대표발의)(의안번호 2210211) / 주민조례발안에 관한 법률 일부개정법률안(김태선 의원 대표발의)(의안번호 2209199) / 주한미군 공여구역주변지역 등 지원 특별법 일부개정법률안(박지혜 의원 대표발의)(의안번호 2207700) / 주한미군 공여구역주변지역 등 지원 특별법 일부개정법률안(이재강 의원 대표발의)(의안번호 2207732) / 주한미군 공여구역주변지역 등 지원 특별법 일부개정법률안(정부 제출)(의안번호 2209115) / 주한미군 공여구역주변지역 등 지원 특별법 일부개정법률안(김성원 의원 대표발의)(의안번호 2209770) / 지방공기업법 일부개정법률안(김위상 의원 대표발의)(의안번호 2207794) / 지방공기업법 일부개정법률안(김종양 의원 대표발의)(의안번호 2208771) / 지방공기업법 일부개정법률안(김태선 의원 대표발의)(의안번호 2209181) / 지방공기업법 일부개정법률안(신장식 의원 대표발의)(의안번호 2209269) / 지방공무원법 일부개정법률안(이해식 의원 대표발의)(의안번호 2207659) / 지방공무원법 일부개정법률안(허성무 의원 대표발의)(의안번호 2208878) / 지방공무원법 일부개정법률안(최보윤 의원 대표발의)(의안번호 2209365) / 지방공무원법 일부개정법률안(김상훈 의원 대표발의)(의안번호 2209708) / 지방교부세법 일부개정법률안(황정아 의원 대표발의)(의안번호 2207756) / 지방교부세법 일부개정법률안(송재봉 의원 대표발의)(의안번호 2208188) / 지방교부세법 일부개정법률안(김교흥 의원 대표발의)(의안번호 2209922) / 지방세기본법 일부개정법률안(김소희 의원 대표발의)(의안번호 2207141) / 지방세기본법 일부개정법률안(오기형 의원 대표발의)(의안번호 2208003) / 지방세기본법 일부개정법률안(양부남 의원 대표발의)(의안번호 2208101) / 지방세법 일부개정법률안(김소희 의원 대표발의)(의안번호 2207143) / 지방세법 일부개정법률안(김예지 의원 대표발의)(의안번호 2208699) / 지방세법 일부개정법률안(구자근 의원 대표발의)(의안번호 2208941) / 지방세징수법 일부개정법률안(오기형 의원 대표발의)(의안번호 2208610) / 지방세특례제한법 일부개정법률안(김성원 의원 대표발의)(의안번호 2207202) / 지방세특례제한법 일부개정법률안(엄태영 의원 대표발의)(의안번호 2207529) / 지방세특례제한법 일부개정법률안(주철현 의원 대표발의)(의안번호 2207746) / 지방세특례제한법 일부개정법률안(정성호 의원 대표발의)(의안번호 2207946) / 지방세특례제한법 일부개정법률안(조인철 의원 대표발의)(의안번호 2208127) / 지방세특례제한법 일부개정법률안(이만희 의원 대표발의)(의안번호 2208224) / 지방세특례제한법 일부개정법률안(강명구 의원 대표발의)(의안번호 2208238) / 지방세특례제한법 일부개정법률안(이만희 의원 대표발의)(의안번호 2208270) / 지방세특례제한법 일부개정법률안(김예지 의원 대표발의)(의안번호 2208285) / 지방세특례제한법 일부개정법률안(이만희 의원 대표발의)(의안번호 2208302) / 지방세특례제한법 일부개정법률안(엄태영 의원 대표발의)(의안번호 2208307) / 지방세특례제한법 일부개정법률안(장철민 의원 대표발의)(의안번호 2208435) / 지방세특례제한법 일부개정법률안(박정 의원 대표발의)(의안번호 2208446) / 지방세특례제한법 일부개정법률안(최수진 의원 대표발의)(의안번호 2208606) / 지방세특례제한법 일부개정법률안(이만희 의원 대표발의)(의안번호 2208684) / 지방세특례제한법 일부개정법률안(이만희 의원 대표발의)(의안번호 2208704) / 지방세특례제한법 일부개정법률안(이만희 의원 대표발의)(의안번호 2208739) / 지방세특례제한법 일부개정법률안(윤준병 의원 대표발의)(의안번호 2208767) / 지방세특례제한법 일부개정법률안(이원택 의원 대표발의)(의안번호 2208984) / 지방세특례제한법 일부개정법률안(이만희 의원 대표발의)(의안번호 2208999) / 지방세특례제한법 일부개정법률안(엄태영 의원 대표발의)(의안번호 2209057) / 지방세특례제한법 일부개정법률안(윤준병 의원 대표발의)(의안번호 2209167) / 지방세특례제한법 일부개정법률안(윤준병 의원 대표발의)(의안번호 2209242) / 지방세특례제한법 일부개정법률안(윤준병 의원 대표발의)(의안번호 2209292) / 지방세특례제한법 일부개정법률안(조인철 의원 대표발의)(의안번호 2209331) / 지방세특례제한법 일부개정법률안(최보윤 의원 대표발의)(의안번호 2209396) / 지방세특례제한법 일부개정법률안(엄태영 의원 대표발의)(의안번호 2209414) / 지방세특례제한법 일부개정법률안(김태선 의원 대표발의)(의안번호 2209613) / 지방세특례제한법 일부개정법률안(안도걸 의원 대표발의)(의안번호 2209639) / 지방세특례제한법 일부개정법률안(김선교 의원 대표발의)(의안번호 2209655) / 지방세특례제한법 일부개정법률안(김주영 의원 대표발의)(의안번호 2209687) / 지방세특례제한법 일부개정법률안(박상웅 의원 대표발의)(의안번호 2209787) / 지방세특례제한법 일부개정법률안(정춘생 의원 대표발의)(의안번호 2209813) / 지방세특례제한법 일부개정법률안(한병도 의원 대표발의)(의안번호 2209838) / 지방세특례제한법 일부개정법률안(허성무 의원 대표발의)(의안번호 2210009) / 지방세특례제한법 일부개정법률안(박상웅 의원 대표발의)(의안번호 2210016) / 지방세특례제한법 일부개정법률안(김기표 의원 대표발의)(의안번호 2210079) / 지방세특례제한법 일부개정법률안(박정하 의원 대표발의)(의안번호 2210164) / 지방세특례제한법 일부개정법률안(박상웅 의원 대표발의)(의안번호 2210217) / 지방자치단체 보조금 관리에 관한 법률 일부개정법률안(양부남 의원 대표발의)(의안번호 2208167) / 지방자치단체 보조금 관리에 관한 법률 일부개정법률안(김태선 의원 대표발의)(의안번호 2209188) / 지방자치단체 출자·출연 기관의 운영에 관한 법률 일부개정법률안(김종양 의원 대표발의)(의안번호 2208761) / 지방자치단체를 당사자로 하는 계약에 관한 법률 일부개정법률안(김태선 의원 대표발의)(의안번호 2209200) / 지방자치단체를 당사자로 하는 계약에 관한 법률 일부개정법률안(장종태 의원 대표발의)(의안번호 2209211) / 지방자치법 일부개정법률안(정춘생 의원 대표발의)(의안번호 2207122) / 지방자치법 일부개정법률안(민형배 의원 대표발의)(의안번호 2207475) / 지방자치법 일부개정법률안(박지원 의원 대표발의)(의안번호 2207878) / 지방자치법 일부개정법률안(이달희 의원 대표발의)(의안번호 2208553) / 지방자치법 일부개정법률안(정동만 의원 대표발의)(의안번호 2209677) / 지방자치법 일부개정법률안(신정훈 의원 대표발의)(의안번호 2209845) / 지방재정법 일부개정법률안(김소희 의원 대표발의)(의안번호 2207142) / 지방재정법 일부개정법률안(정을호 의원 대표발의)(의안번호 2207428) / 지방재정법 일부개정법률안(임오경 의원 대표발의)(의안번호 2209065) / 지역공공은행 설립 및 운영에 관한 특별법안(송재봉 의원 대표발의)(의안번호 2207255) / 지역사랑상품권 이용 활성화에 관한 법률 일부개정법률안(신정훈 의원 대표발의)(의안번호 2207816) / 직능인 경제활동 지원에 관한 법률 일부개정법률안(김종양 의원 대표발의)(의안번호 2208759) / 한국자유총연맹 육성에 관한 법률 일부개정법률안(김성원 의원 대표발의)(의안번호 2207207) / 행정법제 혁신을 위한 공공기관의 정보공개에 관한 법률 등 11개 법률의 일부개정에 관한 법률안(조은희 의원 대표발의)(의안번호 2208259) / 행정절차법 일부개정법률안(최보윤 의원 대표발의)(의안번호 2209364) / 남성행동 변화 역할을 하는 비서 신설에 관한 청원(김수대 외 52,182인 국민동의로 제출)(청원번호 2200109) / 3·15의거 참여자의 명예회복 등에 관한 법률 일부개정법률안(양부남 의원 대표발의)(의안번호 2209152) / 거창사건등 관련자의 명예회복에 관한 특별조치법 전부개정법률안(신성범 의원 대표발의)(의안번호 2209911) / 국립국가폭력트라우마치유센터의 설립 및 운영에 관한 법률 일부개정법률안(전진숙 의원 대표발의)(의안번호 2208017) / 장애인 차별조항 정비를 위한 행정안전위원회 소관 5개 법률 일부개정을 위한 법률안(최보윤 의원 대표발의)(의안번호 2210042) / 국민 안전교육 진흥 기본법 일부개정법률안(조은희 의원 대표발의)(의안번호 2209258) / 보행안전 및 편의증진에 관한 법률 일부개정법률안(이만희 의원 대표발의)(의안번호 2209001) / 생명안전기본법안(박주민 의원·용혜인 의원·한창민 의원 대표발의)(의안번호 2208779) / 어린이놀이시설 안전관리법 일부개정법률안(안태준 의원 대표발의)(의안번호 2207618) / 어린이놀이시설 안전관리법 일부개정법률안(임호선 의원 대표발의)(의안번호 2209186) / 어린이놀이시설 안전관리법 일부개정법률안(허영 의원 대표발의)(의안번호 2209402) / 자연재해대책법 일부개정법률안(장종태 의원 대표발의)(의안번호 2210030) / 재난 및 안전관리 기본법 일부개정법률안(정춘생 의원 대표발의)(의안번호 2207692) / 재난 및 안전관리 기본법 일부개정법률안(정준호 의원 대표발의)(의안번호 2208042) / 재난 및 안전관리 기본법 일부개정법률안(조은희 의원 대표발의)(의안번호 2208292) / 재난 및 안전관리 기본법 일부개정법률안(윤준병 의원 대표발의)(의안번호 2208366) / 재난 및 안전관리 기본법 일부개정법률안(김병기 의원 대표발의)(의안번호 2208751) / 재난 및 안전관리 기본법 일부개정법률안(임호선 의원 대표발의)(의안번호 2208982) / 재난 및 안전관리 기본법 일부개정법률안(백선희 의원 대표발의)(의안번호 2209342) / 재난 및 안전관리 기본법 일부개정법률안(서미화 의원 대표발의)(의안번호 2209452) / 재난 및 안전관리 기본법 일부개정법률안(김윤 의원 대표발의)(의안번호 2209617) / 재난 및 안전관리 기본법 일부개정법률안(백선희 의원 대표발의)(의안번호 2209818) / 재난 및 안전관리 기본법 일부개정법률안(임오경 의원 대표발의)(의안번호 2209831) / 재난 및 안전관리 기본법 일부개정법률안(민형배 의원 대표발의)(의안번호 2209979) / 재해구호법 일부개정법률안(강선우 의원 대표발의)(의안번호 2207998) / 재해구호법 일부개정법률안(안상훈 의원 대표발의)(의안번호 2208917) / 행정법제 혁신을 위한 국민 안전교육 진흥 기본법 등 9개 법률의 일부개정에 관한 법률안(조은희 의원 대표발의)(의안번호 2208261) / 공공단체등 위탁선거에 관한 법률 일부개정법률안(양부남 의원 대표발의)(의안번호 2207939) / 공공단체등 위탁선거에 관한 법률 일부개정법률안(신정훈 의원 대표발의)(의안번호 2208287) / 공공단체등 위탁선거에 관한 법률 일부개정법률안(윤재옥 의원 대표발의)(의안번호 2208350) / 공공단체등 위탁선거에 관한 법률 일부개정법률안(김태선 의원 대표발의)(의안번호 2209176) / 공직선거법 일부개정법률안(정춘생 의원 대표발의)(의안번호 2207259) / 공직선거법 일부개정법률안(강득구 의원 대표발의)(의안번호 2207296) / 공직선거법 일부개정법률안(이광희 의원 대표발의)(의안번호 2207338) / 공직선거법 일부개정법률안(정춘생 의원 대표발의)(의안번호 2207458) / 공직선거법 일부개정법률안(이해식 의원 대표발의)(의안번호 2207526) / 공직선거법 일부개정법률안(최보윤 의원 대표발의)(의안번호 2207668) / 공직선거법 일부개정법률안(한민수 의원 대표발의)(의안번호 2207688) / 공직선거법 일부개정법률안(이달희 의원 대표발의)(의안번호 2207905) / 공직선거법 일부개정법률안(김태호 의원 대표발의)(의안번호 2207989) / 공직선거법 일부개정법률안(김태호 의원 대표발의)(의안번호 2208050) / 공직선거법 일부개정법률안(홍기원 의원 대표발의)(의안번호 2208097) / 공직선거법 일부개정법률안(정희용 의원 대표발의)(의안번호 2208367) / 공직선거법 일부개정법률안(이달희 의원 대표발의)(의안번호 2208409) / 공직선거법 일부개정법률안(나경원 의원 대표발의)(의안번호 2208447) / 공직선거법 일부개정법률안(한병도 의원 대표발의)(의안번호 2208546) / 공직선거법 일부개정법률안(전종덕 의원 대표발의)(의안번호 2208660) / 공직선거법 일부개정법률안(조승환 의원 대표발의)(의안번호 2208668) / 공직선거법 일부개정법률안(이재강 의원 대표발의)(의안번호 2208770) / 공직선거법 일부개정법률안(신동욱 의원 대표발의)(의안번호 2208778) / 공직선거법 일부개정법률안(신동욱 의원 대표발의)(의안번호 2208782) / 공직선거법 일부개정법률안(임호선 의원 대표발의)(의안번호 2208808) / 공직선거법 일부개정법률안(신동욱 의원 대표발의)(의안번호 2208832) / 공직선거법 일부개정법률안(구자근 의원 대표발의)(의안번호 2208843) / 공직선거법 일부개정법률안(최수진 의원 대표발의)(의안번호 2208858) / 공직선거법 일부개정법률안(양부남 의원 대표발의)(의안번호 2208908) / 공직선거법 일부개정법률안(양부남 의원 대표발의)(의안번호 2208945) / 공직선거법 일부개정법률안(민형배 의원 대표발의)(의안번호 2208959) / 공직선거법 일부개정법률안(강대식 의원 대표발의)(의안번호 2208964) / 공직선거법 일부개정법률안(양부남 의원 대표발의)(의안번호 2209004) / 공직선거법 일부개정법률안(양부남 의원 대표발의)(의안번호 2209024) / 공직선거법 일부개정법률안(김태선 의원 대표발의)(의안번호 2209177) / 공직선거법 일부개정법률안(강득구 의원 대표발의)(의안번호 2209284) / 공직선거법 일부개정법률안(채현일 의원 대표발의)(의안번호 2209300) / 공직선거법 일부개정법률안(서미화 의원·용혜인 의원 대표발의)(의안번호 2209350) / 공직선거법 일부개정법률안(백혜련 의원 대표발의)(의안번호 2209474) / 공직선거법 일부개정법률안(김민전 의원 대표발의)(의안번호 2209492) / 공직선거법 일부개정법률안(강대식 의원 대표발의)(의안번호 2209512) / 공직선거법 일부개정법률안(김윤덕 의원 대표발의)(의안번호 2209592) / 공직선거법 일부개정법률안(최민희 의원 대표발의)(의안번호 2209635) / 공직선거법 일부개정법률안(박균택 의원 대표발의)(의안번호 2209674) / 공직선거법 일부개정법률안(한병도 의원 대표발의)(의안번호 2209849) / 공직선거법 일부개정법률안(위성곤 의원 대표발의)(의안번호 2209854) / 공직선거법 일부개정법률안(정춘생 의원 대표발의)(의안번호 2209878) / 공직선거법 일부개정법률안(윤준병 의원 대표발의)(의안번호 2209913) / 공직선거법 일부개정법률안(신정훈 의원 대표발의)(의안번호 2209944) / 공직선거법 일부개정법률안(이성윤 의원 대표발의)(의안번호 2210024) / 공직선거법 일부개정법률안(이원택 의원 대표발의)(의안번호 2210184) / 공직선거법 일부개정법률안(이광희 의원 대표발의)(의안번호 2210196) / 공직선거법 일부개정법률안(조승래 의원 대표발의)(의안번호 2210210) / 선거관리위원회 특별감사 실시와 국민 신뢰 회복을 위한 특별감사관 임명 등에 관한 법률안(권성동 의원 대표발의)(의안번호 2208736) / 국론통합을 위한 대한민국 선거와 투개표 시스템 점검과 보완을 위한 특별법안(박수민 의원 대표발의)(의안번호 2208877) / 선거관리위원회법 일부개정법률안(윤건영 의원 대표발의)(의안번호 2208831) / 선거관리위원회법 일부개정법률안(곽규택 의원 대표발의)(의안번호 2209005) / 선거관리위원회법 일부개정법률안(양부남 의원 대표발의)(의안번호 2209038) / 선거관리위원회법 일부개정법률안(박충권 의원 대표발의)(의안번호 2209050) / 선거관리위원회법 일부개정법률안(이성권 의원 대표발의)(의안번호 2209054) / 선거관리위원회법 일부개정법률안(조은희 의원 대표발의)(의안번호 2209073) / 선거관리위원회법 일부개정법률안(윤준병 의원 대표발의)(의안번호 2209336) / 선거관리위원회법 일부개정법률안(위성곤 의원 대표발의)(의안번호 2209873) / 정당법 일부개정법률안(김교흥 의원 대표발의)(의안번호 2207211) / 정당법 일부개정법률안(박홍근 의원 대표발의)(의안번호 2208955) / 정당법 일부개정법률안(윤건영 의원 대표발의)(의안번호 2209003) / 정치자금법 일부개정법률안(한민수 의원 대표발의)(의안번호 2207332) / 정치자금법 일부개정법률안(장철민 의원 대표발의)(의안번호 2208434) / 정치자금법 일부개정법률안(이강일 의원 대표발의)(의안번호 2208448) / 정치자금법 일부개정법률안(이수진 의원 대표발의)(의안번호 2208937) / 정치자금법 일부개정법률안(강유정 의원 대표발의)(의안번호 2209154) / 정치자금법 일부개정법률안(이인영 의원 대표발의)(의안번호 2210212) / 부정선거 의혹 철저 수사와 대한민국 민주주의 수호 촉구에 관한 청원(김민재 외 51,392인 국민동의로 제출)(청원번호 2200078) / 중앙선거관리위원회 서버 공개에 관한 청원(김창수 외 50,935인 국민동의로 제출)(청원번호 2200083) / 대만처럼 모든 선거 당일 수개표 실황중계 실시 요청에 관한 청원(우길영 외 54,146인 국민동의로 제출)(청원번호 2200094) / 부정선거 없는 믿음직한 선거문화 만들기에 관한 청원(전은영 외 50,755인 국민동의로 제출)(청원번호 2200097) / 전과자 선거출마 불허 법 개정에 관한 청원(우길영 외 52,390인 국민동의로 제출)(청원번호 2200098) / 선거관리위원회 실태에 대한 국정조사에 관한 청원(이동성 외 50,829인 국민동의로 제출)(청원번호 2200114) / 선거시스템 공개검증에 관한 청원(허윤석 외 50,270인 국민동의로 제출)(청원번호 2200116) / 형상기억종이 진위에 대한 철저한 조사특위 설치에 관한 청원(우길영 외 50,645인 국민동의로 제출)(청원번호 2200118) / 부정선거 투표 방지에 관한 청원(안성관 외 55,815인 국민동의로 제출)(청원번호 2200127) / 투표자수와 투표자명부 공개에 관한 청원(우길영 외 50,862인 국민동의로 제출)(청원번호 2200130) / 범죄이력이 있다면 국회의원 시의원 도지사 대선출마 등을 금지하도록 법 개정에 관한 청원(김진용 외 51,154인 국민동의로 제출)(청원번호 2200135) / 대한민국 국민의 알 권리 보장을 위한 선관위와 A-WEB의 부정선거 수사에 관한 청원(이솔 외 50,108인 국민동의로 제출)(청원번호 2200143) / 선거관리위원회 부정채용 및 조세 사용여부 공개에 관한 청원(조정현 외 51,887인 국민동의로 제출)(청원번호 2200160) / 선거법 개정에 관한 청원(박예은 외 53,788인 국민동의로 제출)(청원번호 2200163) / 사전투표제와 전자개표방식 폐기에 관한 청원(박예은 외 50,820인 국민동의로 제출)(청원번호 2200167) / 진실·화해를 위한 과거사정리 기본법 일부개정법률안(이해식 의원 대표발의)(의안번호 2207542) / 진실·화해를 위한 과거사정리 기본법 전부개정법률안(용혜인 의원 대표발의)(의안번호 2210102) / 공무원 인재개발법 일부개정법률안(조승환 의원 대표발의)(의안번호 2208333) / 공무원보수위원회의 설치 및 운영에 관한 법률안(윤건영 의원 대표발의)(의안번호 2207404) / 공무원연금법 일부개정법률안(박정현 의원 대표발의)(의안번호 2207251) / 공무원연금법 일부개정법률안(추미애 의원 대표발의)(의안번호 2207571) / 공무원연금법 일부개정법률안(서영교 의원 대표발의)(의안번호 2207613) / 공무원연금법 일부개정법률안(신영대 의원 대표발의)(의안번호 2207614) / 공무원연금법 일부개정법률안(김영환 의원 대표발의)(의안번호 2207781) / 공무원연금법 일부개정법률안(강득구 의원 대표발의)(의안번호 2207851) / 공무원연금법 일부개정법률안(문금주 의원 대표발의)(의안번호 2208151) / 공무원연금법 일부개정법률안(박민규 의원 대표발의)(의안번호 2208182) / 공무원연금법 일부개정법률안(김정재 의원 대표발의)(의안번호 2208254) / 공무원연금법 일부개정법률안(배현진 의원 대표발의)(의안번호 2208423) / 공무원연금법 일부개정법률안(박정하 의원 대표발의)(의안번호 2208574) / 공무원연금법 일부개정법률안(조계원 의원 대표발의)(의안번호 2208773) / 공무원연금법 일부개정법률안(임이자 의원 대표발의)(의안번호 2208911) / 공무원연금법 일부개정법률안(강대식 의원 대표발의)(의안번호 2208970) / 공무원연금법 일부개정법률안(백혜련 의원 대표발의)(의안번호 2208997) / 공무원연금법 일부개정법률안(조경태 의원 대표발의)(의안번호 2209324) / 공직자윤리법 일부개정법률안(장경태 의원 대표발의)(의안번호 2207689) / 공직자윤리법 일부개정법률안(박정현 의원 대표발의)(의안번호 2208082) / 공직자윤리법 일부개정법률안(민형배 의원 대표발의)(의안번호 2209408) / 공직자윤리법 일부개정법률안(신영대 의원 대표발의)(의안번호 2209890) / 공직자윤리법 일부개정법률안(박지원 의원 대표발의)(의안번호 2210010) / 공직자윤리법 일부개정법률안(최민희 의원 대표발의)(의안번호 2210159) / 공직자윤리법 일부개정법률안(황명선 의원 대표발의)(의안번호 2210223) / 공휴일에 관한 법률 일부개정법률안(김상욱 의원 대표발의)(의안번호 2207420) / 공휴일에 관한 법률 일부개정법률안(김문수 의원 대표발의)(의안번호 2207597) / 공휴일에 관한 법률 일부개정법률안(진종오 의원 대표발의)(의안번호 2208105) / 공휴일에 관한 법률 일부개정법률안(이인선 의원 대표발의)(의안번호 2209488) / 공휴일에 관한 법률 일부개정법률안(이해민 의원 대표발의)(의안번호 2209627) / 공휴일에 관한 법률 일부개정법률안(장경태 의원 대표발의)(의안번호 2209649) / 국가공무원법 일부개정법률안(이해식 의원 대표발의)(의안번호 2207660) / 국가공무원법 일부개정법률안(이만희 의원 대표발의)(의안번호 2208713) / 국가공무원법 일부개정법률안(허성무 의원 대표발의)(의안번호 2208864) / 국가공무원법 일부개정법률안(최보윤 의원 대표발의)(의안번호 2209366) / 국가공무원법 일부개정법률안(김상훈 의원 대표발의)(의안번호 2209706) / 국가공무원법 일부개정법률안(양부남 의원 대표발의)(의안번호 2209718) / 「공무원보수위원회의 설치 및 운영에 관한 법률」(약칭 공무원보수위원회법) 제정에 관한 청원(이선희 외 55,213인 국민동의로 제출)(청원번호 2200104) / 공무원연금 소득공백해소를 위한 공무원 정년연장에 관한 청원(이해준 외 50,370인 국민동의로 제출)(청원번호 2200141) / 대한민국 핵심 공직의 외국인(화교) 임용 제한에 관한 청원(박준형 외 50,279인 국민동의로 제출)(청원번호 2200150) / 국가 주요 공직자의 위헌적 사조직(우리법연구회 등) 활동 금지 및 처벌 근거가 되는 법안 마련 촉구에 관한 청원(박준형 외 50,686인 국민동의로 제출)(청원번호 2200164) / 경범죄 처벌법 일부개정법률안(이종배 의원 대표발의)(의안번호 2207262) / 경찰공무원법 일부개정법률안(주호영 의원 대표발의)(의안번호 2207145) / 경찰공무원법 일부개정법률안(김재원 의원 대표발의)(의안번호 2208443) / 경찰공무원법 일부개정법률안(박정현 의원 대표발의)(의안번호 2209048) / 경찰공무원법 일부개정법률안(이해식 의원 대표발의)(의안번호 2209516) / 경찰공무원법 일부개정법률안(김상훈 의원 대표발의)(의안번호 2209710) / 경찰공무원법 일부개정법률안(김재원 의원 대표발의)(의안번호 2210061) / 경찰관 직무집행법 일부개정법률안(김종양 의원 대표발의)(의안번호 2208201) / 국가경찰과 자치경찰의 조직 및 운영에 관한 법률 일부개정법률안(강득구 의원 대표발의)(의안번호 2207388) / 국가경찰과 자치경찰의 조직 및 운영에 관한 법률 일부개정법률안(정동만 의원 대표발의)(의안번호 2208286) / 국가경찰과 자치경찰의 조직 및 운영에 관한 법률 일부개정법률안(박상혁 의원 대표발의)(의안번호 2208442) / 국가경찰과 자치경찰의 조직 및 운영에 관한 법률 일부개정법률안(이해식 의원 대표발의)(의안번호 2208756) / 국가경찰과 자치경찰의 조직 및 운영에 관한 법률 일부개정법률안(박정현 의원 대표발의)(의안번호 2209045) / 국가경찰과 자치경찰의 조직 및 운영에 관한 법률 일부개정법률안(정청래 의원 대표발의)(의안번호 2209934) / 도로교통법 일부개정법률안(진종오 의원 대표발의)(의안번호 2208108) / 도로교통법 일부개정법률안(강대식 의원 대표발의)(의안번호 2208179) / 도로교통법 일부개정법률안(윤영석 의원 대표발의)(의안번호 2208256) / 도로교통법 일부개정법률안(안철수 의원 대표발의)(의안번호 2208260) / 도로교통법 일부개정법률안(강득구 의원 대표발의)(의안번호 2208274) / 도로교통법 일부개정법률안(남인순 의원 대표발의)(의안번호 2208300) / 도로교통법 일부개정법률안(진성준 의원 대표발의)(의안번호 2208309) / 도로교통법 일부개정법률안(임호선 의원 대표발의)(의안번호 2208686) / 도로교통법 일부개정법률안(김주영 의원 대표발의)(의안번호 2209058) / 도로교통법 일부개정법률안(박덕흠 의원 대표발의)(의안번호 2209218) / 도로교통법 일부개정법률안(정동만 의원 대표발의)(의안번호 2209274) / 도로교통법 일부개정법률안(양부남 의원 대표발의)(의안번호 2209295) / 도로교통법 일부개정법률안(황명선 의원 대표발의)(의안번호 2210080) / 도로교통법 일부개정법률안(모경종 의원 대표발의)(의안번호 2210130) / 자율방범대 설치 및 운영에 관한 법률 일부개정법률안(양부남 의원 대표발의)(의안번호 2207886) / 집회 및 시위에 관한 법률 일부개정법률안(모경종 의원 대표발의)(의안번호 2208669) / 집회 및 시위에 관한 법률 일부개정법률안(이건태 의원 대표발의)(의안번호 2208957) / 총포·도검·화약류 등의 안전관리에 관한 법률 일부개정법률안(진종오 의원 대표발의)(의안번호 2209374) / 한국도로교통공단법 일부개정법률안(김상욱 의원 대표발의)(의안번호 2209437) / 남태령, 허가받은 합법적인 집회를 방해하는 방배경찰서장 직권남용으로 사퇴요청에 관한 청원(이미순 외 50,185인 국민동의로 제출)(청원번호 2200077) / 중국 공안 파견에 대한 의혹과 우려, 국민의 안전과 자존심을 지키기 위한 요청에 관한 청원(정예찬 외 50,606인 국민동의로 제출)(청원번호 2200171) / 119구조·구급에 관한 법률 일부개정법률안(위성곤 의원 대표발의)(의안번호 2209775) / 소방공무원 보건안전 및 복지 기본법 일부개정법률안(이춘석 의원 대표발의)(의안번호 2207250) / 소방공무원 보건안전 및 복지 기본법 일부개정법률안(이춘석 의원 대표발의)(의안번호 2207287) / 소방공무원 보건안전 및 복지 기본법 일부개정법률안(이만희 의원 대표발의)(의안번호 2208522) / 소방공무원법 일부개정법률안(박정현 의원 대표발의)(의안번호 2208415) / 소방공무원법 일부개정법률안(김상훈 의원 대표발의)(의안번호 2209711) / 소방공무원법 일부개정법률안(김재원 의원 대표발의)(의안번호 2210060) / 소방기본법 일부개정법률안(이춘석 의원 대표발의)(의안번호 2207241) / 소방기본법 일부개정법률안(이만희 의원 대표발의)(의안번호 2208523) / 소방기본법 일부개정법률안(강득구 의원 대표발의)(의안번호 2208536) / 소방기본법 일부개정법률안(주호영 의원 대표발의)(의안번호 2209527) / 소방기본법 일부개정법률안(김승원 의원 대표발의)(의안번호 2209884) / 소방시설 설치 및 관리에 관한 법률 일부개정법률안(김교흥 의원 대표발의)(의안번호 2208175) / 소방시설 설치 및 관리에 관한 법률 일부개정법률안(위성곤 의원 대표발의)(의안번호 2209664) / 소방제복의 규제에 관한 법률안(김도읍 의원 대표발의)(의안번호 2209586) / 의용소방대 설치 및 운영에 관한 법률 일부개정법률안(양부남 의원 대표발의)(의안번호 2207948) / 의용소방대 설치 및 운영에 관한 법률 일부개정법률안(정춘생 의원 대표발의)(의안번호 2209856) / 의용소방대 설치 및 운영에 관한 법률 일부개정법률안(최보윤 의원 대표발의)(의안번호 2210258) / 화재의 예방 및 안전관리에 관한 법률 일부개정법률안(조계원 의원 대표발의)(의안번호 2208269) / 화재의 예방 및 안전관리에 관한 법률 일부개정법률안(서미화 의원 대표발의)(의안번호 2209447)",(14시07분),"존경하는 신정훈 위원장님 그리고 행안위 위원 여러분!
 더불어민주당 박주민 의원입니다.
 재난참사 피해자단체 당사자들과 그리고 시민사회단체들과 함께 논의하여 만든 생명안전기본법에 대한 제안설명을 위해 이 자리에 서게 된 것을 매우 영광스럽게 생각합니다.
 저는 지난주에 저희 지역에 있는 분들과 함께 ‘바다호랑이’라는 영화를 관람하였습니다. 이 영화는 2014년 세월호 참사 당시에 자신의 목숨을 걸고 희생자들을 가족 품으로 데리고 온 민간 잠수사들에 대한 영화입니다. 세월호 민간 잠수사분들은 깊고 차가운 바닷속의 그날의 모습이 여전히 생생히 기억난다고 하십니다.
 세월호 참사 19년 전인 1995년에는 또 하나의 아픔이 있었습니다. 바로 삼풍백화점 붕괴 사건이었습니다. 지난주 일요일이 바로 삼풍백화점 붕괴 30주기였는데요. 추도식에 여기 행안위 소속이신 용혜인 위원님과 함께 저도 갔었습니다. 당시에 오백두 분의 무고한 시민분들이 희생당하셨고 그 가족분들은 여전히 1995년 6월 29일 속에서 살아가고 계셨습니다.
 그 당시에 우리가 만약에 제대로 반성을 하고 국민의 생명과 안전을 지키기 위해서 힘을 쏟았다면 우리 사회는 많이 바뀌었을 것입니다. 2014년에 세월호 참사 없었을 것이고요. 또 2022년에 이태원 참사, 2023년에 오송 지하차도 참사 등도 없었을 것입니다. 그리고 그 희생자의 가족분들이 진상규명 등을 위해서 거리에 나오시는 일들도 없었을 것입니다.
 물론 국가가 모든 참사를 100% 다 막아 낼 수는 없을 것입니다. 저도 잘 압니다. 그러나 그렇다고 해서 그것이 우리 정치권이 참사를 방치하는 이유가 되어서는 안 될 것입니다.
 국민의 생명과 안전보다 더 큰 가치가 있겠습니까? 대한민국 정부와 국회가 가장 최우선에 두어야 될 과제가 바로 국민의 생명과 안전을 지키는 일일 것입니다. 우리는 이제 그 어려운 일을 위한 도전에 나서야 됩니다. 그러기 위해서 우리 22대 국회가 바로 생명안전기본법 제정을 위해서 적극적으로 나서야 될 것입니다.
 재난과 시민재해의 피해자들 그리고 시민사회 그리고 국회가 오랫동안 논의하여 만든 법안입니다. 대한민국에 거주하는 모든 사람의 안전권을 명시하였고 국가 및 지방자치단체가 안전권을 지키기 위해서 반드시 해야 될 임무들을 기술하였으며 피해자들과 안전 약자들의 권리를 보장하기 위한 기본적인 내용들을 담았습니다. 
 참사 등의 원인과 수습 과정에 대한 객관적이고 전문적인 조사를 위해 별도의 독립적인 조사위원회를 설치하는 내용도 담겨 있습니다. 매번 참사가 발생할 때마다 피해자들이 거리로 나와서 삭발하고 단식하고 삼보일배하고 하면서 진상규명을 위해서 애를 쓰지 않으셔도 이 법이 통과된다면 보다 수월하게 진상규명을 위한 프로세스가 진행될 수 있을 것이다라는 생각이 듭니다.
 5년이 넘은 긴 논의와 국회 차원의 연구용역 등을 거쳐서 여기 계시는 용혜인 의원님 등 제정당 여러 의원님들과 함께 공동 대표발의를 진행했습니다.
 아무쪼록 이 법안의 취지대로 그리고 신속하게 통과될 수 있도록 여기 계시는 행안위 위원님들의 많은 관심과 토론 부탁드리겠습니다.
 감사합니다."
