session,session_type,meeting_no,date,speech_order,speaker_name,speaker_position,speaker_area,data_mem_id,agenda_item_orders,agenda_item_titles,agenda_item_times,speech_text
423,임시회,제1호,2025년 3월 6일(목),424,용혜인,위원,(비례대표),6697,1,중앙선거관리위원회 위원후보자(김대웅) 인사청문회,(10시04분),"최근 불공정 여론조사로 논란이 된 이 기관들은 등록 요건에 미달하는 부실기관이다라는 공통점들이 있습니다. 윤석열 지지율 51%로 논란이 됐던 여론조사공정 같은 경우는 여심위에서 편법 운영을 지적을 받았던 기관이고, KOPRA도……
 (발언시간 초과로 마이크 중단)
 (마이크 중단 이후 계속 발언한 부분)
상근 인력 기준 등을 위반한 부실기관이다라고 하는 시민단체의 고발이 있었습니다. 이런 부실한 여론조사 기관들을 계속 방치하면 제2, 제3의 명태균 게이트가 발생할 겁니다. 명태균 씨 같은 경우는 전문 분석인력을 한 명도 갖추지 않고 미등록 여론조사 업체를 운영했고 수차례 벌금형과 경고 처분을 받고서도 계속 여론 조작을 시도했습니다.
 그러니까 선관위가 등록 요건을 제대로 점검하지 않고 등록 취소와 관련된 규제들을 강화하지 않았기 때문에 여론 조작 범죄들이 저는 반복돼 왔다라고 평가할 수밖에 없을 것 같습니다.
 그래서 말씀드리고 싶은 것은 이 여론조사 기관에 대한 등록 요건을 법률로 좀……"
423,임시회,제1호,2025년 3월 6일(목),425,신정훈,위원장,(전남 나주시화순군),6713,1,중앙선거관리위원회 위원후보자(김대웅) 인사청문회,(10시04분),정리해 주시지요.
423,임시회,제1호,2025년 3월 6일(목),426,용혜인,위원,(비례대표),6697,1,중앙선거관리위원회 위원후보자(김대웅) 인사청문회,(10시04분),"예, 정리하겠습니다.
 법률로 명문화하고 기관들에 대한 상시적 점검을 진행할 필요가 있다라고 보고요. 이 등록 취소된 기관에 대한 영업 정지나 혹은 재취업 금지 같은 규제 강화도 같이 진행이 되어야 되겠다라고 생각하는데요. 여기에 대해서 후보자 입장 부탁드립니다."
423,임시회,제1호,2025년 3월 6일(목),427,김대웅,중앙선거관리위원회위원후보자,,0,1,중앙선거관리위원회 위원후보자(김대웅) 인사청문회,(10시04분),위원님께서 지적하신 내용은 유념하고 그 부분에 대해서도 세심히 살펴보도록 하겠습니다.
423,임시회,제1호,2025년 3월 6일(목),428,용혜인,위원,(비례대표),6697,1,중앙선거관리위원회 위원후보자(김대웅) 인사청문회,(10시04분),이상입니다.
423,임시회,제1호,2025년 3월 6일(목),429,신정훈,위원장,(전남 나주시화순군),6713,1,중앙선거관리위원회 위원후보자(김대웅) 인사청문회,(10시04분),"수고하셨습니다.
 다음은 윤건영 위원님 질의해 주시기 바랍니다."
423,임시회,제1호,2025년 3월 6일(목),430,윤건영,위원,(서울 구로구을),6687,1,중앙선거관리위원회 위원후보자(김대웅) 인사청문회,(10시04분),"구로을의 윤건영입니다.
 후보자님, PPT 한번 봐 주시겠습니까?
 (영상자료를 보며)
 앞서 여러 위원님들 말씀 주셨는데요. 감사원 통계 자료입니다. 최근 10년간 선관위 채용의 위법 부당한 사례입니다.
 저는 그런 생각이 듭니다, 10년 동안 어떻게 이렇게 그냥 둘 수 있었을까. 어떤 조직이라도 이렇게 두는 것은 정말 심각한 문제가 있다고 생각하지 않습니까?
 후보자님, 어떻게 생각하십니까?"
423,임시회,제1호,2025년 3월 6일(목),431,김대웅,중앙선거관리위원회위원후보자,,0,1,중앙선거관리위원회 위원후보자(김대웅) 인사청문회,(10시04분),저도 위원님하고 똑같은 생각을 하고 있습니다.
423,임시회,제1호,2025년 3월 6일(목),432,윤건영,위원,(서울 구로구을),6687,1,중앙선거관리위원회 위원후보자(김대웅) 인사청문회,(10시04분),"만약에 선관위원으로 되신다면 이런 문제에 대해서 집중적으로 고민하셔야 되는데요. 그 이유에 대해서 한번 같이 토론을 해 보려고 합니다.
 다음 PPT 봐 주시면요.
 저는 내부 제보가 10년 동안 당연히 있었을 건데 왜 안 됐을까라고 하면 짬짜미 때문에 그렇다고 생각합니다. 선관위 고위직이나 하위직 할 것 없이 내부 제보를 묵살하지 않았을까라는 의심을 하는데요.
 감사원 지적사항에 보면 이런 내용들이 있습니다. 분명히 과장과 계장의 금품수수 사실이 있고 투서가 전달됐는데도 채용 과정에서 문제없다고 종결했다라는 겁니다.
 이게 가당키나 한 일입니까? 이런 일이 있어서야 되겠습니까, 후보님?"
423,임시회,제1호,2025년 3월 6일(목),433,김대웅,중앙선거관리위원회위원후보자,,0,1,중앙선거관리위원회 위원후보자(김대웅) 인사청문회,(10시04분),절대 있으면 안 된다고 생각을 합니다.
423,임시회,제1호,2025년 3월 6일(목),434,윤건영,위원,(서울 구로구을),6687,1,중앙선거관리위원회 위원후보자(김대웅) 인사청문회,(10시04분),"만약에 선관위원이 되신다면 이런 걸 바로잡는 게 선관위원으로서 해야 될 일이라고 저는 생각을 하고요.
 다음 PPT 봐 주십시오.
 어제 선관위가 내놓은 조치에 따르면 채용비리와 관련되어 있는 10명에 대해서, 이 10명이라는 숫자 어떤 의미인지 알고 계시지요? 혹시 후보자님, 모르십니까?"
423,임시회,제1호,2025년 3월 6일(목),435,김대웅,중앙선거관리위원회위원후보자,,0,1,중앙선거관리위원회 위원후보자(김대웅) 인사청문회,(10시04분),아마……
423,임시회,제1호,2025년 3월 6일(목),436,윤건영,위원,(서울 구로구을),6687,1,중앙선거관리위원회 위원후보자(김대웅) 인사청문회,(10시04분),"선관위가 파악하고 있는 현재 채용비리에 관련된 인원입니다. 이 사람에 대해서 과천 선관위로 발령을 내겠다라는 겁니다. 즉 이 10명에 대한 페널티를 뭘로 할 거냐라고 질의했더니 과천 선관위로 발령 내겠다는 게 전부예요.
 이게 맞습니까, 후보자님? 아니, 불법 채용했어요. 세습 채용한 거예요. 그러면 당연히 엄단을 해야 되는데 근무지만 과천으로 발령 내겠다라는 게 말이 맞습니까?
 후보자님, 어떻게 생각하십니까?"
423,임시회,제1호,2025년 3월 6일(목),437,김대웅,중앙선거관리위원회위원후보자,,0,1,중앙선거관리위원회 위원후보자(김대웅) 인사청문회,(10시04분),구체적 사안에 따라 다를 수는 있겠지만 행위에 상응하는 책임을 묻는 것이 옳다고 생각을 합니다.
423,임시회,제1호,2025년 3월 6일(목),438,윤건영,위원,(서울 구로구을),6687,1,중앙선거관리위원회 위원후보자(김대웅) 인사청문회,(10시04분),"‘행위에 상응하는’, 정확하게 말씀하셨는데요. 세습 채용한 겁니다. 아버지 잘 만나서 젊은 친구가 선관위에 들어온 거예요, 불법적으로. 그러면 단호하게 처벌하셔야지요. 과천 청사에 근무하는 게 무슨 처벌이 됩니까?
 제가 ‘662건(?)’이라고 넣었습니다. 이게 뭔가 하면요 앞서 10년간 통계입니다. 그 이전에 얼마나 많은 일이 있었는지도 모릅니다. 이 662건과 관련되어 있는 채용비리 인원들을 선관위가 파악조차 못 하고 있습니다. 이게 무슨 정의입니까?
 후보자님은 재판관으로 수십 년간 봉직하셨습니다. 후보자께서 생각하는 정의에 이게 부합한다고 생각하십니까?"
423,임시회,제1호,2025년 3월 6일(목),439,김대웅,중앙선거관리위원회위원후보자,,0,1,중앙선거관리위원회 위원후보자(김대웅) 인사청문회,(10시04분),일단 부합하는 데 모자란다고 생각을 합니다.
423,임시회,제1호,2025년 3월 6일(목),440,윤건영,위원,(서울 구로구을),6687,1,중앙선거관리위원회 위원후보자(김대웅) 인사청문회,(10시04분),그러면 이것 단호히 조치하셔야 됩니다.
423,임시회,제1호,2025년 3월 6일(목),441,김대웅,중앙선거관리위원회위원후보자,,0,1,중앙선거관리위원회 위원후보자(김대웅) 인사청문회,(10시04분),예.
423,임시회,제1호,2025년 3월 6일(목),442,윤건영,위원,(서울 구로구을),6687,1,중앙선거관리위원회 위원후보자(김대웅) 인사청문회,(10시04분),"지금 현직에 계신 분이 아니어서 제가 이 정도로 하는데요. 선관위원으로 만약에 임명을 받는다면 이 부분부터 조치하셔야지요. 즉 선관위가 발표한 10명 수준이 아니라 최소한 지난 10년 동안 채용비리하고 관련된 모든 사람들을 조치해야 됩니다.
 그렇게 하실 의사 있습니까?"
423,임시회,제1호,2025년 3월 6일(목),443,김대웅,중앙선거관리위원회위원후보자,,0,1,중앙선거관리위원회 위원후보자(김대웅) 인사청문회,(10시04분),구체적으로 자세히 검토를 해 보도록 하겠습니다.
423,임시회,제1호,2025년 3월 6일(목),444,윤건영,위원,(서울 구로구을),6687,1,중앙선거관리위원회 위원후보자(김대웅) 인사청문회,(10시04분),"당연히 검토하셔야지요. 그런데 채용비리는 공정과 불공정의 문제입니다. 상식과 비상식의 문제입니다. 이것을 그냥 넘어갈 일이 아닙니다.
 662건 중에 10명만 처벌하겠다니요? 이게 국민 감정에 맞습니까? 상식에 부합하지 않는다고 생각합니다. 662건을 탈탈 털어서 관련된 인사 전원을 조치해야 된다고 생각합니다. 의지를 밝혀 주십시오, 후보자님."
423,임시회,제1호,2025년 3월 6일(목),445,김대웅,중앙선거관리위원회위원후보자,,0,1,중앙선거관리위원회 위원후보자(김대웅) 인사청문회,(10시04분),확실하게 신상필벌이 이루어져야 된다고 생각을 하고 있습니다.
423,임시회,제1호,2025년 3월 6일(목),446,윤건영,위원,(서울 구로구을),6687,1,중앙선거관리위원회 위원후보자(김대웅) 인사청문회,(10시04분),"좋습니다.
 후보자께서는 22년부터 25년 2월까지 법무부 가석방심사위원회 위원으로 활동하셨습니다. 맞습니까?"
423,임시회,제1호,2025년 3월 6일(목),447,김대웅,중앙선거관리위원회위원후보자,,0,1,중앙선거관리위원회 위원후보자(김대웅) 인사청문회,(10시04분),"예, 맞습니다."
423,임시회,제1호,2025년 3월 6일(목),448,윤건영,위원,(서울 구로구을),6687,1,중앙선거관리위원회 위원후보자(김대웅) 인사청문회,(10시04분),"윤석열 대통령의 장모인 최은순 씨의 가석방 관련해서 애초에 법조계에서는 이런 이야기가 나왔습니다. ‘장모 최은순 씨를 사기죄를 적용했더라면 최소 징역 5년 이상 받았을 거야. 그런데 봐주기 위해서 부동산실명법 위반 혐의, 사문서 위조 및 행사 혐의만 적용했어’라는 게 서초동 법원가에 파다한 일이었습니다.
 그래서 장모 최은순과 관련해서 가석방위에서 1차 때는 부결된 걸로 알고 있습니다. 그런데 두 번째에는 후보자가 포함된 가석방심사위원회에서 전원 만장일치로 가석방을 선고했습니다. 물론 연령이라든지 형량이라든지 그런 이야기 하지 마십시오. 그것은 일반적인 경우입니다. 윤석열 증인의 장모 최은순 씨 같은 경우에는 애초 검찰이 법 조항부터가 봐주기 위해서 수사한 겁니다. 그게 명백해 보이고요.
 앞서 말씀드렸던 것처럼 후보자는 법관으로 수십 년간 계셨습니다. 그러면 이게 다 보였을 텐데 후보자는 이게 정의라고 생각하십니까?"
423,임시회,제1호,2025년 3월 6일(목),449,김대웅,중앙선거관리위원회위원후보자,,0,1,중앙선거관리위원회 위원후보자(김대웅) 인사청문회,(10시04분),일단 그때는 정한 원칙과 다른 사례와의 비교 등을 통해서 공정하게 의결을 했다는 걸로 말씀을 드릴 수밖에 없을 것 같습니다.
423,임시회,제1호,2025년 3월 6일(목),450,윤건영,위원,(서울 구로구을),6687,1,중앙선거관리위원회 위원후보자(김대웅) 인사청문회,(10시04분),"후보자가 제게 제출한 자료입니다. ‘정의는 국가와 사회가 올바르게 작동하기 위한 기본적 원리로서 정도를 의미한다’라고 했습니다. 후보자가 가석방심사위원회에서 한 행위는 제가 볼 때 정의롭지 않습니다. 많은 국민들의 국민 상식과 법감정에 위반되는 거라고 생각을 합니다.
 오후 추가질의 때 하고 1분은 남겨 놓겠습니다. 오후 추가질의에 쓰겠습니다."
423,임시회,제1호,2025년 3월 6일(목),451,신정훈,위원장,(전남 나주시화순군),6713,1,중앙선거관리위원회 위원후보자(김대웅) 인사청문회,(10시04분),"예. 
 거기에 대해서 답변하시겠습니까?"
423,임시회,제1호,2025년 3월 6일(목),452,김대웅,중앙선거관리위원회위원후보자,,0,1,중앙선거관리위원회 위원후보자(김대웅) 인사청문회,(10시04분),가석방심사위원회에서의 의결 내용을 여기서 말씀드릴 수는 없는 것이긴 하지만 어쨌든 법에 위반되지 않게 그것은 정당하게 권한을 행사하고 의결을 했다는 점은 다시 한번 말씀드리겠습니다.
423,임시회,제1호,2025년 3월 6일(목),453,신정훈,위원장,(전남 나주시화순군),6713,1,중앙선거관리위원회 위원후보자(김대웅) 인사청문회,(10시04분),이상으로……
423,임시회,제1호,2025년 3월 6일(목),454,조은희,위원,(서울 서초구갑),6629,1,중앙선거관리위원회 위원후보자(김대웅) 인사청문회,(10시04분),"위원장님, 자료 요구에 대해서 한말씀 드리겠습니다."
423,임시회,제1호,2025년 3월 6일(목),455,신정훈,위원장,(전남 나주시화순군),6713,1,중앙선거관리위원회 위원후보자(김대웅) 인사청문회,(10시04분),예.
423,임시회,제1호,2025년 3월 6일(목),456,조은희,위원,(서울 서초구갑),6629,1,중앙선거관리위원회 위원후보자(김대웅) 인사청문회,(10시04분),"기회를 주셔서 감사합니다. 
 위원장님이 지시해 주신 덕분에 일부 자료가 도착했습니다. 그런데 자료를 보니 박찬진 전 사무총장의 딸이 아빠 찬스 채용비리가 뜨겁게 불거진 이후 작년 10월 1일 자로 승진했습니다. 이래서 자료를 안 준 겁니다. 뿐만 아니라 아빠 찬스 의혹을 받는 윤재현 전 경북선관위 상임위원의 딸 역시 작년 1월 1일에 승진했습니다. 
 직무 배제도 아니고 징계 절차도 아니고 어떻게 문제의 당사자들을 승진까지 시키게 됐는지 위원장님께서는 오후에 출석할 선관위원장, 선관위 사무총장에게 그 경위에 대한 답변도 준비하도록 해 주셨으면 합니다. 
 그리고 이상식 위원이 조금 전 질의에서 우리 국민의힘 위원들이 가치판단 없이 부정선거에 집착하고 있다, 집착하고 주장한다고 했는데요. 이상식 위원에 대해서 저희들 굉장히 할 말이 많습니다만 동료 위원에 대해서 뭐 더 이상 말씀을 안 드리고요. 이 부분에 대해서는 위원장님께서 우리 상대당 위원님들을 이렇게 도매금으로 싸잡아 하시는 것에 대해서는 중간에 지적을 좀 해 주시기를 부탁드립니다.
 이상입니다."
423,임시회,제1호,2025년 3월 6일(목),457,신정훈,위원장,(전남 나주시화순군),6713,1,중앙선거관리위원회 위원후보자(김대웅) 인사청문회,(10시04분),"이상으로 오전 질의를 마치고요.
 점심을 위해서 오후 2시까지 휴회를 선포합니다."
423,임시회,제1호,2025년 3월 6일(목),458,신정훈,위원장,(전남 나주시화순군),6713,1,중앙선거관리위원회 위원후보자(김대웅) 인사청문회,(10시04분),"의석을 정돈해 주시기 바랍니다.
 성원이 되었으므로 회의를 속개하겠습니다.
 오전에 여당 위원님들께서 중앙선거관리위원회 위원장의 출석을 요구하시어 의사를 확인한 결과 합의제 기구인 선관위의 의사를 위원장이 독자적으로 표시할 우려가 있고 사무총장의 출석이 예정돼 있으며 위원장이 선관위원 인사청문회에 출석한 전례가 없다는 점을 고려해서 출석이 어렵다는 의사를 보내왔습니다.
 다만 김용빈 사무총장을 비롯한 증인·참고인 질의는 주질의 이후로 예정돼 있으나 여당 위원님들의 조기 출석요구를 고려하여 증인·참고인을 모두 미리 출석하도록 하였다는 점을 설명드립니다.
 오늘 인사청문회에는 증인 두 분과 참고인 두 분이 출석하였으며 불출석 증인은 없습니다. 
 그러면 증인과 참고인을 확인하겠습니다.
 호명된 증인과 참고인은 잠시 자리에 일어나 주시기 바랍니다.
 출석한 증인과 참고인의 신원은 행정실에서 사전에 확인하였음을 안내해 드립니다.
 먼저 박찬진 증인 일어나 주십시오.
 송봉섭 증인 일어나 주십시오.
 김용빈 참고인 일어나 주십시오.
 장병호 참고인 일어나 주십시오.
 (인사)
 감사합니다.
 여러 가지 바쁘신 일정 중에서도 이렇게 국회의 부름에 응해 주셔서 다시 한번 감사의 말씀 드립니다.
 이어서 증인 선서를 받도록 하겠습니다.
 증인 선서는 증인이 인사청문회에서 진술함에 있어서 양심에 따라 숨김과 보탬이 없이 사실 그대로를 증언하겠다는 확인을 받기 위한 것입니다.
 정당한 사유 없이 선서나 증언을 거부하거나 증언 시 모욕적인 언행 또는 허위의 진술을 하는 경우 국회에서의 증언·감정 등에 관한 법률에 따라서 처벌될 수 있음을 알려 드립니다.
 증인을 대표해서 박찬진 증인 일어나서 발언대에 나오셔서 오른손을 들고 선서문을 낭독한 후 위원장에게 제출해 주시기 바랍니다."
423,임시회,제1호,2025년 3월 6일(목),459,박찬진,증인,,0,1,중앙선거관리위원회 위원후보자(김대웅) 인사청문회,(10시04분),"“선서, 본인은 국회 행정안전위원회에서 실시하는 중앙선거관리위원회 위원후보자 인사청문회와 관련하여 행정안전위원회에서 증언을 함에 있어 국회에서의 증언·감정 등에 관한 법률 제8조 규정에 의하여 양심에 따라 숨김과 보탬이 없이 사실 그대로 말하고 만일 진술이나 서면답변에 거짓이 있으면 위증의 벌을 받기로 맹서합니다.”
2025년 3월 6일 증인 박찬진
 증인 송봉섭"
423,임시회,제1호,2025년 3월 6일(목),460,신정훈,위원장,(전남 나주시화순군),6713,1,중앙선거관리위원회 위원후보자(김대웅) 인사청문회,(10시04분),"그러면 오전에 이어서 주질의를 계속 진행하되 증인 신문 및 참고인 질의를 병행해서 진행하겠습니다.
 배부된 순서에 따라 질의하되 증인 신문과 참고인 질의 그리고 후보자에 대한 질의 중 원하시는 질의를 해 주시면 되겠습니다.
 윤건영 위원님은 나중에 보충질의에서 추가 1분 쓰시겠지요?"
423,임시회,제1호,2025년 3월 6일(목),461,윤건영,위원,(서울 구로구을),6687,1,중앙선거관리위원회 위원후보자(김대웅) 인사청문회,(10시04분),예.
423,임시회,제1호,2025년 3월 6일(목),462,신정훈,위원장,(전남 나주시화순군),6713,1,중앙선거관리위원회 위원후보자(김대웅) 인사청문회,(10시04분),다음은 조은희 위원님 질의해 주시기 바랍니다.
423,임시회,제1호,2025년 3월 6일(목),463,조은희,위원,(서울 서초구갑),6629,1,중앙선거관리위원회 위원후보자(김대웅) 인사청문회,(10시04분),"우선 화면을 좀 보시겠습니다.
 (영상자료를 보며)
 한 취업 준비 카페에서 공기업 준비하며 여러 번 불합격에 접했는데 참 허탈하다고 올렸고 어느 공시생 부모는 내 딸도 착하니 채용해 달라고 합니다. 878건의 채용비리 관련 규정 위반을 두고 힘도 없고 백도 없는 청년들은 들러리만 됐습니다.
 그간 헌법기관이라는 이름 뒤에 숨어 선관위는 외부 감사도 피해 왔습니다. 지난 10년간 가장 불공정한 부패 비리 천국이라 해도 과언이 아닙니다. 청년들이 분노하고 억울해 한다는 점을 좀 명심해 주시고요.
 사무총장님, 어제 과방위 현안질의에서 감사원을 상대로 권한쟁의 심판을 제기했던 이유에 대해 선관위가 헌법기관이라면 국회와 법원, 헌재와 동일한 대우를 해 달라는 것이라고 말씀하셨는데요. 이것 국회나 법원에서 감사 안 받기 때문에 선관위도 감사 안 받겠다 이 취지지요?"
423,임시회,제1호,2025년 3월 6일(목),464,김용빈,참고인,,0,1,중앙선거관리위원회 위원후보자(김대웅) 인사청문회,(10시04분),그것은 아닙니다.
423,임시회,제1호,2025년 3월 6일(목),465,조은희,위원,(서울 서초구갑),6629,1,중앙선거관리위원회 위원후보자(김대웅) 인사청문회,(10시04분),그러면 뭡니까?
423,임시회,제1호,2025년 3월 6일(목),466,김용빈,참고인,,0,1,중앙선거관리위원회 위원후보자(김대웅) 인사청문회,(10시04분),동등하게 대우를 해 달라는 겁니다.
423,임시회,제1호,2025년 3월 6일(목),467,조은희,위원,(서울 서초구갑),6629,1,중앙선거관리위원회 위원후보자(김대웅) 인사청문회,(10시04분),그 말이 그 말이지요. 왜 말장난하십니까?
423,임시회,제1호,2025년 3월 6일(목),468,김용빈,참고인,,0,1,중앙선거관리위원회 위원후보자(김대웅) 인사청문회,(10시04분),결국은……
423,임시회,제1호,2025년 3월 6일(목),469,조은희,위원,(서울 서초구갑),6629,1,중앙선거관리위원회 위원후보자(김대웅) 인사청문회,(10시04분),외부 통제를 받지 않겠다는 의도 아닙니까?
423,임시회,제1호,2025년 3월 6일(목),470,김용빈,참고인,,0,1,중앙선거관리위원회 위원후보자(김대웅) 인사청문회,(10시04분),국회나 법원에 대해서도……
423,임시회,제1호,2025년 3월 6일(목),471,조은희,위원,(서울 서초구갑),6629,1,중앙선거관리위원회 위원후보자(김대웅) 인사청문회,(10시04분),"다시 제가 물을게요. 
 그렇게 말씀하시면 안 됩니다. 국회의원이 을 아닙니까, 선관위의?
 박찬진 전 사무총장의 딸이 작년 10월 7일 7급으로 승진했습니다. 윤재현 전 경북선관위 상임위원 딸도 작년 1월 1일 승진했습니다. 그간 뭐라고 하셨습니까? 선관위가 징계에 대해서는 감사원이 징계 요청한 바 없다, 내부 규정한 것 없다, 모른 척 미루더니 승진은 척척 일사천리로 진행했습니다. 소쿠리 투표 논란 당시 선거관리 실무 책임자도 충북선관위로 연고지까지 배려하면서 1급 승진시켰습니다. 그런데도 외부 통제를 받지 않겠다는 말씀이십니까?"
423,임시회,제1호,2025년 3월 6일(목),472,김용빈,참고인,,0,1,중앙선거관리위원회 위원후보자(김대웅) 인사청문회,(10시04분),"기관 비리가 있는 부분하고, 이 비리를 반드시 척결해야 된다는 부분은 맞는데요."
423,임시회,제1호,2025년 3월 6일(목),473,조은희,위원,(서울 서초구갑),6629,1,중앙선거관리위원회 위원후보자(김대웅) 인사청문회,(10시04분),그러니까요. 지금 그냥 법조문에 얽매여서 형식 논리로 그러면 어떻게 국민들이 선관위를 믿겠습니까? 사무총장이 저렇게 말씀하시는데요.
423,임시회,제1호,2025년 3월 6일(목),474,김용빈,참고인,,0,1,중앙선거관리위원회 위원후보자(김대웅) 인사청문회,(10시04분),그런데 이게 법리적인 부분이기 때문에 그렇게 말씀드릴 수밖에 없습니다.
423,임시회,제1호,2025년 3월 6일(목),475,조은희,위원,(서울 서초구갑),6629,1,중앙선거관리위원회 위원후보자(김대웅) 인사청문회,(10시04분),"잠깐요. 또 묻겠습니다.
 영상 좀 틀어 주세요.
 (영상자료 상영)
 박찬진 증인, 증인은 아빠 찬스 아니라고 그랬어요. 책임지겠다고 그랬어요.
 송봉섭 증인, 특혜 전혀 없다고 말했습니다. 거짓말이지요? 왜 거짓말했습니까!
 제가 박찬진 증인에게 묻겠습니다. 
 지금 따님 어디 계십니까?"
423,임시회,제1호,2025년 3월 6일(목),476,박찬진,증인,,0,1,중앙선거관리위원회 위원후보자(김대웅) 인사청문회,(10시04분),중앙위원회 사무처에 보직 배제된 채 발령돼 있습니다.
423,임시회,제1호,2025년 3월 6일(목),477,조은희,위원,(서울 서초구갑),6629,1,중앙선거관리위원회 위원후보자(김대웅) 인사청문회,(10시04분),배제 언제 됐습니까?
