session,session_type,meeting_no,date,speech_order,speaker_name,speaker_position,speaker_area,data_mem_id,agenda_item_orders,agenda_item_titles,agenda_item_times,speech_text
423,임시회,제1호,2025년 3월 6일(목),1229,김대웅,중앙선거관리위원회위원후보자,,0,1,중앙선거관리위원회 위원후보자(김대웅) 인사청문회,(10시04분),"예, 알겠습니다."
423,임시회,제1호,2025년 3월 6일(목),1230,신정훈,위원장,(전남 나주시화순군),6713,1,중앙선거관리위원회 위원후보자(김대웅) 인사청문회,(10시04분),"흔들려서는 안 된다고 생각합니다. 
 다음은 이해식 위원님 질의해 주시기 바랍니다."
423,임시회,제1호,2025년 3월 6일(목),1231,이해식,위원,(서울 강동구을),6648,1,중앙선거관리위원회 위원후보자(김대웅) 인사청문회,(10시04분),"서울 강동을의 이해식 위원입니다. 
 후보자님, 앞서 위원님의 질의가 있었던 것으로 제가 얘기를 들었는데 애초 저희 의원실에서 제일 처음 문제 제기한 거라서 제가 또 다시 한번 질문을 하겠습니다. 
 후보자께서는 아파트 분양 과정에서 다섯 차례의 위장전입을 했고 배우자께서는 다운계약서를 작성한 바가 있습니다. 
 위장전입이라고 하는 것은 명백한 실정법 위반이지요?"
423,임시회,제1호,2025년 3월 6일(목),1232,김대웅,중앙선거관리위원회위원후보자,,0,1,중앙선거관리위원회 위원후보자(김대웅) 인사청문회,(10시04분),예.
423,임시회,제1호,2025년 3월 6일(목),1233,이해식,위원,(서울 강동구을),6648,1,중앙선거관리위원회 위원후보자(김대웅) 인사청문회,(10시04분),"당시 현직 법관 신분이었던 후보자가 상습적으로 실정법을 위반한 것이다, 매우 실망스러운 것이라고 할 수 있겠지요?"
423,임시회,제1호,2025년 3월 6일(목),1234,김대웅,중앙선거관리위원회위원후보자,,0,1,중앙선거관리위원회 위원후보자(김대웅) 인사청문회,(10시04분),"예, 그 부분은 잘못한 걸 인정하고 있습니다."
423,임시회,제1호,2025년 3월 6일(목),1235,이해식,위원,(서울 강동구을),6648,1,중앙선거관리위원회 위원후보자(김대웅) 인사청문회,(10시04분),2003년도에 작성되었던 다운계약서는 당시 불법은 아니었다 하더라도 세금을 줄이기 위한 편법 행위로 관행이다 이렇게 말할 수는 없는 거라고 생각이 됩니다. 그렇지요?
423,임시회,제1호,2025년 3월 6일(목),1236,김대웅,중앙선거관리위원회위원후보자,,0,1,중앙선거관리위원회 위원후보자(김대웅) 인사청문회,(10시04분),그렇습니다. 그것도 역시 잘못한 것입니다.
423,임시회,제1호,2025년 3월 6일(목),1237,이해식,위원,(서울 강동구을),6648,1,중앙선거관리위원회 위원후보자(김대웅) 인사청문회,(10시04분),당시 정상적으로 지방세를 냈더라면 4930만 원을 내야 되는데 다운계약서를 작성함으로써 1009만 2000원 정도밖에 내지를 않았고 따라서 4000만 원 가까운 세금을 내지 않은 결과를 초래한 것이지요. 국가재정의 손실을 초래한 것으로 보여집니다. 그렇지요?
423,임시회,제1호,2025년 3월 6일(목),1238,김대웅,중앙선거관리위원회위원후보자,,0,1,중앙선거관리위원회 위원후보자(김대웅) 인사청문회,(10시04분),예.
423,임시회,제1호,2025년 3월 6일(목),1239,이해식,위원,(서울 강동구을),6648,1,중앙선거관리위원회 위원후보자(김대웅) 인사청문회,(10시04분),그렇다면 불법이 아니다 그런 말로 넘어갈 수는 없는 거겠지요?
423,임시회,제1호,2025년 3월 6일(목),1240,김대웅,중앙선거관리위원회위원후보자,,0,1,중앙선거관리위원회 위원후보자(김대웅) 인사청문회,(10시04분),"예, 그렇습니다."
423,임시회,제1호,2025년 3월 6일(목),1241,이해식,위원,(서울 강동구을),6648,1,중앙선거관리위원회 위원후보자(김대웅) 인사청문회,(10시04분),다시 한번 공식적으로 사과를 하실 용의가 있습니까?
423,임시회,제1호,2025년 3월 6일(목),1242,김대웅,중앙선거관리위원회위원후보자,,0,1,중앙선거관리위원회 위원후보자(김대웅) 인사청문회,(10시04분),"예, 그 부분에 대해서는 사실 오전에도 말씀드렸지만 변명의 여지가 없는 부분이라서 그 부분은 제가 잘못했다는 것을 확실히 인정하고 있습니다. 사과드립니다."
423,임시회,제1호,2025년 3월 6일(목),1243,이해식,위원,(서울 강동구을),6648,1,중앙선거관리위원회 위원후보자(김대웅) 인사청문회,(10시04분),"후보자께서 헌법과 법률을 수호하는 법관 신분이고 또 선거관리를 책임져야 되는 선관위원후보자로 지금 앉아 계시기 때문에 재차 이런 질문을 드리는 겁니다.
 그리고 저는 선관위도 마찬가지라고 생각해요. 선거관리위원회가 헌법상 독립기구로 돼 있지 않습니까?"
423,임시회,제1호,2025년 3월 6일(목),1244,김대웅,중앙선거관리위원회위원후보자,,0,1,중앙선거관리위원회 위원후보자(김대웅) 인사청문회,(10시04분),예.
423,임시회,제1호,2025년 3월 6일(목),1245,이해식,위원,(서울 강동구을),6648,1,중앙선거관리위원회 위원후보자(김대웅) 인사청문회,(10시04분),이렇게 헌법상 독립기구로 돼 있는 나라가 우리나라 말고 어느 나라가 있는지를 혹시 아십니까?
423,임시회,제1호,2025년 3월 6일(목),1246,김대웅,중앙선거관리위원회위원후보자,,0,1,중앙선거관리위원회 위원후보자(김대웅) 인사청문회,(10시04분),제가 아는 한도로는 드문 걸로 알고 있습니다.
423,임시회,제1호,2025년 3월 6일(목),1247,이해식,위원,(서울 강동구을),6648,1,중앙선거관리위원회 위원후보자(김대웅) 인사청문회,(10시04분),"드물지는 않습니다. 가까이 필리핀이라는 나라도 있고 아프리카의 나이지리아라든가 남아프리카공화국 이런 데도 그런 것 같습니다. 그리고 인도라든가 파키스탄 같은 나라들도 그렇다고 알고 있습니다. 정확한지는 모르겠는데…… 사무총장님, 어떻습니까?"
423,임시회,제1호,2025년 3월 6일(목),1248,김용빈,참고인,,0,1,중앙선거관리위원회 위원후보자(김대웅) 인사청문회,(10시04분),태국은 확실하게 상설기관화돼서 국가 서열도 굉장히 높습니다.
423,임시회,제1호,2025년 3월 6일(목),1249,이해식,위원,(서울 강동구을),6648,1,중앙선거관리위원회 위원후보자(김대웅) 인사청문회,(10시04분),그렇습니까?
423,임시회,제1호,2025년 3월 6일(목),1250,김용빈,참고인,,0,1,중앙선거관리위원회 위원후보자(김대웅) 인사청문회,(10시04분),그런데 인도 쪽은 제가 정확하게 모르겠습니다.
423,임시회,제1호,2025년 3월 6일(목),1251,이해식,위원,(서울 강동구을),6648,1,중앙선거관리위원회 위원후보자(김대웅) 인사청문회,(10시04분),"그러나 어떻든 미·영을 비롯해서 일부…… 그러니까 주로 선진 국가들은 그렇지는 않지요?
 우리나라도 사실은 행정부에서 선거관리를 할 때는 됐다 그렇게 생각합니다, 개인적으로. 그런데 우리는 역사적인 맥락이 있지요. 그렇지요?"
423,임시회,제1호,2025년 3월 6일(목),1252,김대웅,중앙선거관리위원회위원후보자,,0,1,중앙선거관리위원회 위원후보자(김대웅) 인사청문회,(10시04분),예.
423,임시회,제1호,2025년 3월 6일(목),1253,이해식,위원,(서울 강동구을),6648,1,중앙선거관리위원회 위원후보자(김대웅) 인사청문회,(10시04분),"3·15 부정선거라는 게 있었고 4·19 혁명이 있었고, 그래서 1963년도 5차 헌법 개정 때 선거관리위원회를 헌법기구로 독립을 시켰습니다. 3·15 부정선거라고 하는 뼈아픈 역사의 과거가 있기 때문에 그걸 되풀이해서는 안 된다라고 하는 국민적 열망을 담은 것이거든요.
 그러면 선거관리위원회는 그만큼 더 엄격하게 선거관리에 임해야 되고 선거관리위원회 위원들을 포함한, 위원장에서부터 위원들을 포함한 직원들까지 헌법상 독립기구로서의 어떤 자존감이라 그럴까 그런 것을 가지고 근무를 했어야 됨에도 불구하고 헌법상 독립기구라고 하는 것을 마치 이용이라도 하듯이 이런 채용비리가 만연한 조직으로 운영해 왔다는 것, 이것은 정말 땅을 치고 통곡할 일이다 이렇게 생각합니다."
423,임시회,제1호,2025년 3월 6일(목),1254,김대웅,중앙선거관리위원회위원후보자,,0,1,중앙선거관리위원회 위원후보자(김대웅) 인사청문회,(10시04분),"예, 맞습니다."
423,임시회,제1호,2025년 3월 6일(목),1255,이해식,위원,(서울 강동구을),6648,1,중앙선거관리위원회 위원후보자(김대웅) 인사청문회,(10시04분),그렇지요?
423,임시회,제1호,2025년 3월 6일(목),1256,김대웅,중앙선거관리위원회위원후보자,,0,1,중앙선거관리위원회 위원후보자(김대웅) 인사청문회,(10시04분),"예, 저도 똑같이 생각하고 있습니다."
423,임시회,제1호,2025년 3월 6일(목),1257,이해식,위원,(서울 강동구을),6648,1,중앙선거관리위원회 위원후보자(김대웅) 인사청문회,(10시04분),"바로 저는 그 점에 있어서 채용비리가 재발되지 않도록 하는 자체적인 아주 정말 단호한 조치 그리고 국민들께서 납득할 만한 정말 파격적인 조치가 있어야 된다고 생각합니다.
 그래서 위원으로 가시면 그런 국민들의 신뢰를 다시 회복할 수 있는 정말 엄정한 조치를 해야 될 책임이 후보자에게 있다, 저는 이렇게 생각하는데 어떻게 생각하세요?"
423,임시회,제1호,2025년 3월 6일(목),1258,김대웅,중앙선거관리위원회위원후보자,,0,1,중앙선거관리위원회 위원후보자(김대웅) 인사청문회,(10시04분),맞습니다. 헌법기관이라고 해서 제한 없는 권한을 갖고 있는 건 아니라고 생각하고요. 헌법기관이라면 또 그에 걸맞은 책임을 져야 된다고 생각하고 있습니다. 말씀하신 것은 명심하고 최선을 다해서 수행하도록 하겠습니다.
423,임시회,제1호,2025년 3월 6일(목),1259,이해식,위원,(서울 강동구을),6648,1,중앙선거관리위원회 위원후보자(김대웅) 인사청문회,(10시04분),"시간이 끝나서 그런데요, 어쨌든 이것이 선거부정 의혹으로까지 연결되는 그런 빌미를 제공한 것은 있다 이렇게 생각합니다. 물론 선거부정하고 차원이 다른 문제지요. 그동안 이 채용비리가 없었다면 우리나라 선거관리는 정말 세계에서도 자랑할 만한 선거관리였고 모범적인 선거관리였거든요, 선진국에서도 벤치마킹을 왔고. 특히 사전선거의 시스템이라고 하는 것은 탁월한 시스템으로 인정받고 있었어요. 그런데 부정 채용, 채용비리 이것이 그냥 한꺼번에 그런 명성을 다 무너뜨려 버린 거예요.
 그래서 지금 내란을 경고하면서 윤석열의 파면을 반대하는 측에서 이렇게 과도하게 활용하고 있는 측면이 있고 또 그것을 국민의힘 의원들 상당수가 동조하고 있는 상황이 참 안타깝기는 한데…… 
 그러나 이 부정 채용비리만큼은 다시 재발되지 않도록 확실한 대책이 있어야 한다 이런 말씀을 꼭 드리고 싶습니다."
423,임시회,제1호,2025년 3월 6일(목),1260,김대웅,중앙선거관리위원회위원후보자,,0,1,중앙선거관리위원회 위원후보자(김대웅) 인사청문회,(10시04분),"예, 잘 알겠습니다."
423,임시회,제1호,2025년 3월 6일(목),1261,신정훈,위원장,(전남 나주시화순군),6713,1,중앙선거관리위원회 위원후보자(김대웅) 인사청문회,(10시04분),"수고하셨습니다.
 다음은 양부남 위원님 질의해 주시기 바랍니다."
423,임시회,제1호,2025년 3월 6일(목),1262,양부남,위원,(광주 서구을),6848,1,중앙선거관리위원회 위원후보자(김대웅) 인사청문회,(10시04분),"후보자님, 많은 위원님들이 선관위의 채용비리에 대해서 질타가 많이 이어지고 있습니다. 채용비리는 제가 구체적으로 말씀드리지 않겠는데 비리의 종합세트라고 할 수가 있어요. 그리고 이걸 보면서, 우리 많은 청년들에게 실망감과 분노와 좌절감을 안겨 준 사건입니다.
 그것의 PPT 한번 보겠습니다.
 (영상자료를 보며)
 채용비리도 있지만 선관위가 선거 때 정말로 힘을 집중해야 될 기관인데도 불구하고 선거 때만 되면 집을 나가요. 2018년도에 30명, 2020년 총선 때 60명, 2022년 지방선거에 85명, 2024년 총선에 80명이 집을 나갔어요, 선거하기 6개월 전에. 이것 가당키나 한 일입니까? 그래서 이러한 문제가 있어서 이번에 감사원에서 직무감찰을 한 것 아닙니까? 
 여기에 대해서 헌재는 행정권을 수반으로 하는 대통령 거기에 속한 감사원이 헌법기관으로 있는 중앙선관위를 감찰하는 것은 적절치 않다라고 판결을 내렸습니다. 
 제가 행정안전위원회에 처음 왔을 때 그런 질의를 했어요, 사무총장한테. 과연 중앙선관위가 헌재를 상대로 권한쟁의심판을 하는 걸 보고 국민이 어떻게 생각할까 질의한 적이 있었습니다. 그건 또 다른 차원이지만 어찌 됐든 헌재에서는 이번에 감사원의 감사가 적절하지 않다는 판단인데 면죄부를 준 건 아닙니다. 그걸 명심해야 될 것입니다. 
 그리고 제가 확인하고 싶은 것은 이렇게 채용비리가 있고 근무 기강이 엉망이지만 그렇다고 해서 이것이 부정선거로 이어지는 것은 아니지 않습니까?"
423,임시회,제1호,2025년 3월 6일(목),1263,김대웅,중앙선거관리위원회위원후보자,,0,1,중앙선거관리위원회 위원후보자(김대웅) 인사청문회,(10시04분),"예, 그렇습니다."
423,임시회,제1호,2025년 3월 6일(목),1264,양부남,위원,(광주 서구을),6848,1,중앙선거관리위원회 위원후보자(김대웅) 인사청문회,(10시04분),그렇지 않습니까?
423,임시회,제1호,2025년 3월 6일(목),1265,김대웅,중앙선거관리위원회위원후보자,,0,1,중앙선거관리위원회 위원후보자(김대웅) 인사청문회,(10시04분),예.
423,임시회,제1호,2025년 3월 6일(목),1266,양부남,위원,(광주 서구을),6848,1,중앙선거관리위원회 위원후보자(김대웅) 인사청문회,(10시04분),"이건 논리의 비약이고 견강부회라는 생각이 듭니다.
 그리고 지금 윤석열 대통령께서 수없이 강조하고 있습니다. 부정선거 때문에 내가 계엄을 했다 이렇게 강조하고 있는데 부정선거가 인정되지 않는다는 것은 우리가 여러 번 질의와 답변을 통해서 확인을 했습니다. 
 그런데 제가 후보자께 질의하고 싶은 것은 가사 윤석열 대통령 주장처럼 부정선거 의혹이 있다손 칩시다. 그러면 부정선거의 의혹이 있으면 이렇게 무장한 군을 동원해서 압수수색을 해야 됩니까, 아니면 윤석열 대통령의 지시를 철통같이 잘 따르는 검찰을 동원해서 수사를 해야 됩니까? 어떻게 해야 돼요?"
423,임시회,제1호,2025년 3월 6일(목),1267,김대웅,중앙선거관리위원회위원후보자,,0,1,중앙선거관리위원회 위원후보자(김대웅) 인사청문회,(10시04분),"글쎄, 통상적인 방법을 취하는 게 맞다고 생각을 하는데요."
423,임시회,제1호,2025년 3월 6일(목),1268,양부남,위원,(광주 서구을),6848,1,중앙선거관리위원회 위원후보자(김대웅) 인사청문회,(10시04분),"통상적인 방법이 뭡니까?
 그렇게 답변하지 마시고.
 통상적인 방법이 무슨 방법이에요? 군을 동원하는 게 통상적입니까?"
423,임시회,제1호,2025년 3월 6일(목),1269,김대웅,중앙선거관리위원회위원후보자,,0,1,중앙선거관리위원회 위원후보자(김대웅) 인사청문회,(10시04분),그렇지는 않다고 생각합니다.
423,임시회,제1호,2025년 3월 6일(목),1270,양부남,위원,(광주 서구을),6848,1,중앙선거관리위원회 위원후보자(김대웅) 인사청문회,(10시04분),정확히 이야기를 해 보세요.
423,임시회,제1호,2025년 3월 6일(목),1271,김대웅,중앙선거관리위원회위원후보자,,0,1,중앙선거관리위원회 위원후보자(김대웅) 인사청문회,(10시04분),다만 개개 질문하신 부분의 부정선거 부분에 대해서는 좀 말씀드린 게 있고……
423,임시회,제1호,2025년 3월 6일(목),1272,양부남,위원,(광주 서구을),6848,1,중앙선거관리위원회 위원후보자(김대웅) 인사청문회,(10시04분),"아니, 제가 전제를 했잖아요. 부정선거가 가사 만 번, 천 번 양보해서 있다손 치면 어떻게 해야 되냐 이거예요. 군을 보내야 돼요, 아니면 수사기관을 보내야 돼요?"
423,임시회,제1호,2025년 3월 6일(목),1273,김대웅,중앙선거관리위원회위원후보자,,0,1,중앙선거관리위원회 위원후보자(김대웅) 인사청문회,(10시04분),그 부분은 제가 지금 후보자 신분에서 말씀드리기가 어렵다는 점을 좀 이해해 주시면 감사하겠습니다.
423,임시회,제1호,2025년 3월 6일(목),1274,양부남,위원,(광주 서구을),6848,1,중앙선거관리위원회 위원후보자(김대웅) 인사청문회,(10시04분),그러면 윤석열 대통령의 비상계엄이 정당하다는 겁니까?
423,임시회,제1호,2025년 3월 6일(목),1275,김대웅,중앙선거관리위원회위원후보자,,0,1,중앙선거관리위원회 위원후보자(김대웅) 인사청문회,(10시04분),꼭 그런 뜻은 아닙니다만 어쨌든 구체적인 답변은 좀 드리기가 어렵다……
423,임시회,제1호,2025년 3월 6일(목),1276,양부남,위원,(광주 서구을),6848,1,중앙선거관리위원회 위원후보자(김대웅) 인사청문회,(10시04분),"아니, 그게 무슨…… 그러면 군을 보내도 된다 이 말씀입니까?"
423,임시회,제1호,2025년 3월 6일(목),1277,김대웅,중앙선거관리위원회위원후보자,,0,1,중앙선거관리위원회 위원후보자(김대웅) 인사청문회,(10시04분),그 부분도 마찬가지입니다.
423,임시회,제1호,2025년 3월 6일(목),1278,양부남,위원,(광주 서구을),6848,1,중앙선거관리위원회 위원후보자(김대웅) 인사청문회,(10시04분),"그래요?
 아니, 확실히 이야기하세요. 군을 보내도 되는 겁니까?"
423,임시회,제1호,2025년 3월 6일(목),1279,김대웅,중앙선거관리위원회위원후보자,,0,1,중앙선거관리위원회 위원후보자(김대웅) 인사청문회,(10시04분),그러니까……
423,임시회,제1호,2025년 3월 6일(목),1280,양부남,위원,(광주 서구을),6848,1,중앙선거관리위원회 위원후보자(김대웅) 인사청문회,(10시04분),"아니, 판사 출신이 법치주의에 대한 개념이 있는지 저는 질의하고 싶네요."
423,임시회,제1호,2025년 3월 6일(목),1281,김대웅,중앙선거관리위원회위원후보자,,0,1,중앙선거관리위원회 위원후보자(김대웅) 인사청문회,(10시04분),"초기 질문에 아마, 어느 위원님 질문할 때 잠깐 답변드린 것 같은데……"
423,임시회,제1호,2025년 3월 6일(목),1282,양부남,위원,(광주 서구을),6848,1,중앙선거관리위원회 위원후보자(김대웅) 인사청문회,(10시04분),"아니, 제 질문이에요. 제 질문에 답변해 보세요."
423,임시회,제1호,2025년 3월 6일(목),1283,김대웅,중앙선거관리위원회위원후보자,,0,1,중앙선거관리위원회 위원후보자(김대웅) 인사청문회,(10시04분),군을 동원해서 선관위에 온 것은 잘못됐다고 생각한다고……
423,임시회,제1호,2025년 3월 6일(목),1284,양부남,위원,(광주 서구을),6848,1,중앙선거관리위원회 위원후보자(김대웅) 인사청문회,(10시04분),"아니, 그 답변이 그렇게 어려워요? 그런 소신도 없이 어떻게 중앙선관위원을 할 수가 있어요? 무엇 때문에 중앙선관위원으로 오신 겁니까, 그러면?
 그리고 군을 동원해서 헌법기관인 중앙선관위를 점거한 것은 국헌문란이 되지요? 안 됩니까, 국헌문란? 뭐가 국헌문란입니까?"
423,임시회,제1호,2025년 3월 6일(목),1285,김대웅,중앙선거관리위원회위원후보자,,0,1,중앙선거관리위원회 위원후보자(김대웅) 인사청문회,(10시04분),국가 헌법기관을……
423,임시회,제1호,2025년 3월 6일(목),1286,양부남,위원,(광주 서구을),6848,1,중앙선거관리위원회 위원후보자(김대웅) 인사청문회,(10시04분),그렇지요? 중앙선관위는 헌법기관이지요?
423,임시회,제1호,2025년 3월 6일(목),1287,김대웅,중앙선거관리위원회위원후보자,,0,1,중앙선거관리위원회 위원후보자(김대웅) 인사청문회,(10시04분),"예, 맞습니다."
423,임시회,제1호,2025년 3월 6일(목),1288,양부남,위원,(광주 서구을),6848,1,중앙선거관리위원회 위원후보자(김대웅) 인사청문회,(10시04분),헌법기관을 무력으로 진압했어요. 그게 국헌문란 아닙니까? 아니에요?
423,임시회,제1호,2025년 3월 6일(목),1289,김대웅,중앙선거관리위원회위원후보자,,0,1,중앙선거관리위원회 위원후보자(김대웅) 인사청문회,(10시04분),그렇지는 않습니다.
423,임시회,제1호,2025년 3월 6일(목),1290,양부남,위원,(광주 서구을),6848,1,중앙선거관리위원회 위원후보자(김대웅) 인사청문회,(10시04분),"국헌문란이지요.
 그리고 군대를 동원해서 이런 것은 폭동입니다. 내란죄에 해당되지요?
 답변해 보세요. 법률가가 이런 걸 답변을 못 하면 어떤 소신을 가지고 일하겠습니까?"
423,임시회,제1호,2025년 3월 6일(목),1291,김대웅,중앙선거관리위원회위원후보자,,0,1,중앙선거관리위원회 위원후보자(김대웅) 인사청문회,(10시04분),그 부분은 말씀드리기 곤란하다는 점을 좀 이해해 주셨으면 합니다.
423,임시회,제1호,2025년 3월 6일(목),1292,양부남,위원,(광주 서구을),6848,1,중앙선거관리위원회 위원후보자(김대웅) 인사청문회,(10시04분),어떤 데서 답변이 곤란합니까?
423,임시회,제1호,2025년 3월 6일(목),1293,김대웅,중앙선거관리위원회위원후보자,,0,1,중앙선거관리위원회 위원후보자(김대웅) 인사청문회,(10시04분),현직 후보자 신분이고 또 재판 중에 있는 사건이어서 현직 법관 입장에서 말씀드리기가 좀 곤란합니다. 그것은 좀 이해해 주셨으면 감사하겠습니다.
423,임시회,제1호,2025년 3월 6일(목),1294,양부남,위원,(광주 서구을),6848,1,중앙선거관리위원회 위원후보자(김대웅) 인사청문회,(10시04분),"제가 이해할 부분이 아니고 이 TV를, 이 인사청문회를 보고 있는 많은 국민이 후보자를 보면서 저 정도 소신을 가지고 지금 온 국민한테 질타를 받고 있는 중앙선관위의 근무 기강, 채용비리, 공정성을 과연 확보할 수 있을 것인지 의문을 가질 겁니다. 소신 갖고 하세요."
423,임시회,제1호,2025년 3월 6일(목),1295,김대웅,중앙선거관리위원회위원후보자,,0,1,중앙선거관리위원회 위원후보자(김대웅) 인사청문회,(10시04분),"예, 잘 알겠습니다."
423,임시회,제1호,2025년 3월 6일(목),1296,양부남,위원,(광주 서구을),6848,1,중앙선거관리위원회 위원후보자(김대웅) 인사청문회,(10시04분),"현재 서울고등법원의 법원장이신 분이 무슨 미련이 있고, 무슨 관직에 대해 미련이 있습니까? 소신 갖고 하는 게 국가와 국민을 위하는 길입니다, 본인의 명예를 지키는 길이고. 명심하시기 바랍니다.
 이상입니다."
423,임시회,제1호,2025년 3월 6일(목),1297,김대웅,중앙선거관리위원회위원후보자,,0,1,중앙선거관리위원회 위원후보자(김대웅) 인사청문회,(10시04분),명심하겠습니다.
