session,session_type,meeting_no,date,speech_order,speaker_name,speaker_position,speaker_area,data_mem_id,agenda_item_orders,agenda_item_titles,agenda_item_times,speech_text
423,임시회,제1호,2025년 3월 6일(목),1,신정훈,위원장,(전남 나주시화순군),6713,,,,"의석을 정돈해 주시기 바랍니다.
 성원이 되었으므로 제423회 국회(임시회) 제1차 행정안전위원회를 개회하겠습니다.
 오늘 우리 위원회는 중앙선거관리위원회 위원후보자(김대웅)에 대한 인사청문회를 실시하도록 하겠습니다.
 인사청문회는 국민의 대표기관인 국회가 공직후보자의 직무수행 능력과 준법성, 도덕성, 책임성을 확인하여 해당 직책에 적임자인지를 검증하는 데 그 목적이 있습니다.
 특히 중앙선거관리위원회 위원은 민주주의의 꽃인 선거를 공정하고 차질 없이 관리함으로써 우리 정치의 안전과 발전을 책임지는 막중한 자리입니다.
 또한 최근에는 부정선거 음모론으로 인한 국민의 혼란과 조직 내 채용비리에 대한 국민의 불신을 해소해야 한다는 중대한 역할도 요구받고 있습니다.
 오늘 인사청문회에서는 후보자가 전문성과 책임성을 가지고 맡은 바 직무를, 소임을 제대로 수행할 수 있는지 검증하도록 하겠습니다.
 후보자께서는 위원님들의 질의에 성실하고 진솔하게 답변하셔서 인사청문회가 그 취지에 맞게 운영될 수 있도록 협조해 주시기 바랍니다.
 또한 오늘 인사청문회는 국회방송으로 생중계되고 있다는 점을 위원님들께서 참고해 주시기 바랍니다."
423,임시회,제1호,2025년 3월 6일(목),2,신정훈,위원장,(전남 나주시화순군),6713,1,중앙선거관리위원회 위원후보자(김대웅) 인사청문회,(10시04분),"그러면 의사일정 제1항 중앙선거관리위원회 위원후보자(김대웅)에 대한 인사청문회를 상정합니다.
 오늘 인사청문회는 먼저 후보자의 선서와 모두발언을 들은 다음 위원님들의 질의를 시작하겠습니다. 또한 증인 신문 및 참고인 질의는 주질의를 완료한 후에 보충질의와 함께 실시하겠습니다.
 그러면 공직후보자의 선서를 받도록 하겠습니다.
 김대웅 후보자께서는 발언대로 나오셔서 오른손을 들고 선서문을 낭독한 다음 선서가 끝나면 서명 날인한 선서문을 위원장에게 제출해 주시기 바랍니다."
423,임시회,제1호,2025년 3월 6일(목),3,김대웅,중앙선거관리위원회위원후보자,,0,1,중앙선거관리위원회 위원후보자(김대웅) 인사청문회,(10시04분),"“선서, 공직후보자인 본인은 국회가 실시하는 인사청문회에서 양심에 따라 숨김과 보탬이 없이 사실 그대로 말할 것을 맹서합니다.”
2025년 3월 6일 공직후보자 김대웅"
423,임시회,제1호,2025년 3월 6일(목),4,신정훈,위원장,(전남 나주시화순군),6713,1,중앙선거관리위원회 위원후보자(김대웅) 인사청문회,(10시04분),"다음으로 공직후보자의 모두발언을 듣겠습니다.
 후보자는 발언대로 나오셔서 모두발언해 주시기 바랍니다."
423,임시회,제1호,2025년 3월 6일(목),5,김대웅,중앙선거관리위원회위원후보자,,0,1,중앙선거관리위원회 위원후보자(김대웅) 인사청문회,(10시04분),"존경하는 신정훈 행정안전위원회 위원장님 그리고 여러 위원님 여러분!
 연일 의정활동으로 바쁘신 가운데서도 귀중한 시간을 내어 저에게 중앙선거관리위원회 위원후보자로서 인사청문을 받을 수 있게 해 주신 데 대하여 진심으로 감사드립니다.
 저는 오늘 중앙선거관리위원회 위원후보자로서 국회의 검증을 받고자 이 자리에 섰습니다. 제가 이 자리에 서게 된 것은 개인적으로 큰 영광이기는 합니다만 그 어느 때보다 선거관리위원회의 공정한 선거관리에 대한 국민의 관심과 우려가 크다는 점을 잘 알기에 한없이 무거운 책임감을 느낍니다.
 오늘 이 자리가 중앙선거관리위원회 위원으로서의 자질과 능력을 검증하는 엄숙한 자리인 만큼 위원님들께서 주시는 고견을 진지하게 경청하고 모든 질문에 대해 솔직하고 성실하게 답변드리도록 하겠습니다.
 저는 1993년 수원지방법원 판사로 임관한 이래 32년간 법관으로 재직하면서 각급 법원에서 민사, 형사, 행정 등 다양한 재판 사무를 처리하였습니다. 기본권 보장이라는 헌법의 큰 틀 안에서 약자와 소수자 보호라는 헌법적 책무를 완수하기 위해 항상 국민을 최우선에 두고 법과 양심에 따라 공정하게 재판하고자 하였습니다. 어느 한쪽에 치우치지 않는 올바른 결론을 도출하고자 공정하고 중립적인 입장에서 당사자들의 말을 경청하였습니다. 재판 결과에 모든 사람이 동의할 수는 없을지라도 재판절차에는 모든 사람이 승복할 수 있도록 국민의 신뢰를 얻기 위해 끊임없이 노력하였습니다.
 이처럼 제가 견지해 온 공정, 중립, 신뢰라는 덕목은 중앙선거관리위원회 위원에게도 요구되는 것이기도 합니다. 선거관리위원회 위원은 참정권 보장이라는 임무를 완수하기 위해 공정하고 중립적인 자세로 국민의 말씀을 들어 이를 정책에 반영하고 흠결 없는 선거관리를 통해 국민으로부터 신뢰받을 수 있도록 노력하여야 합니다. 그것이 바로 국민이 선거관리위원회에 바라는 것이고 이 자리에서 검증받는 제가 이루어 내야 할 과제라고 생각합니다.
 제가 중앙선거관리위원회 위원으로 지명된다면 법관으로서 체득한 독립성과 공정함을 바탕으로 국민의 참정권이 올바르게 선거 절차에 반영될 수 있도록 선거관리에 매진하여 이를 통해 우리나라 민주주의 발전에 기여할 수 있도록 최선을 다하겠습니다.
 위원장님을 비롯한 위원님 여러분!
 중앙선거관리위원회는 1963년 창설된 이래 올바른 선거문화 정착을 위해 꾸준히 노력하여 왔고 우리나라 민주주의 발전에 기여해 왔습니다.
 최근 선거관리를 둘러싸고 의혹을 제기하는 일이 발생하고 있습니다. 저는 이번 인사청문을 준비하면서 민주주의 발전에서 선거관리위원회의 역할이 중요하다는 점을 다시 한번 생각하게 되었습니다.
 그동안 선거관리위원회가 변화하는 선거환경에 제대로 대응하지 못한 부분은 없는지, 국민의 눈높이에서 개선할 사항이 있는지를 살펴볼 필요가 있다는 것도 느끼게 되었습니다.
 오늘 인사청문 이후에 제가 중앙선거관리위원회 위원으로 직무를 수행할 기회가 주어진다면 지난 선거 과정에서 나타난 문제점이 무엇인지 살펴보고 선거관리위원회 운영에 비합리적인 부분은 없는지도 세심하게 살펴보도록 하겠습니다. 그리하여 국민들께서 안심하며 소중한 참정권을 행사할 수 있도록 최선을 다하겠습니다.
 존경하는 신정훈 위원장님 그리고 위원님 여러분!
 중앙선거관리위원회에 대한 국민의 신뢰는 결국 공정하고 흠 없는 선거관리를 달성함으로써만 얻을 수 있다고 생각합니다.
 앞으로 실시되는 모든 선거에서 공정과 신뢰를 최고의 가치로 삼고 불합리한 제도를 개선하는 등 선거관리위원회가 국민의 신뢰를 받는 헌법기관으로 거듭날 수 있도록 최선을 다하겠습니다.
 끝으로 저에 대한 인사청문을 위하여 귀중한 시간을 내어 주신 신정훈 위원장님과 여러 위원님들께 다시 한번 감사를 드립니다.
 오늘 인사청문 과정에서 주시는 고견과 충고는 국민의 뜻으로 여겨 겸허한 자세로 마음 깊이 새기겠습니다.
 감사합니다."
423,임시회,제1호,2025년 3월 6일(목),6,신정훈,위원장,(전남 나주시화순군),6713,1,중앙선거관리위원회 위원후보자(김대웅) 인사청문회,(10시04분),"수고하셨습니다.
 이제 위원님들의 질의를 시작하겠습니다.
 질의는 배부된 순서에 따라서 일문일답 방식으로 진행하겠습니다.
 주질의 시간은 답변시간을 포함해서 7분입니다.
 이만희 위원님 의사진행발언입니까?"
423,임시회,제1호,2025년 3월 6일(목),7,이만희,위원,(경북 영천시청도군),6667,1,중앙선거관리위원회 위원후보자(김대웅) 인사청문회,(10시04분),예.
423,임시회,제1호,2025년 3월 6일(목),8,배준영,위원,(인천 중구강화군옹진군),6700,1,중앙선거관리위원회 위원후보자(김대웅) 인사청문회,(10시04분),저도……
423,임시회,제1호,2025년 3월 6일(목),9,신정훈,위원장,(전남 나주시화순군),6713,1,중앙선거관리위원회 위원후보자(김대웅) 인사청문회,(10시04분),"배준영 위원님도……
 먼저 이만희 위원님 발언해 주시기 바랍니다."
423,임시회,제1호,2025년 3월 6일(목),10,이만희,위원,(경북 영천시청도군),6667,1,중앙선거관리위원회 위원후보자(김대웅) 인사청문회,(10시04분),"감사합니다, 위원장님.
 이만희 위원입니다.
 사실 오늘 선거관리위원회 위원의 인사청문에 대한 국민적 관심이 아마 제 경험으로는 굉장히, 어느 때보다도 제일 높은 것 같다는 생각이 들었습니다.
 사실 오늘 이 회의를 통해 가지고 후보자에 대한 검증 부분도 좋겠지만 또 거기에 못지않게 많은 국민들께서 이미 분노를 느끼고 계시는 선관위의 현대판 음서제도 또 불공정함의 극치인 채용비리에 대해서 밝혀진 감사원 감사 결과에 대한 선관위의 책임 있는 답변을 아마 듣고 싶어 하신다고 저는 생각을 합니다.
 그런데 오늘 사실 오전 회의에 유감스럽게도 노태악 선거관리위원장이나 또 김용빈 사무총장이 지금 출석하지 않은 것으로 조금 전 간사로부터 얘기를 들었습니다. 저는 여야를 떠나서 이런 중요한 상황이 벌어지고 국민적인 분노와 관심이 집중된 사안에 대해서는 비록 헌법기관이라고 하더라도 그 관계자들이 나와서 우리 위원들의 질의에 성실하게 답변하는 것이 맞지 않나 생각을 합니다.
 위원장님, 좀 늦은 감이 있겠지만 위원장님께서 여야 간사 간의 협의를 통하셔 가지고 지금부터라도 선관위원장이나 선거관리위원회 사무총장의 출석을 좀 담보해 주시는 것이 어떤가 하는 말씀을 드리고요.
 또 한 가지, 저희들 사무실에서 있었던 내용을 다시 한번 말씀드리면 지난 27일 날 발표된 감사원의 선관위 부정 채용 감사 결과에 따르면 21년도 12월부터 선관위에서 부모와 친인척 간의, 자녀 간의 채용 관계 현황 자료를 이미 만들었답니다. 만들고 또 22년 4월 달에는 그 자료를 업데이트까지 했다는 거예요. 그런데 그동안 감사원에서도 밝혔지만 열한 차례에 걸쳐서 관련 정보가 없다며 허위 답변을 제출한 걸로 드러났다는 발표가 있었지만 저희 사무실에서 직접 확인을 해 보니까 23년도 5월과 6월에 걸쳐 가지고 세 차례 관련된 자료 요구를 했습니다.
 그런데 모두 답변들이 관련 정보가 파악되지 않고 있다, 별도로 관리하고 있지 않다, 유사하게 조사한 실시내역은 확인되지 않는다는 등의 허위 답변이 제출된 사항이 있었습니다. 저는 이런 사항들은 명백하게 허위 공문서 작성 및 동행사뿐만이 아니라 어떻게 보면 공무집행을 방해한 그런 부분도 있지 않나 생각을 하고요.
 선관위의 어떤 국회의 감사나 감시를 무력화하는 이 엄중한 사항에 대해서 위원회 차원에서 고발이라든지 이런 내용들을 검토해 주시기를 강력하게 요청하는 바입니다.
 이상입니다."
423,임시회,제1호,2025년 3월 6일(목),11,신정훈,위원장,(전남 나주시화순군),6713,1,중앙선거관리위원회 위원후보자(김대웅) 인사청문회,(10시04분),배준영 위원님 발언해 주시기 바랍니다.
423,임시회,제1호,2025년 3월 6일(목),12,배준영,위원,(인천 중구강화군옹진군),6700,1,중앙선거관리위원회 위원후보자(김대웅) 인사청문회,(10시04분),"배준영 위원입니다.
 지금 대한민국 중앙선관위가 총체적 난국 상황입니다. 국민에게 선거가 공정하게 관리되는지 수긍할 수 있도록 설득력 있게 설명하지도 못하고 있고요. 부정한 인사 채용이 선관위 내에 심각하게 관행화되어 있습니다. 이에 대해서 우리 국민의힘에서 이 시급하고 중대한 사항에 대해서 수차례 긴급 현안질의를 하자고 요청을 한 것으로 알고 있습니다마는 미루고 미뤄 갖고 결국은 오늘 인사청문회 오전에서조차 이걸 하지 못하는 상황이 됐습니다.
 그래서 존경하는 위원장님께서는 앞으로는 민주당에서 요청한 긴급 현안질의만 그렇게 따박따박 정시에 열어 주지 마시고 국민들이 정말 필요하고 원하는 것에 대해서는 시급하게 열어 주셔서 좀 형평성을 맞춰 주시면 좋겠다라는 건의의 말씀을 드립니다.
 이상입니다."
423,임시회,제1호,2025년 3월 6일(목),13,이달희,위원,(비례대표),6767,1,중앙선거관리위원회 위원후보자(김대웅) 인사청문회,(10시04분),"위원장님, 자료 요구 좀……"
423,임시회,제1호,2025년 3월 6일(목),14,윤건영,위원,(서울 구로구을),6687,1,중앙선거관리위원회 위원후보자(김대웅) 인사청문회,(10시04분),저도 잠깐……
423,임시회,제1호,2025년 3월 6일(목),15,신정훈,위원장,(전남 나주시화순군),6713,1,중앙선거관리위원회 위원후보자(김대웅) 인사청문회,(10시04분),먼저 말씀하십시오.
423,임시회,제1호,2025년 3월 6일(목),16,이달희,위원,(비례대표),6767,1,중앙선거관리위원회 위원후보자(김대웅) 인사청문회,(10시04분),"국민의힘 이달희 위원입니다.
 오늘 인사청문회를 앞두고 중앙선거관리위원회 위원 수당에 대한 규칙을 보면 제5조에 중앙선거관리위원회의 위원장 및 상임이 아닌 위원의 안건검토활동을 지원하기 위해 안건검토수당을 지급하고 있습니다. 회의의안 중 의결사항과 중요 정책 및 현안에 관한 보고사항에 대해 안건별로 각각 회의비를 지급하도록 규정되어 있습니다.
 2023년부터 최근까지 선관위 회의는 총 32차례에 논의된 안건이 260건이고 이 가운데 의결이 필요한 안건이 93건으로 확인이 됩니다.
 관련해서 위원장님, 위원들에게 지급한 위원회 그리고 회의별 안건수당 지급내역을 오후 질의 전에 제출해 주실 것을 요청합니다.
 이상입니다."
423,임시회,제1호,2025년 3월 6일(목),17,신정훈,위원장,(전남 나주시화순군),6713,1,중앙선거관리위원회 위원후보자(김대웅) 인사청문회,(10시04분),윤건영 위원님 한말씀 해 주십시오.
423,임시회,제1호,2025년 3월 6일(목),18,윤건영,위원,(서울 구로구을),6687,1,중앙선거관리위원회 위원후보자(김대웅) 인사청문회,(10시04분),"윤건영입니다.
 국민의힘 위원님께서 선관위 채용비리 관련 현안질의에 대한 필요성을 강조하셨습니다. 민주당은 전적으로 동의합니다. 한 번이 아니라 열 번, 스무 번도 해야 된다고 생각합니다.
 다만 지금의 현안이 선관위 채용비리만 있냐라는 걸 되묻고 싶습니다. 정신 못 차리고 승진 잔치를 벌이고 있는 경찰에 대해서도 국민들은 많은 의구심을 가지고 있습니다. 보은 인사, 알박기 인사라고 비난하고 있지 않습니까?
 그리고 면전에서 이런 말씀 드리기는 좀 곤란합니다만 이철규 국민의힘 의원의 자제분에 대한 마약 관련 수사에 대해서도 늑장 수사라는 의혹들이 제기되고 있습니다. 많은 국민들이 의구심을 가지고 있지요. 이런 걸 다 같이 함께 하자는 겁니다. 인사청문회에 집중하고 인사청문회 이후에 하루가 됐든 이틀이 됐든 3일이 됐든 얼마든지 했으면 좋겠습니다. 자료 요청도 저는 얼마든지 하면 좋고요. 앞서 존경하는 이만희 위원님 하셨던 고발 얼마든지 할 수 있습니다. 다 합시다.
 다만 왜 채용비리만 그렇게 하냐는 겁니다. 이철규 의원의 자제분에 대한 늑장 수사, 봐주기 수사 하고요. 경찰 알박기 인사도 하고요. 다 했으면 좋겠습니다. 그게 시한이 많이 걸린다고 그러면 이틀, 3일 하면 되지 않겠습니까? 그게 국회의원이 해야 될 일 아니겠습니까?
 그리고 이 자리에서 제가 최근에 제보받은 내용을 말씀드리면 소방청에서도 경찰청과 똑같은 보은 인사를 하고 있다라는 겁니다. 소방청장 다음, 즉 소방청 서열 2위 자리인 소방정감 두 자리를 인사를 추진하고 있다고 합니다. 승진한 지 1년밖에 안 된 용산발 인사, 보은 인사를 한다라는 제보를 받았습니다. 심지어 그분은, 대상 되는 그분은 이상민 행안부장관 시절에 소방정책관을 해서 용산발 인사라고 소방청 내에서는 소문이 자자하다고 합니다. 특히나 이번 이상민 장관의 단전·단수 조치에서 전화 사실을 공개했던 서울본부장과 경기본부장을 내쫓기 위한 것 아니냐라는 그런 우려 섞인 걱정도 있습니다.
 이런 것까지 저는 다 했으면 좋겠습니다. 얼마든지 할 수 있으니까요. 제가 존경하는 조은희 간사님께도 말씀드렸습니다. 오늘 인사청문회가 끝나고 내일이든 다음 주 월요일이든, 이틀이든 3일이든 다 하자고 했는데 부정적인 답변을, 그에 대한 답을 안 주셨습니다. 오늘이라도 분명하게 답을 해 주셨으면 좋겠습니다. 
 저희들은 선관위 부정 채용 의혹뿐만이 아니라 최근에 제기되고 있는 우리 국회 행안위와 관련돼 있는 주요 현안에 대한 현안질의 전혀 마다할 이유 없다는 걸 다시 한번 밝혀 드립니다.
 이상입니다."
423,임시회,제1호,2025년 3월 6일(목),19,조은희,위원,(서울 서초구갑),6629,1,중앙선거관리위원회 위원후보자(김대웅) 인사청문회,(10시04분),"조은희 간사입니다.
 존경하는 윤건영 간사님께서 굉장히 좋은 말씀을 해 주셔서 저는 전적으로 동의합니다. 다만 섞어찌개를 하지 말자, 섞어찌개로 물타기를 하지 말자는 말씀을 드립니다.
 자칫하면 민주당이 독립적인 헌법기관인 선관위에서 무수하게 벌어진 각종 특혜 채용에 대해서 심각성을 간과하고 있다는 오해를 받을 수 있으니까 이 부분은 선관위는 선관위대로 따로 하고 또 야당이 얘기하시는 경찰청·소방청에 대한 현안질의는 또 따로 하자는 제안을 제가 어제 위원장실에 드렸습니다.
 현재 국민들은 선관위 전체가 부패와 부정의 온상이다라고 생각하고 있습니다. 그래서 경찰청·소방청에 대한 현안질의와 선관위에 대한 현안질의를 같이 희석시켜서 물타기한다는 오해를 받지 않고, 선관위가 워낙 중요하니까 2일이든 3일이든 선관위 단독으로 하고 또 경찰청·소방청에 대해서 현안질의를 하면 된다고 생각합니다.
 또 존경하는 이만희 위원님과 배준영 위원님도 얘기하셨다시피 위원장님께서는 민주당이 요구하는 현안질의는 즉각적으로 받아 주신 전례도 있지 않습니까? 그래서 분리해서 현안질의를 할 수 있도록 그렇게 해 주시기를 건의드립니다.
 또 제가 이런 말씀을 드려야 하나 이런 생각이 들지만, 민주당이 선관위를 감싸고 돈다는 의혹에 대해서 저도 믿고 싶지 않지만 한말씀 드리겠습니다.
 23년 5월 초에 선관위 채용비리가 처음 터지고 나서 5월 16일에 행안위 현안질의를 개최한 바 있습니다. 그 당시 민주당에서는 똑같이 경찰청, 행안부도 같이 현안질의 하자고 물타기로 오해받을 수 있는 제안을 했습니다만 그냥 선관위 현안질의를 했는데, 제가 그 당시 5월 24일 속기록을 찾아보니―구체적으로 실명은 거론하지 않겠습니다―한 민주당 위원께서는 박찬진 총장과 송봉섭 차장이 자체 조사기구로 조사하고 있으니 독립기구 흔들면 안 된다라고 실드까지 치셨습니다. 
 그런데 이 두 분 오늘 증인으로 채택돼서 국회에 와서 그동안 위증한 것과, 또 아빠 찬스를 써서 불법 채용한 당사자 아닙니까? 이분들한테 맡기자, 조사기구를 하자 이렇게 제안까지 하셨습니다. 돌이켜 놓고 보면 고양이 앞에 생선을 맡긴 꼴 아니겠습니까? 채용비리 의혹 당사자들이 셀프 감사를 주도했으니 제대로 될 턱이 없었습니다. 지난 2년 동안 선관위의 현실은 달라지지 않았습니다.
 위원장님, 지금 이렇게 또 섞어찌개를 할 경우에는 2년 전과 똑같은 상황이 재발됩니다. 부디 따로따로 현안질의를 할 수 있도록 의사진행을 해 주실 것을 부탁드리고.
 자료 요구 있는데 해도 되겠습니까, 아니면 따로 할까요?"
423,임시회,제1호,2025년 3월 6일(목),20,신정훈,위원장,(전남 나주시화순군),6713,1,중앙선거관리위원회 위원후보자(김대웅) 인사청문회,(10시04분),다음에 하시지요.
423,임시회,제1호,2025년 3월 6일(목),21,조은희,위원,(서울 서초구갑),6629,1,중앙선거관리위원회 위원후보자(김대웅) 인사청문회,(10시04분),"예, 그러겠습니다."
423,임시회,제1호,2025년 3월 6일(목),22,신정훈,위원장,(전남 나주시화순군),6713,1,중앙선거관리위원회 위원후보자(김대웅) 인사청문회,(10시04분),자료 요구는 충분히 서면질의로 할 수 있지요?
423,임시회,제1호,2025년 3월 6일(목),23,조은희,위원,(서울 서초구갑),6629,1,중앙선거관리위원회 위원후보자(김대웅) 인사청문회,(10시04분),아닙니다.
423,임시회,제1호,2025년 3월 6일(목),24,신정훈,위원장,(전남 나주시화순군),6713,1,중앙선거관리위원회 위원후보자(김대웅) 인사청문회,(10시04분),아닙니까?
423,임시회,제1호,2025년 3월 6일(목),25,윤건영,위원,(서울 구로구을),6687,1,중앙선거관리위원회 위원후보자(김대웅) 인사청문회,(10시04분),"자료 요구는 조금 이따 하시고. 
 저쪽에서 3명이나 이야기했는데 우리도 이야기 좀 해야 될 것 같은데요."
423,임시회,제1호,2025년 3월 6일(목),26,신정훈,위원장,(전남 나주시화순군),6713,1,중앙선거관리위원회 위원후보자(김대웅) 인사청문회,(10시04분),그러면 한병도 위원님 발언해 주시기 바랍니다.
