session,session_type,meeting_no,date,speech_order,speaker_name,speaker_position,speaker_area,data_mem_id,agenda_item_orders,agenda_item_titles,agenda_item_times,speech_text
423,임시회,제1호,2025년 3월 6일(목),827,정춘생,위원,(비례대표),6855,1,중앙선거관리위원회 위원후보자(김대웅) 인사청문회,(10시04분),"사과할 부분은 아니라고 생각을 하고요. 
 저는 선관위 사무총장 출신이 특정 정당에 가입해서 입후보하는 것이 문제 있다라는 문제를 제기하는 과정에서 불가피하게 언급할 수밖에 없었다는 점을 말씀을 드리고요. 
 대개 지역구 선거사무소 갈 때는 지지자들도 가지만 눈도장을 찍기 위해서도 많이 가시지요. 그런 의미에서 언급이 된 겁니다. 이 부분에 대해서 사과한다는 것 저는 받아들일 수 없습니다. 
 이상입니다."
423,임시회,제1호,2025년 3월 6일(목),828,신정훈,위원장,(전남 나주시화순군),6713,1,중앙선거관리위원회 위원후보자(김대웅) 인사청문회,(10시04분),"그 정도로 하시지요. 
 동료 위원님들하고 관련돼 있는 부분에 대해서는 최대한 절제하면서 발언해 주셨으면 좋겠다 이런 말씀 드리고요. 
 다만 해당된 그 선관위 사무총장은 소쿠리 투표의 책임을 지고 물러난 사람입니다. 그런 사람들이 특정 정당, 특히 정부 여당에 가입했다는 것도 좀 우습고 또 후보자로 출마했다는 것은 더더욱 우습습니다. 
 그런 문제들에 대해서는 앞으로 우리가 제도적으로 개선 대책을 세워 나가면서 앞으로 선관위가 더 이상 정치적인 논란에 또 휘말리지 않도록 하는 것이 필요하겠다 이렇게 생각합니다."
423,임시회,제1호,2025년 3월 6일(목),829,조은희,위원,(서울 서초구갑),6629,1,중앙선거관리위원회 위원후보자(김대웅) 인사청문회,(10시04분),"제가 한말씀 드리겠습니다, 위원장님."
423,임시회,제1호,2025년 3월 6일(목),830,신정훈,위원장,(전남 나주시화순군),6713,1,중앙선거관리위원회 위원후보자(김대웅) 인사청문회,(10시04분),그만하십시다.
423,임시회,제1호,2025년 3월 6일(목),831,조은희,위원,(서울 서초구갑),6629,1,중앙선거관리위원회 위원후보자(김대웅) 인사청문회,(10시04분),기회 좀 주십시오.
423,임시회,제1호,2025년 3월 6일(목),832,신정훈,위원장,(전남 나주시화순군),6713,1,중앙선거관리위원회 위원후보자(김대웅) 인사청문회,(10시04분),그만하십시다. 충분히……
423,임시회,제1호,2025년 3월 6일(목),833,조은희,위원,(서울 서초구갑),6629,1,중앙선거관리위원회 위원후보자(김대웅) 인사청문회,(10시04분),주십시오. 일방적입니다.
423,임시회,제1호,2025년 3월 6일(목),834,위성곤,위원,(제주 서귀포시),6694,1,중앙선거관리위원회 위원후보자(김대웅) 인사청문회,(10시04분),하면 또 저희가 해야 되잖아요.
423,임시회,제1호,2025년 3월 6일(목),835,신정훈,위원장,(전남 나주시화순군),6713,1,중앙선거관리위원회 위원후보자(김대웅) 인사청문회,(10시04분),잠시 정회를 했다가……
423,임시회,제1호,2025년 3월 6일(목),836,조은희,위원,(서울 서초구갑),6629,1,중앙선거관리위원회 위원후보자(김대웅) 인사청문회,(10시04분),"아니, 또 하시지요. 30초만 주십시오, 서로서로."
423,임시회,제1호,2025년 3월 6일(목),837,신정훈,위원장,(전남 나주시화순군),6713,1,중앙선거관리위원회 위원후보자(김대웅) 인사청문회,(10시04분),그만하십시다.
423,임시회,제1호,2025년 3월 6일(목),838,조은희,위원,(서울 서초구갑),6629,1,중앙선거관리위원회 위원후보자(김대웅) 인사청문회,(10시04분),이거는 배준영 위원님 명예에 관한 것이기 때문에 해야 됩니다.
423,임시회,제1호,2025년 3월 6일(목),839,모경종,위원,(인천 서구병),6786,1,중앙선거관리위원회 위원후보자(김대웅) 인사청문회,(10시04분),신상발언하셨잖아요.
423,임시회,제1호,2025년 3월 6일(목),840,조은희,위원,(서울 서초구갑),6629,1,중앙선거관리위원회 위원후보자(김대웅) 인사청문회,(10시04분),신상발언……
423,임시회,제1호,2025년 3월 6일(목),841,신정훈,위원장,(전남 나주시화순군),6713,1,중앙선거관리위원회 위원후보자(김대웅) 인사청문회,(10시04분),"아니요, 충분히 정춘생 위원님이 발언한 내용에 대해서 소위 말해서 국회 윤리라든가 이런 문제에 대해서 전혀 벗어남이 없었다고 생각합니다. 특별히 특정 위원을 공격하는 그런 것이 아니었는데 그런 자료가 쓰여서……"
423,임시회,제1호,2025년 3월 6일(목),842,조은희,위원,(서울 서초구갑),6629,1,중앙선거관리위원회 위원후보자(김대웅) 인사청문회,(10시04분),"제가 증인이어서 그렇습니다. 위원장님, 주십시오."
423,임시회,제1호,2025년 3월 6일(목),843,신정훈,위원장,(전남 나주시화순군),6713,1,중앙선거관리위원회 위원후보자(김대웅) 인사청문회,(10시04분),"그러면 계속할까요, 계속?"
423,임시회,제1호,2025년 3월 6일(목),844,조은희,위원,(서울 서초구갑),6629,1,중앙선거관리위원회 위원후보자(김대웅) 인사청문회,(10시04분),"예, 하십시다."
423,임시회,제1호,2025년 3월 6일(목),845,신정훈,위원장,(전남 나주시화순군),6713,1,중앙선거관리위원회 위원후보자(김대웅) 인사청문회,(10시04분),"예, 하세요."
423,임시회,제1호,2025년 3월 6일(목),846,조은희,위원,(서울 서초구갑),6629,1,중앙선거관리위원회 위원후보자(김대웅) 인사청문회,(10시04분),"기회 주셔서 감사합니다.
 저는 세자 논란이 있는 김세환 전 사무총장이 우리 배준영 위원님 지역구에 출마할 의사가 있다는 제보를 받았습니다, 당시에. 너무 놀라서 배준영 위원께 전화드렸습니다, 그 사실 알고 있냐고. 모르고 계시더라고요.
 그런데 지금 현행법에 의해서 본인이 가고 본인이 출마하고 이런 거를 누가 막을 수 있습니까? 그런데 마치 그렇게 말하면…… 세자 논란 일으킨 그 김세환 전 사무총장 누가 임명했습니까? 문재인 정부 때 임명한 사람 아닙니까? 그렇지만 우리는 그 말 안 하고 있습니다."
423,임시회,제1호,2025년 3월 6일(목),847,신정훈,위원장,(전남 나주시화순군),6713,1,중앙선거관리위원회 위원후보자(김대웅) 인사청문회,(10시04분),하세요. 하시라고.
423,임시회,제1호,2025년 3월 6일(목),848,조은희,위원,(서울 서초구갑),6629,1,중앙선거관리위원회 위원후보자(김대웅) 인사청문회,(10시04분),안 하고 있습니다.
423,임시회,제1호,2025년 3월 6일(목),849,신정훈,위원장,(전남 나주시화순군),6713,1,중앙선거관리위원회 위원후보자(김대웅) 인사청문회,(10시04분),"자, 정춘생 위원님이……"
423,임시회,제1호,2025년 3월 6일(목),850,위성곤,위원,(제주 서귀포시),6694,1,중앙선거관리위원회 위원후보자(김대웅) 인사청문회,(10시04분),김세환 후보 국민의힘 당원이시지요? 말씀하세요.
423,임시회,제1호,2025년 3월 6일(목),851,정춘생,위원,(비례대표),6855,1,중앙선거관리위원회 위원후보자(김대웅) 인사청문회,(10시04분),"아니, 손가락을 보지 마시고 하늘을 좀 봐 주십시오, 무슨 얘기를 하고자 했는지."
423,임시회,제1호,2025년 3월 6일(목),852,조은희,위원,(서울 서초구갑),6629,1,중앙선거관리위원회 위원후보자(김대웅) 인사청문회,(10시04분),그러니까 위원 이름을 거명하시면 안 됩니다.
423,임시회,제1호,2025년 3월 6일(목),853,정춘생,위원,(비례대표),6855,1,중앙선거관리위원회 위원후보자(김대웅) 인사청문회,(10시04분),그러면 심사에서 걸렀어야지요. 사전 서류 심사하지 않습니까? 심사에서 걸렀어야지요.
423,임시회,제1호,2025년 3월 6일(목),854,조은희,위원,(서울 서초구갑),6629,1,중앙선거관리위원회 위원후보자(김대웅) 인사청문회,(10시04분),그리고 출마 신청한 사람들 전부 다 자유 경선 했습니다.
423,임시회,제1호,2025년 3월 6일(목),855,정춘생,위원,(비례대표),6855,1,중앙선거관리위원회 위원후보자(김대웅) 인사청문회,(10시04분),문제가 있는 놈으로 심사에서 걸렀어야지요.
423,임시회,제1호,2025년 3월 6일(목),856,조은희,위원,(서울 서초구갑),6629,1,중앙선거관리위원회 위원후보자(김대웅) 인사청문회,(10시04분),"왜냐하면 경선 안 하면 무소속으로 출마하니까요.
 그런데 그걸 가지고 배준영 위원 사진을 내는 거는 프레임 씌우기입니다."
423,임시회,제1호,2025년 3월 6일(목),857,위성곤,위원,(제주 서귀포시),6694,1,중앙선거관리위원회 위원후보자(김대웅) 인사청문회,(10시04분),무슨 프레임이에요?
423,임시회,제1호,2025년 3월 6일(목),858,조은희,위원,(서울 서초구갑),6629,1,중앙선거관리위원회 위원후보자(김대웅) 인사청문회,(10시04분),왜 거기 사진을 냅니까?
423,임시회,제1호,2025년 3월 6일(목),859,정춘생,위원,(비례대표),6855,1,중앙선거관리위원회 위원후보자(김대웅) 인사청문회,(10시04분),"아니, 특정 정당에 가서는 안 된다 이 얘기예요."
423,임시회,제1호,2025년 3월 6일(목),860,조은희,위원,(서울 서초구갑),6629,1,중앙선거관리위원회 위원후보자(김대웅) 인사청문회,(10시04분),거기에 대해서 왜 사과를 못 합니까?
423,임시회,제1호,2025년 3월 6일(목),861,정춘생,위원,(비례대표),6855,1,중앙선거관리위원회 위원후보자(김대웅) 인사청문회,(10시04분),제 질의의 본질을 좀 보십시오.
423,임시회,제1호,2025년 3월 6일(목),862,조은희,위원,(서울 서초구갑),6629,1,중앙선거관리위원회 위원후보자(김대웅) 인사청문회,(10시04분),질문 본질을 오해받지 않게 하셔야 됩니다.
423,임시회,제1호,2025년 3월 6일(목),863,정춘생,위원,(비례대표),6855,1,중앙선거관리위원회 위원후보자(김대웅) 인사청문회,(10시04분),그게 왜 사과입니까? 사과할 사안입니까?
423,임시회,제1호,2025년 3월 6일(목),864,조은희,위원,(서울 서초구갑),6629,1,중앙선거관리위원회 위원후보자(김대웅) 인사청문회,(10시04분),사과하십시오.
423,임시회,제1호,2025년 3월 6일(목),865,정춘생,위원,(비례대표),6855,1,중앙선거관리위원회 위원후보자(김대웅) 인사청문회,(10시04분),"사과할 사안이 아니라고 생각합니다, 저는"
423,임시회,제1호,2025년 3월 6일(목),866,신정훈,위원장,(전남 나주시화순군),6713,1,중앙선거관리위원회 위원후보자(김대웅) 인사청문회,(10시04분),"자, 이제 멈춰 주세요. 멈춰 주세요.
 윤건영 위원님 의사진행발언하세요."
423,임시회,제1호,2025년 3월 6일(목),867,윤건영,위원,(서울 구로구을),6687,1,중앙선거관리위원회 위원후보자(김대웅) 인사청문회,(10시04분),"존경하는 배준영 위원님이 질의 과정에서 사진이 인용된 것 같습니다. 저희가 말하려고 하는 것은 선관위 사무총장 출신으로 그리고 부주의한 행위로 인해서 사실상 경질됐던 사람이 정당의 후보가 되고 또 보궐선거에 출마하려고 했다라는 사실을 이야기하는 것 아니겠습니까, 존경하는 정춘생 위원님이 지적하신 내용은.
 그 부분에 대해서는 여야의 문제가 아닌 것 같습니다. 어느 당이든, 여당이든 야당이든 그런 사람 받으면 안 되는 거지요. 그게 상식 아닙니까? 경질됐던 사람에 대해서……
 그런데 제가 알기로는 이미 1차 경선도 통과된 걸로 알고 있고요. 방금 조은희 간사님께서 어느 정부 때 임명했냐…… 그러면 존경하는 지금 현직 사무총장님은 윤석열 대통령이 임명하셨지 않습니까. 그렇지요? 그런데 존경하는 사무총장님 매번 하시던 말씀이 있습니다, 당부처럼 하시던 말씀. ‘선관위는 법적으로 독립된 기관이다. 윤석열 대통령이 나를 임명하지 않았다’라고 이야기하십니다.
 그런 걸 따지자는 게 아니잖아요. 손가락이 하늘을 가르키고 그러면 하늘을 봐야지요. 왜 손끝을 봅니까? 이거는 싸우자는 것도 아니고요. 문제가 있는 사무총장에 대해서, 전 선관위 사무총장의 행태에 대해서 이야기하는데 뭘 두둔하십니까? 두둔할 일 아니잖아요. 저희도 그 문제 제기를 적절히 지적……"
423,임시회,제1호,2025년 3월 6일(목),868,조은희,위원,(서울 서초구갑),6629,1,중앙선거관리위원회 위원후보자(김대웅) 인사청문회,(10시04분),왜 말씀을 만드십니까? 언제 두둔했습니까?
423,임시회,제1호,2025년 3월 6일(목),869,윤건영,위원,(서울 구로구을),6687,1,중앙선거관리위원회 위원후보자(김대웅) 인사청문회,(10시04분),지금 하는 게 두둔하는 거여서 그러는 겁니다.
423,임시회,제1호,2025년 3월 6일(목),870,조은희,위원,(서울 서초구갑),6629,1,중앙선거관리위원회 위원후보자(김대웅) 인사청문회,(10시04분),김세환 전 총장에 대해서 왜 두둔한다고 하십니까?
423,임시회,제1호,2025년 3월 6일(목),871,윤건영,위원,(서울 구로구을),6687,1,중앙선거관리위원회 위원후보자(김대웅) 인사청문회,(10시04분),그러니까요. 제 이야기 중이잖아요. 아니면 가만히 있으면 되지 저희가 지금 뭐……
423,임시회,제1호,2025년 3월 6일(목),872,조은희,위원,(서울 서초구갑),6629,1,중앙선거관리위원회 위원후보자(김대웅) 인사청문회,(10시04분),또 발언 기회를 주실 줄 압니까?
423,임시회,제1호,2025년 3월 6일(목),873,윤건영,위원,(서울 구로구을),6687,1,중앙선거관리위원회 위원후보자(김대웅) 인사청문회,(10시04분),정춘생 위원이나 저희 야당에서 다른 이야기 하는 게 아니잖아요.
423,임시회,제1호,2025년 3월 6일(목),874,조은희,위원,(서울 서초구갑),6629,1,중앙선거관리위원회 위원후보자(김대웅) 인사청문회,(10시04분),그러면 사진 내면 안 됩니다.
423,임시회,제1호,2025년 3월 6일(목),875,윤건영,위원,(서울 구로구을),6687,1,중앙선거관리위원회 위원후보자(김대웅) 인사청문회,(10시04분),전 사무총장에 대해서 이야기하고 있는 것 아닙니까? 그런데 왜 지금 발끈해 가지고 이야기를 합니까? 그러면 두둔하는 거지요.
423,임시회,제1호,2025년 3월 6일(목),876,조은희,위원,(서울 서초구갑),6629,1,중앙선거관리위원회 위원후보자(김대웅) 인사청문회,(10시04분),발끈하게 됐지요.
423,임시회,제1호,2025년 3월 6일(목),877,윤건영,위원,(서울 구로구을),6687,1,중앙선거관리위원회 위원후보자(김대웅) 인사청문회,(10시04분),제 발언 시간에 끼어들지 마세요. 그렇게 하시면 안 돼……
423,임시회,제1호,2025년 3월 6일(목),878,조은희,위원,(서울 서초구갑),6629,1,중앙선거관리위원회 위원후보자(김대웅) 인사청문회,(10시04분),위원장님이 발언 기회를 안 주십니다.
423,임시회,제1호,2025년 3월 6일(목),879,모경종,위원,(인천 서구병),6786,1,중앙선거관리위원회 위원후보자(김대웅) 인사청문회,(10시04분),그러면 이따가 다시 말씀하시고요.
423,임시회,제1호,2025년 3월 6일(목),880,윤건영,위원,(서울 구로구을),6687,1,중앙선거관리위원회 위원후보자(김대웅) 인사청문회,(10시04분),"이따가 하셔야지요. 발언 기회 안 준다고 무턱대고 막 합니까? 그렇게 합니까, 정치를?"
423,임시회,제1호,2025년 3월 6일(목),881,조은희,위원,(서울 서초구갑),6629,1,중앙선거관리위원회 위원후보자(김대웅) 인사청문회,(10시04분),민주당 위원장이시잖아요.
423,임시회,제1호,2025년 3월 6일(목),882,모경종,위원,(인천 서구병),6786,1,중앙선거관리위원회 위원후보자(김대웅) 인사청문회,(10시04분),그게 지금 무슨 말씀이세요?
423,임시회,제1호,2025년 3월 6일(목),883,윤건영,위원,(서울 구로구을),6687,1,중앙선거관리위원회 위원후보자(김대웅) 인사청문회,(10시04분),민주당 위원장이라고 정치를……
423,임시회,제1호,2025년 3월 6일(목),884,조은희,위원,(서울 서초구갑),6629,1,중앙선거관리위원회 위원후보자(김대웅) 인사청문회,(10시04분),민주당 편드시잖아요!
423,임시회,제1호,2025년 3월 6일(목),885,윤건영,위원,(서울 구로구을),6687,1,중앙선거관리위원회 위원후보자(김대웅) 인사청문회,(10시04분),지금 하고 있는 행태가 문제가 있어서 말씀하는 겁니다.
423,임시회,제1호,2025년 3월 6일(목),886,신정훈,위원장,(전남 나주시화순군),6713,1,중앙선거관리위원회 위원후보자(김대웅) 인사청문회,(10시04분),정리해 주세요.
423,임시회,제1호,2025년 3월 6일(목),887,윤건영,위원,(서울 구로구을),6687,1,중앙선거관리위원회 위원후보자(김대웅) 인사청문회,(10시04분),이상입니다.
423,임시회,제1호,2025년 3월 6일(목),888,신정훈,위원장,(전남 나주시화순군),6713,1,중앙선거관리위원회 위원후보자(김대웅) 인사청문회,(10시04분),"잠시 정회를 했다가, 생중계가 다시 재개될 수 있는 약 20분 정도 휴회를 했다가 속개하도록 하겠습니다.
 정회를 선포합니다."
423,임시회,제1호,2025년 3월 6일(목),889,신정훈,위원장,(전남 나주시화순군),6713,1,중앙선거관리위원회 위원후보자(김대웅) 인사청문회,(10시04분),"의석을 정돈해 주시기 바랍니다.
 성원이 되었으므로 회의를 속개하겠습니다.
 이어서 보충질의를 시작하겠습니다.
 질의 시간은 답변 시간을 포함해서 5분입니다.
 먼저 이달희 위원님 질의해 주시기 바랍니다."
423,임시회,제1호,2025년 3월 6일(목),890,이달희,위원,(비례대표),6767,1,중앙선거관리위원회 위원후보자(김대웅) 인사청문회,(10시04분),"오전 질의에 이어서, 존경하는 한병도 위원님께서 선관위원들하고 1시간 30분 토론해 보니까 이해가 되더라 하셨는데, 저도 한 2시간 가까이 보고도 받고 토론을 했었는데 이해가 다 됐던 부분이 감사원 감사보고서 나오고 깜짝 놀랐습니다. 우리를 이렇게 이해를 다 시키고 아무 일 없고 이랬다고 했는데 어떻게 이런 비리 사실을 감사원 지적이 됐는데……
 이 부분에서는 사실 고위직 비리이기 때문에 직원들이 함부로 바깥에 발설을 할 수가 없었던 것입니다, 후보님. 여기 자체에서, 내부에서도 특혜 채용에 대해서 투서가 접수되어도 ‘우리 가족회사잖아. 선거만 잘 치르면 되지’라는 얘기로 무마시켰다고 합니다.
 이 부분에 대해서 정말 그동안 바깥에 와서 국회에 와서 2시간 토론하면서도 고위직 비리에 대해서는 말할 수 없었던 선거관리위원회 직원들에 대한 고충 이런 부분에 대해서, 이 채용비리에 대해서는 반드시 단죄하고 넘어가야 되지, 그 남아 있는 직원들 전체가 매도되는 이런 상황을 청산해야 된다고 생각합니다. 동의하십니까?"
423,임시회,제1호,2025년 3월 6일(목),891,김대웅,중앙선거관리위원회위원후보자,,0,1,중앙선거관리위원회 위원후보자(김대웅) 인사청문회,(10시04분),"예, 동의합니다."
423,임시회,제1호,2025년 3월 6일(목),892,이달희,위원,(비례대표),6767,1,중앙선거관리위원회 위원후보자(김대웅) 인사청문회,(10시04분),"그리고 제가 이십여 년 정당에서 사무처로 일을 했기 때문에 행안위 질의에서 선관위 부실선거에 대해서 가장 많은 시간을 할애해서 현안질의를 했던 것 같습니다. 총장님, 맞습니까? 
 그래서 저 나름으로 전자개표기도 자동분류기로 하지 왜 이름을 전자개표기로 해서 국민을 헷갈리게 하느냐 이런 질의까지 한 적도 있습니다. 지금 말씀드리면 아까 우리 존경하는 위원님들 말씀에 47% 이상의 국민들이 선관위 업무가 불공정하다, 불공정하다고 하는 것은 선거 부실에 더해서 아까 말씀드린 것처럼 부정까지 막 이렇게 연결되는 듯한 느낌이 들지 않습니까?
 그러면, 지난 현안질의에도 제가 말씀드렸습니다. 지금 우리나라 사회적 갈등 비용이 1년에 한 200조 가까이 되다가 이 선거 관련해서 나오고부터는 거의 300조에 가까운 통계 자료가 나오고 또 특히 탄핵 정국에는 1700조, 이번에 선거관리위원 부정 이 문제로 갈등 비용을 더 많이 치를 것 같습니다. 위원님 어떻게 생각하십니까?"
423,임시회,제1호,2025년 3월 6일(목),893,김대웅,중앙선거관리위원회위원후보자,,0,1,중앙선거관리위원회 위원후보자(김대웅) 인사청문회,(10시04분),저도 사회적 갈등……
423,임시회,제1호,2025년 3월 6일(목),894,이달희,위원,(비례대표),6767,1,중앙선거관리위원회 위원후보자(김대웅) 인사청문회,(10시04분),그러면 이 사회적 갈등 비용 털고 가야 되지 않겠습니까?
423,임시회,제1호,2025년 3월 6일(목),895,김대웅,중앙선거관리위원회위원후보자,,0,1,중앙선거관리위원회 위원후보자(김대웅) 인사청문회,(10시04분),"예, 맞습니다."
423,임시회,제1호,2025년 3월 6일(목),896,이달희,위원,(비례대표),6767,1,중앙선거관리위원회 위원후보자(김대웅) 인사청문회,(10시04분),"그래서 지난번에, 이거는 지금 국민의힘 전신인 정당이 패소한 겁니다마는 그때 이회창, 노무현 때 전자개표기 조작에 의해서 재검표한 적이 있습니다. 개표소 약 40% 가까운 80곳을 재검표했는데 당락에는 차이가 없었습니다. 그때 비용이 5000만 원 가까이 들고 8000명 정도가 동원되었다고 합니다. 저도 그 8000명 중의 한 명으로 가서 재검표에 참여한 적이 있습니다.
 이런 인원의 참여와 돈을 들여서 이 사회의 갈등 비용을 줄이고 가야 되겠습니까, 아니면 그대로 이 47%, 50%에 가까운 반 국민이 이렇게 부실하다고 하고 있는데 사회 갈등 비용을 치르고 계속 우리는 아무런 그것 없다고 가야 되겠습니까?
 그래서 저는 강력하게 위원님, 선거관리위원님들 다 모이셔서 이번에 서버 검증을 해야 된다고 봅니다. 전문가들은 한 두세 달만 하면 그 안에서 해킹이 있었는지 어떤 프로그램이 심어졌다 지워졌는지 다 추적할 수 있다고 합니다. 지금 저는 이 부분에서 선거부정으로 인해서―부정이 되었다고 하는 게 아니고―이렇게 불신이 있으니까 돈을 들여서, 시간을 들여서라도 털고 가자는 겁니다.
 야당의 위원님들이 음모론 나올 때마다 그러면 돈 쓰고 따라다니면서 해야 되나…… 국민의 47%입니다. 그리고 사회적 갈등 비용 너무 큽니다. 이 부분에 대해서 위원님 어떻게 생각하십니까? 
 (신정훈 위원장, 윤건영 간사와 사회교대)"
423,임시회,제1호,2025년 3월 6일(목),897,김대웅,중앙선거관리위원회위원후보자,,0,1,중앙선거관리위원회 위원후보자(김대웅) 인사청문회,(10시04분),"일단 사회적 갈등을 일으키는 데 선거가 또 문제가 됐다는 것은 저희 굉장히 안타깝게 생각을 하고 있습니다. 그래서 갈등을 해소하기 위한 여러 가지 장치를 마련하는 것은 맞다고 생각하고 있습니다.
 말씀하신 서버 검증은 제가 정확히 말씀드릴 수는 없지만 어떤 적법한 절차나 재판 과정이나 그런 걸 통해서 허용이 된다면 그것은 가능하지 않을까 이렇게 생각을 하고 있습니다."
423,임시회,제1호,2025년 3월 6일(목),898,이달희,위원,(비례대표),6767,1,중앙선거관리위원회 위원후보자(김대웅) 인사청문회,(10시04분),"위원장님, 1분만 더 쓰겠습니다."
423,임시회,제1호,2025년 3월 6일(목),899,윤건영,위원장대리,(서울 구로구을),6687,1,중앙선거관리위원회 위원후보자(김대웅) 인사청문회,(10시04분),1분 더 드리십시오.
423,임시회,제1호,2025년 3월 6일(목),900,이달희,위원,(비례대표),6767,1,중앙선거관리위원회 위원후보자(김대웅) 인사청문회,(10시04분),"사무총장님, 국회 행정법상 우리 행안위 소속 선거관리위원회잖아요. 여야 간사님들께서 합의하면 이 부분에 대해서 동의하시겠습니까?"
