session,session_type,meeting_no,date,speech_order,speaker_name,speaker_position,speaker_area,data_mem_id,agenda_item_orders,agenda_item_titles,agenda_item_times,speech_text
429,정기회,제2호,2025년 9월 10일(수),1,신정훈,위원장,(전남 나주시화순군),6713,,,,"의석을 정돈해 주시기 바랍니다.
 조사를 재개하기에 앞서 9월 23일 청문회의 증인·참고인 출석요구의 건을 의결코자 제429회 국회(정기회) 제2차 행정안전위원회를 개회하겠습니다."
429,정기회,제2호,2025년 9월 10일(수),2,신정훈,위원장,(전남 나주시화순군),6713,1,증인·참고인 출석요구의 건,,"그러면 의사일정 제1항 국정조사 증인·참고인 출석요구의 건을 상정합니다.
 국정감사 및 조사에 관한 법률 제10조에 따라 9월 23일 청문회에 출석할 증인 22명, 참고인 5명을 배부해 드린 유인물과 같이 간사 간 합의하였습니다. 이와 같이 출석을 요구코자 하는데 위원님 여러분 이의 없으십니까?
 (「예」 하는 위원 있음)
 이의가 없으시므로 가결되었음을 선포합니다.
 그러면 전체회의의 정회를 선포합니다."
429,정기회,제2호,2025년 9월 10일(수),3,신정훈,위원장,(전남 나주시화순군),6713,1,증인·참고인 출석요구의 건,,"의석을 정돈해 주시기 바랍니다.
 조사를 재개하기에 앞서 전체회의를 잠시 속개하겠습니다."
429,정기회,제2호,2025년 9월 10일(수),4,신정훈,위원장,(전남 나주시화순군),6713,2,o 의사일정 변경의 건 / 증인·참고인 출석요구 변경의 건,,"그러면 의사일정 제2항 증인·참고인 출석요구 변경의 건을 상정합니다.
 오늘 오후 의결한 증인 중 성명 기재에 오류가 있는 증인의 성명을 배부해 드린 유인물과 같이 변경하여 의결코자 하는데 위원님 여러분 이의 없으십니까?
 (「예」 하는 위원 있음)
 가결되었음을 선포합니다.
(증인 및 참고인 명단은 끝에 실음) 그러면 전체회의를 정회하고 국정조사의 재개를 선포합니다."
