session,session_type,meeting_no,date,speech_order,speaker_name,speaker_position,speaker_area,data_mem_id,agenda_item_orders,agenda_item_titles,agenda_item_times,speech_text
418,정기회,제13호,2024년 11월 28일(목),1,신정훈,위원장,(전남 나주시화순군),6713,,,,"의석을 정돈해 주시기 바랍니다. 
 성원이 되었으므로 제418회 국회(정기회) 제13차 행정안전위원회를 개회하겠습니다. 
 바쁘신 와중에도 회의에 참석해 주신 위원님 여러분께 감사의 말씀 드립니다. 
 오늘 회의는 먼저 법안심사소위원회에서 심사를 마친 법률안을 의결한 후에 우리 위원회에 회부된 지방세 관계법 개정안을 상정하여 제안설명과 전문위원 검토보고를 듣고 위원님들의 대체토론을 실시하도록 하겠습니다. 
 본격적인 의사일정에 들어가기에 앞서 우리 위원회에 신규로 임용된 입법조사관을 소개해 드리겠습니다. 
 이다영 입법조사관입니다. 
 (인사)
 임용을 축하드리면서 앞으로 우리 위원회 입법활동을 성실히 지원해 주시기를 당부드립니다. 
 이어서 안건을 상정하겠습니다."
418,정기회,제13호,2024년 11월 28일(목),2,이성권,위원,(부산 사하구갑),6727,,,,"위원장님, 안건 상정하기 전에 의사진행발언 좀 해도 되겠습니까?"
418,정기회,제13호,2024년 11월 28일(목),3,신정훈,위원장,(전남 나주시화순군),6713,,,,이성권 위원님.
418,정기회,제13호,2024년 11월 28일(목),4,이성권,위원,(부산 사하구갑),6727,,,,"부산 사하갑의 이성권 위원입니다. 
 죄송합니다. 여러 차례 똑같은 내용으로 말씀을 드리게 되었고 어제 제1법안심사소위원회에서도 제가 의사진행발언을 통해서 말씀을 드렸습니다만 오늘 또 전체회의를 맞이해서 말씀을 드리지 않을 수가 없습니다. 
 부산 글로벌허브도시 특별법과 관련해서 말씀을 드리겠습니다. 
 부산 글로벌허브도시 특별법 안건 상정과 공청회 개최를 강력하게 다시 한번 우리 위원회의 위원장님과 위원님들께 촉구를 드립니다. 
 수도권 일극 체제가 심화되고 지방소멸 위기는 팽창 중에 있습니다. 
 국회는, 특히 우리 행정안전위원회는 지역균형발전과 또 상생발전 입법을 해태해서는 절대 안 될 것입니다. 
 부산 글로벌허브도시 특별법은 올해 5월 31일 제22대 국회 개원과 동시에 여야 국회의원 공동으로 발의된 법안입니다. 발의를 한 지 6개월이 다 되어 가는데도 불구하고 입법공청회 개최가 되지 않고 있습니다. 그동안 저희 국민의힘과 또 부산 지역 국회의원들께서 야당 간사님을 비롯한 위원님들께 법안 상정을 간곡히 부탁드려 왔습니다. 
 이 법안은 정부 18개 관계부처와 조율을 끝낸 합리적인 법안이라서 넉넉하게 또 빨리 논의가 되리라고 기대를 했었습니다. 그러나 도대체 왜 합의가 되지 않고 지금까지 공청회가 열리지 않는지 좀 이해가 되지 않고 있습니다. 
 어떠한 이유로 공청회가 거부되고 있는지 궁금합니다. 묻고 또 물어도 저한테는 솔직히 명확한 설명을 해 주지 않아서 일부러 회피하고 있는 것 아닌가라는 생각이 들 정도입니다. 
 이 법안은 제정을 촉구하는 우리 부산시민의 160만 명의 뜻을 모아서 서명을 모아서 전달된 법안입니다. 부산 인구 330만입니다. 애들 빼고 나면 절반 이상의 사람들이 서명을 했던 법안이라고 볼 수가 있습니다. 제발 좀 통과될 수 있도록 공청회를 요청하고요. 
 또 하나, 제가 이해가 안 되는 장면이 하나 있습니다. 
 국회에서는 선입선출이라는 관례가 있지 않습니까? 그런데 이번 법안 처리와 관련해서는 22대 국회 개원 당일에 여야 공동으로 발의된 부산 글로벌허브도시 특별법보다 한참이나 뒤늦게 발의된 야당 의원님의 제정법은 어제 법안심사1소위에서 입법공청회를 열었습니다. 관례가 이렇게 무시되는 것도 도대체 이해가 안 갑니다. 공평한 처사인지 묻고 싶습니다. 오히려 형평성을 위배한 것이 아닌지 우려스럽기도 합니다. 
 방금 전에 보셨지만 부산의 박형준 시장님을 비롯해서 상공회의소 회장님 그리고 여성단체 회장을 비롯한 시민단체 관계자들이 올라와서 법안 상정과 입법공청회를 요청하는 천막 농성을 어제부터 시작하고 있고 우리 위원회에도 위원장님에게도 그 의사를 전달하고 있습니다. 당장 법안을 통과시켜 달라는 것도 아니고 절차대로 해 달라는 요청입니다. 
 마지막으로 다시 한 번 더 부탁드리겠습니다. 
 위원장님과 야당 위원님들도 지방소멸을 막아야 한다 또 국가균형발전에 대해서 그 취지에 동감을 하고 있을 거라고 생각을 합니다. 연내에 안건으로 상정하고 공청회를 열 수 있도록 위원장님과 위원님들께 다시 한번 간곡히 요청을 드립니다. 
 감사합니다."
418,정기회,제13호,2024년 11월 28일(목),5,신정훈,위원장,(전남 나주시화순군),6713,,,,수고하셨습니다.
418,정기회,제13호,2024년 11월 28일(목),6,정동만,위원,(부산 기장군),6638,,,,"위원장님, 저도……"
418,정기회,제13호,2024년 11월 28일(목),7,신정훈,위원장,(전남 나주시화순군),6713,,,,"한 분으로 하시지요. 
 정동만 위원님, 같이 하셨으니까……"
418,정기회,제13호,2024년 11월 28일(목),8,조승환,위원,(부산 중구영도구),6841,,,,저는 안 하겠습니다.
418,정기회,제13호,2024년 11월 28일(목),9,정동만,위원,(부산 기장군),6638,,,,짧게 하겠습니다.
418,정기회,제13호,2024년 11월 28일(목),10,신정훈,위원장,(전남 나주시화순군),6713,,,,"아니, 한 분만 하시지요. 제가 시간을 충분히 드렸으니까요."
418,정기회,제13호,2024년 11월 28일(목),11,신정훈,위원장,(전남 나주시화순군),6713,"1,2,3,4,5,6,7,8,9,10,11,12,13,14,15,16,17,18,19,20,21,22,23,24,25,26,27,28,29,30,31,32,33,34,35,36,37,38,39,40,41,42,43,44,45,46,47,48,49,50,51,52,53,54,55,56,57,58,59,60,61,62,63,64,65,66,67,68,69,70,71",새마을금고법 일부개정법률안(이성권 의원 대표발의)(의안번호 2204228) / 새마을금고법 일부개정법률안(김상욱 의원 대표발의)(의안번호 2202621) / 새마을금고법 일부개정법률안(이성권 의원 대표발의)(의안번호 2204285) / 새마을금고법 일부개정법률안(윤건영 의원 대표발의)(의안번호 2201735) / 새마을금고법 일부개정법률안(박성민 의원 대표발의)(의안번호 2201692) / 새마을금고법 일부개정법률안(신정훈 의원 대표발의)(의안번호 2204978) / 새마을금고법 일부개정법률안(대안) / 여수·순천 10·19사건 진상규명 및 희생자 명예회복에 관한 특별법 일부개정법률안(김문수 의원 대표발의)(의안번호 2200872) / 여수·순천 10·19사건 진상규명 및 희생자 명예회복에 관한 특별법 일부개정법률안(주철현 의원 대표발의)(의안번호 2202374) / 여수·순천 10·19사건 진상규명 및 희생자 명예회복에 관한 특별법 일부개정법률안(용혜인 의원 대표발의)(의안번호 2203583) / 여수·순천 10·19사건 진상규명 및 희생자 명예회복에 관한 특별법 일부개정법률안(권향엽 의원 대표발의)(의안번호 2204406) / 여수·순천 10·19사건 진상규명 및 희생자 명예회복에 관한 특별법 일부개정법률안(대안) / 인구감소지역 지원 특별법 일부개정법률안(한병도 의원 대표발의)(의안번호 2200232) / 전자정부법 일부개정법률안(배준영 의원 대표발의)(의안번호 2203398) / 전자정부법 일부개정법률안(양부남 의원 대표발의)(의안번호 2203797) / 전자정부법 일부개정법률안(대안) / 지방공기업법 일부개정법률안(이상식 의원 대표발의)(의안번호 2202789) / 공무원 재해보상법 일부개정법률안(유용원 의원 대표발의)(의안번호 2200953) / 공무원 재해보상법 일부개정법률안(박대출 의원 대표발의)(의안번호 2201105) / 공무원 재해보상법 일부개정법률안(김상욱 의원 대표발의)(의안번호 2201700) / 공무원 재해보상법 일부개정법률안(강선영 의원 대표발의)(의안번호 2202589) / 공무원 재해보상법 일부개정법률안(권향엽 의원 대표발의)(의안번호 2203307) / 공무원 재해보상법 일부개정법률안(대안) / 공무원연금법 일부개정법률안(박대출 의원 대표발의)(의안번호 2201104) / 공무원연금법 일부개정법률안(김상욱 의원 대표발의)(의안번호 2201702) / 공무원연금법 일부개정법률안(강선영 의원 대표발의)(의안번호 2202590) / 공무원연금법 일부개정법률안(대안) / 국가공무원법 일부개정법률안(정부 제출)(의안번호 2201083) / 국가공무원법 일부개정법률안(양부남 의원 대표발의)(의안번호 2201234) / 국가공무원법 일부개정법률안(양부남 의원 대표발의)(의안번호 2201267) / 국가공무원법 일부개정법률안(김태년 의원 대표발의)(의안번호 2205131) / 국가공무원법 일부개정법률안(대안) / 지방공무원법 일부개정법률안(정부 제출)(의안번호 2201202) / 지방공무원법 일부개정법률안(양부남 의원 대표발의)(의안번호 2201236) / 지방공무원법 일부개정법률안(양부남 의원 대표발의)(의안번호 2201268) / 지방공무원법 일부개정법률안(김태년 의원 대표발의)(의안번호 2205136) / 지방공무원법 일부개정법률안(대안) / 재난 및 안전관리 기본법 일부개정법률안(정부 제출)(의안번호 2201324) / 재난 및 안전관리 기본법 일부개정법률안(박성훈 의원 대표발의)(의안번호 2203000) / 재난 및 안전관리 기본법 일부개정법률안(김선교 의원 대표발의)(의안번호 2203326) / 재난 및 안전관리 기본법 일부개정법률안(이달희 의원 대표발의)(의안번호 2205588) / 재난 및 안전관리 기본법 일부개정법률안(조은희 의원 대표발의)(의안번호 2205777) / 재난 및 안전관리 기본법 일부개정법률안(대안) / 자연재해대책법 일부개정법률안(정부 제출)(의안번호 2201199) / 공직선거법 일부개정법률안(한병도 의원 대표발의)(의안번호 2200354) / 공직선거법 일부개정법률안(한병도 의원 대표발의)(의안번호 2200816) / 공직선거법 일부개정법률안(채현일 의원 대표발의)(의안번호 2203628) / 공직선거법 일부개정법률안(대안) / 경비업법 일부개정법률안(한병도 의원 대표발의)(의안번호 2201298) / 경비업법 일부개정법률안(김석기 의원 대표발의)(의안번호 2201900) / 경비업법 일부개정법률안(김종양 의원 대표발의)(의안번호 2205734) / 경비업법 일부개정법률안(대안) / 경찰공무원법 일부개정법률안(한병도 의원 대표발의)(의안번호 2202548) / 도로교통법 일부개정법률안(박성훈 의원 대표발의)(의안번호 2203909) / 도로교통법 일부개정법률안(김종양 의원 대표발의)(의안번호 2204080) / 도로교통법 일부개정법률안(김종양 의원 대표발의)(의안번호 2203991) / 도로교통법 일부개정법률안(대안) / 총포·도검·화약류 등의 안전관리에 관한 법률 일부개정법률안(박정현 의원 대표발의)(의안번호 2202555) / 총포·도검·화약류 등의 안전관리에 관한 법률 일부개정법률안(고동진 의원 대표발의)(의안번호 2202452) / 총포·도검·화약류 등의 안전관리에 관한 법률 일부개정법률안(모경종 의원 대표발의)(의안번호 2202454) / 총포·도검·화약류 등의 안전관리에 관한 법률 일부개정법률안(박주민 의원 대표발의)(의안번호 2202534) / 총포·도검·화약류 등의 안전관리에 관한 법률 일부개정법률안(민홍철 의원 대표발의)(의안번호 2202574) / 총포·도검·화약류 등의 안전관리에 관한 법률 일부개정법률안(임이자 의원 대표발의)(의안번호 2202662) / 총포·도검·화약류 등의 안전관리에 관한 법률 일부개정법률안(진종오 의원 대표발의)(의안번호 2202880) / 총포·도검·화약류 등의 안전관리에 관한 법률 일부개정법률안(서일준 의원 대표발의)(의안번호 2203040) / 총포·도검·화약류 등의 안전관리에 관한 법률 일부개정법률안(박충권 의원 대표발의)(의안번호 2203939) / 총포·도검·화약류 등의 안전관리에 관한 법률 일부개정법률안(대안) / 소방공무원 보건안전 및 복지 기본법 일부개정법률안(이상식 의원 대표발의)(의안번호 2202021) / 소방공무원 보건안전 및 복지 기본법 일부개정법률안(이성권 의원 대표발의)(의안번호 2205432) / 소방공무원 보건안전 및 복지 기본법 일부개정법률안(대안) / 소방기본법 일부개정법률안(이상식 의원 대표발의)(의안번호 2202998),(10시18분),"그러면 의사일정 제1항 새마을금고법 일부개정법률안부터 의사일정 제71항 소방기본법 일부개정법률안까지 71건 법률안을 상정합니다. 
 먼저 소위원장의 심사보고가 있겠습니다. 
 윤건영 제1소위원장 나오셔서 심사 결과 보고를 해 주시기 바랍니다."
