session,session_type,meeting_no,date,speech_order,speaker_name,speaker_position,speaker_area,data_mem_id,agenda_item_orders,agenda_item_titles,agenda_item_times,speech_text
418,정기회,제11호,2024년 11월 14일(목),484,김종양,위원,(경남 창원시의창구),6801,"1,2,3",2025년도 예산안(의안번호 2203519) / 가. 행정안전부 소관 / 나. 중앙선거관리위원회 소관 / 다. 진실·화해를위한과거사정리위원회 소관 / 라. 인사혁신처 소관 / 마. 경찰청 소관 / 바. 소방청 소관 / 2025년도 기금운용계획안(의안번호 2203520) / 가. 공무원연금기금 / 현안 질의,(10시42분),"그래요. 지금 사실 인터폴이 잘 아시겠지만 회원국 196개국입니다. UN 193개국입니다. 전 세계 정부 간 국제기구 중에서 가장 큰 국제기구이고 총회가 1년에 한 번씩 개최되는데 그 총회를 유치했다는 것은 아주 자랑스러운 일이고요. 그것을 통해 가지고 대한민국의 위상 또 우리 경찰의 위상을 전 세계에 알릴 수 있는 좋은 계기가 될 수 있기 때문에 모처럼 유치한 인터폴 총회 아직 시간은 좀 남았지만 잘 준비해 주시고요.
 그리고 사실 이런 국제기구 유치 그다음에 전 세계의 국제적인 리더들을 한국에 오도록 하는 것도 중요하지만 다음에 한국을 방문하고 나서 갈 때 그때 ‘정말 한국 대단하다. 좋은 인상, 좋은 배려 받고 간다’는 그런 게 더 중요하다고 봅니다.
 이번 달 초에 제1회 인터폴 미래치안회의 있었지요, 청장님?"
418,정기회,제11호,2024년 11월 14일(목),485,조지호,경찰청장,,0,"1,2,3",2025년도 예산안(의안번호 2203519) / 가. 행정안전부 소관 / 나. 중앙선거관리위원회 소관 / 다. 진실·화해를위한과거사정리위원회 소관 / 라. 인사혁신처 소관 / 마. 경찰청 소관 / 바. 소방청 소관 / 2025년도 기금운용계획안(의안번호 2203520) / 가. 공무원연금기금 / 현안 질의,(10시42분),"예, 있었습니다."
418,정기회,제11호,2024년 11월 14일(목),486,김종양,위원,(경남 창원시의창구),6801,"1,2,3",2025년도 예산안(의안번호 2203519) / 가. 행정안전부 소관 / 나. 중앙선거관리위원회 소관 / 다. 진실·화해를위한과거사정리위원회 소관 / 라. 인사혁신처 소관 / 마. 경찰청 소관 / 바. 소방청 소관 / 2025년도 기금운용계획안(의안번호 2203520) / 가. 공무원연금기금 / 현안 질의,(10시42분),그때 인터폴 총재하고 또 인터폴 아프리카 부총재 등등 참석하고 가셨지요?
418,정기회,제11호,2024년 11월 14일(목),487,조지호,경찰청장,,0,"1,2,3",2025년도 예산안(의안번호 2203519) / 가. 행정안전부 소관 / 나. 중앙선거관리위원회 소관 / 다. 진실·화해를위한과거사정리위원회 소관 / 라. 인사혁신처 소관 / 마. 경찰청 소관 / 바. 소방청 소관 / 2025년도 기금운용계획안(의안번호 2203520) / 가. 공무원연금기금 / 현안 질의,(10시42분),예.
418,정기회,제11호,2024년 11월 14일(목),488,김종양,위원,(경남 창원시의창구),6801,"1,2,3",2025년도 예산안(의안번호 2203519) / 가. 행정안전부 소관 / 나. 중앙선거관리위원회 소관 / 다. 진실·화해를위한과거사정리위원회 소관 / 라. 인사혁신처 소관 / 마. 경찰청 소관 / 바. 소방청 소관 / 2025년도 기금운용계획안(의안번호 2203520) / 가. 공무원연금기금 / 현안 질의,(10시42분),그러면 갈 때 느낌이 어땠는지 혹시 후문 한번 들어 보셨습니까? 안 들어 보셨지요?
418,정기회,제11호,2024년 11월 14일(목),489,조지호,경찰청장,,0,"1,2,3",2025년도 예산안(의안번호 2203519) / 가. 행정안전부 소관 / 나. 중앙선거관리위원회 소관 / 다. 진실·화해를위한과거사정리위원회 소관 / 라. 인사혁신처 소관 / 마. 경찰청 소관 / 바. 소방청 소관 / 2025년도 기금운용계획안(의안번호 2203520) / 가. 공무원연금기금 / 현안 질의,(10시42분),인터폴 총재의 경우에는 약간의 컴플레인이 있었던 걸로 들었습니다.
418,정기회,제11호,2024년 11월 14일(목),490,김종양,위원,(경남 창원시의창구),6801,"1,2,3",2025년도 예산안(의안번호 2203519) / 가. 행정안전부 소관 / 나. 중앙선거관리위원회 소관 / 다. 진실·화해를위한과거사정리위원회 소관 / 라. 인사혁신처 소관 / 마. 경찰청 소관 / 바. 소방청 소관 / 2025년도 기금운용계획안(의안번호 2203520) / 가. 공무원연금기금 / 현안 질의,(10시42분),"그분이 UAE에서 아주 영향력자이신데 하여튼 그런 분들에 대해서 조그마한 어떤 배려만 하면 그분들이 한국에 대해서 아주 좋은 인상을 가져갈 거라고 봅니다.
 그런데 이번에 글래스고의 인터폴 총회에 우리 한국에서도 아시아 대륙에 있는 집행위원 출마했지요?"
418,정기회,제11호,2024년 11월 14일(목),491,조지호,경찰청장,,0,"1,2,3",2025년도 예산안(의안번호 2203519) / 가. 행정안전부 소관 / 나. 중앙선거관리위원회 소관 / 다. 진실·화해를위한과거사정리위원회 소관 / 라. 인사혁신처 소관 / 마. 경찰청 소관 / 바. 소방청 소관 / 2025년도 기금운용계획안(의안번호 2203520) / 가. 공무원연금기금 / 현안 질의,(10시42분),예.
418,정기회,제11호,2024년 11월 14일(목),492,김종양,위원,(경남 창원시의창구),6801,"1,2,3",2025년도 예산안(의안번호 2203519) / 가. 행정안전부 소관 / 나. 중앙선거관리위원회 소관 / 다. 진실·화해를위한과거사정리위원회 소관 / 라. 인사혁신처 소관 / 마. 경찰청 소관 / 바. 소방청 소관 / 2025년도 기금운용계획안(의안번호 2203520) / 가. 공무원연금기금 / 현안 질의,(10시42분),몇 표 얻었습니까?
418,정기회,제11호,2024년 11월 14일(목),493,조지호,경찰청장,,0,"1,2,3",2025년도 예산안(의안번호 2203519) / 가. 행정안전부 소관 / 나. 중앙선거관리위원회 소관 / 다. 진실·화해를위한과거사정리위원회 소관 / 라. 인사혁신처 소관 / 마. 경찰청 소관 / 바. 소방청 소관 / 2025년도 기금운용계획안(의안번호 2203520) / 가. 공무원연금기금 / 현안 질의,(10시42분),일곱 표 정도 얻은 걸로 알고 있습니다.
418,정기회,제11호,2024년 11월 14일(목),494,김종양,위원,(경남 창원시의창구),6801,"1,2,3",2025년도 예산안(의안번호 2203519) / 가. 행정안전부 소관 / 나. 중앙선거관리위원회 소관 / 다. 진실·화해를위한과거사정리위원회 소관 / 라. 인사혁신처 소관 / 마. 경찰청 소관 / 바. 소방청 소관 / 2025년도 기금운용계획안(의안번호 2203520) / 가. 공무원연금기금 / 현안 질의,(10시42분),"지금까지 전 세계 150개, 160개국 참석했는데 일곱 표를 얻었다는 것은 상당히 우리 경찰로 봐서는 한번 되새겨 볼 만한 그런 투표 결과인 것 같습니다. 그게 제가 봤을 때는 인터폴 총재 한국 왔을 때, 갈 때의 느낌 그다음에 아프리카 부총재 한국 갈 때의 느낌 등등이 다소 반영되었을 수도 있겠다 하는 그런 느낌을 저는 받았습니다.
 그러니까 청장님, 국제기구 유치, 국제행사 유치도 중요하지만 방문하는 국제적인, 특히 치안 지도자 등에 대한 사소한 배려라도 해 줘서 한국에 대해서 좋은 인상, 지금껏 제가 국제회의 가 가지고 한국에 대한 우리 경찰의 입장은 전 세계적이라는 그런 평가를 받을 정도로 극찬이 있는데 다소 그런 극찬의 이미지가 훼손되지 않기를 바랍니다. 잘 좀 챙겨 주시기 바랍니다.
 그리고 청장님, 이번에 올해 들어 가지고 우리 범죄 중에서 가장 이슈가 된 게 딥페이크 등 디지털 성범죄지요?"
418,정기회,제11호,2024년 11월 14일(목),495,조지호,경찰청장,,0,"1,2,3",2025년도 예산안(의안번호 2203519) / 가. 행정안전부 소관 / 나. 중앙선거관리위원회 소관 / 다. 진실·화해를위한과거사정리위원회 소관 / 라. 인사혁신처 소관 / 마. 경찰청 소관 / 바. 소방청 소관 / 2025년도 기금운용계획안(의안번호 2203520) / 가. 공무원연금기금 / 현안 질의,(10시42분),최근에 그렇습니다.
418,정기회,제11호,2024년 11월 14일(목),496,김종양,위원,(경남 창원시의창구),6801,"1,2,3",2025년도 예산안(의안번호 2203519) / 가. 행정안전부 소관 / 나. 중앙선거관리위원회 소관 / 다. 진실·화해를위한과거사정리위원회 소관 / 라. 인사혁신처 소관 / 마. 경찰청 소관 / 바. 소방청 소관 / 2025년도 기금운용계획안(의안번호 2203520) / 가. 공무원연금기금 / 현안 질의,(10시42분),"이것 단속과 관련해서 여러 가지 어려움이 있다는 것 잘 아실 겁니다. 기술적인 문제라든지 서버의 해외 존재 문제 등등 여러 가지가 있는데 결국 이 문제 해결에 있어서 가장 좋은 대안은 인터폴을 통한 어떤 펀딩 프로젝트를, 딥페이크 성범죄 단속을 인터폴에 맡기고 거기에 대한 비용 일부를 우리 대한민국이 대는 소위 인터폴 펀딩 프로젝트를 추진하는 게 필요하다고 보고 경찰청에서도 지금 추진을 하고 있지요?"
418,정기회,제11호,2024년 11월 14일(목),497,조지호,경찰청장,,0,"1,2,3",2025년도 예산안(의안번호 2203519) / 가. 행정안전부 소관 / 나. 중앙선거관리위원회 소관 / 다. 진실·화해를위한과거사정리위원회 소관 / 라. 인사혁신처 소관 / 마. 경찰청 소관 / 바. 소방청 소관 / 2025년도 기금운용계획안(의안번호 2203520) / 가. 공무원연금기금 / 현안 질의,(10시42분),"예, 그렇습니다."
418,정기회,제11호,2024년 11월 14일(목),498,김종양,위원,(경남 창원시의창구),6801,"1,2,3",2025년도 예산안(의안번호 2203519) / 가. 행정안전부 소관 / 나. 중앙선거관리위원회 소관 / 다. 진실·화해를위한과거사정리위원회 소관 / 라. 인사혁신처 소관 / 마. 경찰청 소관 / 바. 소방청 소관 / 2025년도 기금운용계획안(의안번호 2203520) / 가. 공무원연금기금 / 현안 질의,(10시42분),"그런데 올해 예산 확보됐습니까, 안 됐습니까?"
418,정기회,제11호,2024년 11월 14일(목),499,조지호,경찰청장,,0,"1,2,3",2025년도 예산안(의안번호 2203519) / 가. 행정안전부 소관 / 나. 중앙선거관리위원회 소관 / 다. 진실·화해를위한과거사정리위원회 소관 / 라. 인사혁신처 소관 / 마. 경찰청 소관 / 바. 소방청 소관 / 2025년도 기금운용계획안(의안번호 2203520) / 가. 공무원연금기금 / 현안 질의,(10시42분),15억 정도 확보된 걸로 알고 있습니다.
418,정기회,제11호,2024년 11월 14일(목),500,김종양,위원,(경남 창원시의창구),6801,"1,2,3",2025년도 예산안(의안번호 2203519) / 가. 행정안전부 소관 / 나. 중앙선거관리위원회 소관 / 다. 진실·화해를위한과거사정리위원회 소관 / 라. 인사혁신처 소관 / 마. 경찰청 소관 / 바. 소방청 소관 / 2025년도 기금운용계획안(의안번호 2203520) / 가. 공무원연금기금 / 현안 질의,(10시42분),"확보되지 않았고 전혀 지금 반영도 안 되어 있습니다.
 그러니까 오늘 모경종 위원도 이야기했듯이 이 딥페이크 성범죄 관련돼서는 범부처, 범정부 간 공감대가 형성되어 있잖아요. 이럴 때 인터폴을 통해 용병을 쓰는 겁니다. 인터폴이라는 국제기구를 갖다가 용병을 써서, 우리가 일부의 비용을 대고 용병을 써서 사실상 전 세계 딥페이크 피해의 상당수가, 대부분이 한국인 이 문제를 단속하자는 겁니다. 그러니까 예산 확보, 인터폴 펀딩 작업이 중요하고요.
 또 하나는 인사혁신처장님, 이런 중요한 국제기구의 펀딩을 통한 프로젝트 사업을 추진하는 데 있어서 한국 사람이, 한국 공무원이 한 사람 가 있으면 거의 한국이 원하는 그런 방식대로 다 이 사업을 추진할 수 있습니다. 그러니까 여기에는 굳이 별도의 정원 등등 이런 것 괘념치 마시고 해외 파견 직원을 한 명 정도는, 특히 우리 경찰을 한 명 정도는 파견시켜 주는 게 이 사업이 제대로, 100% 우리가 원하는 방향으로 움직일 수 있다는 점을 한번 충분히 감안을 해 주시기 바랍니다."
418,정기회,제11호,2024년 11월 14일(목),501,연원정,인사혁신처장,,0,"1,2,3",2025년도 예산안(의안번호 2203519) / 가. 행정안전부 소관 / 나. 중앙선거관리위원회 소관 / 다. 진실·화해를위한과거사정리위원회 소관 / 라. 인사혁신처 소관 / 마. 경찰청 소관 / 바. 소방청 소관 / 2025년도 기금운용계획안(의안번호 2203520) / 가. 공무원연금기금 / 현안 질의,(10시42분),"예, 살펴보겠습니다."
418,정기회,제11호,2024년 11월 14일(목),502,김종양,위원,(경남 창원시의창구),6801,"1,2,3",2025년도 예산안(의안번호 2203519) / 가. 행정안전부 소관 / 나. 중앙선거관리위원회 소관 / 다. 진실·화해를위한과거사정리위원회 소관 / 라. 인사혁신처 소관 / 마. 경찰청 소관 / 바. 소방청 소관 / 2025년도 기금운용계획안(의안번호 2203520) / 가. 공무원연금기금 / 현안 질의,(10시42분),마치도록 하겠습니다.
418,정기회,제11호,2024년 11월 14일(목),503,신정훈,위원장,(전남 나주시화순군),6713,"1,2,3",2025년도 예산안(의안번호 2203519) / 가. 행정안전부 소관 / 나. 중앙선거관리위원회 소관 / 다. 진실·화해를위한과거사정리위원회 소관 / 라. 인사혁신처 소관 / 마. 경찰청 소관 / 바. 소방청 소관 / 2025년도 기금운용계획안(의안번호 2203520) / 가. 공무원연금기금 / 현안 질의,(10시42분),"수고하셨습니다.
 다음은 박정현 위원님 질의해 주시기 바랍니다."
418,정기회,제11호,2024년 11월 14일(목),504,박정현,위원,(대전 대덕구),6808,"1,2,3",2025년도 예산안(의안번호 2203519) / 가. 행정안전부 소관 / 나. 중앙선거관리위원회 소관 / 다. 진실·화해를위한과거사정리위원회 소관 / 라. 인사혁신처 소관 / 마. 경찰청 소관 / 바. 소방청 소관 / 2025년도 기금운용계획안(의안번호 2203520) / 가. 공무원연금기금 / 현안 질의,(10시42분),"대전 대덕구 박정현 위원입니다.
 이상민 장관님, 지역 살림이 굉장히 어려워요. 지금 지방교부세도 삭감이 돼서 실제로 중앙정부가 예산 지원을 하지 않으면 지역의 현안 문제를 풀기가 굉장히 어렵습니다. 그래서 저는 지역 현안 몇 가지 말씀을 드리겠습니다. 전향적으로 검토해 주시기를 당부를 드리겠습니다."
418,정기회,제11호,2024년 11월 14일(목),505,이상민,행정안전부장관,,0,"1,2,3",2025년도 예산안(의안번호 2203519) / 가. 행정안전부 소관 / 나. 중앙선거관리위원회 소관 / 다. 진실·화해를위한과거사정리위원회 소관 / 라. 인사혁신처 소관 / 마. 경찰청 소관 / 바. 소방청 소관 / 2025년도 기금운용계획안(의안번호 2203520) / 가. 공무원연금기금 / 현안 질의,(10시42분),"예, 알겠습니다."
418,정기회,제11호,2024년 11월 14일(목),506,박정현,위원,(대전 대덕구),6808,"1,2,3",2025년도 예산안(의안번호 2203519) / 가. 행정안전부 소관 / 나. 중앙선거관리위원회 소관 / 다. 진실·화해를위한과거사정리위원회 소관 / 라. 인사혁신처 소관 / 마. 경찰청 소관 / 바. 소방청 소관 / 2025년도 기금운용계획안(의안번호 2203520) / 가. 공무원연금기금 / 현안 질의,(10시42분),"우선 제 지역의 대덕구 장동-이현 간 도로 개설 문제가 있는데요. 이미 설계비는 4억 정도가 반영이 돼서 집행이 되고 있는데 이게 지금 주한미군 공여구역 발전종합계획이 변경되면서 지난 10월에 이 예산이 집행이 됐습니다. 그러다 보니까 내년에, 그러면 설계가 됐으면 보상되어야 되지 않습니까?"
418,정기회,제11호,2024년 11월 14일(목),507,이상민,행정안전부장관,,0,"1,2,3",2025년도 예산안(의안번호 2203519) / 가. 행정안전부 소관 / 나. 중앙선거관리위원회 소관 / 다. 진실·화해를위한과거사정리위원회 소관 / 라. 인사혁신처 소관 / 마. 경찰청 소관 / 바. 소방청 소관 / 2025년도 기금운용계획안(의안번호 2203520) / 가. 공무원연금기금 / 현안 질의,(10시42분),"예, 그렇지요."
418,정기회,제11호,2024년 11월 14일(목),508,박정현,위원,(대전 대덕구),6808,"1,2,3",2025년도 예산안(의안번호 2203519) / 가. 행정안전부 소관 / 나. 중앙선거관리위원회 소관 / 다. 진실·화해를위한과거사정리위원회 소관 / 라. 인사혁신처 소관 / 마. 경찰청 소관 / 바. 소방청 소관 / 2025년도 기금운용계획안(의안번호 2203520) / 가. 공무원연금기금 / 현안 질의,(10시42분),보상비 7억 원이 미반영되어 있습니다. 그 보상비 7억 원 반영 좀 시켜 주십시오.
418,정기회,제11호,2024년 11월 14일(목),509,이상민,행정안전부장관,,0,"1,2,3",2025년도 예산안(의안번호 2203519) / 가. 행정안전부 소관 / 나. 중앙선거관리위원회 소관 / 다. 진실·화해를위한과거사정리위원회 소관 / 라. 인사혁신처 소관 / 마. 경찰청 소관 / 바. 소방청 소관 / 2025년도 기금운용계획안(의안번호 2203520) / 가. 공무원연금기금 / 현안 질의,(10시42분),예산 지원 필요성에 공감을 하고 있고요. 재정 당국과 잘 협의해서 반영할 수 있도록 해 보겠습니다.
418,정기회,제11호,2024년 11월 14일(목),510,박정현,위원,(대전 대덕구),6808,"1,2,3",2025년도 예산안(의안번호 2203519) / 가. 행정안전부 소관 / 나. 중앙선거관리위원회 소관 / 다. 진실·화해를위한과거사정리위원회 소관 / 라. 인사혁신처 소관 / 마. 경찰청 소관 / 바. 소방청 소관 / 2025년도 기금운용계획안(의안번호 2203520) / 가. 공무원연금기금 / 현안 질의,(10시42분),"오랜만에 케미가 잘 맞는 것 같네요.
 두 번째는 골령골 아시지요? 대전에 있는 산내 평화공원인데요. 한국전쟁 전후해 가지고 민간인이 학살당한 곳입니다. 전체가 한 최대 7000명 정도인데 지금 발굴된 유해만 한 1400여 구 됩니다. 김광동 진화위원장 잘 아실 것 같은데요.
 그런데 어쨌든 이게 국가 폭력의 현장 아닙니까? 그러면 이 현장의 상흔을 치유하는 것은 국가의 책무라고 생각하는데요.
 지금 위령시설 조성 사업비 210억 원이 반영되어 있지 않습니다. 보니까 타당성 재조사가 조금 늦게 진행이 되고 아마 곧 이제 통과가 될 것 같거든요."
418,정기회,제11호,2024년 11월 14일(목),511,이상민,행정안전부장관,,0,"1,2,3",2025년도 예산안(의안번호 2203519) / 가. 행정안전부 소관 / 나. 중앙선거관리위원회 소관 / 다. 진실·화해를위한과거사정리위원회 소관 / 라. 인사혁신처 소관 / 마. 경찰청 소관 / 바. 소방청 소관 / 2025년도 기금운용계획안(의안번호 2203520) / 가. 공무원연금기금 / 현안 질의,(10시42분),12월 초까지 아마 되는 걸로 알고 있습니다.
418,정기회,제11호,2024년 11월 14일(목),512,박정현,위원,(대전 대덕구),6808,"1,2,3",2025년도 예산안(의안번호 2203519) / 가. 행정안전부 소관 / 나. 중앙선거관리위원회 소관 / 다. 진실·화해를위한과거사정리위원회 소관 / 라. 인사혁신처 소관 / 마. 경찰청 소관 / 바. 소방청 소관 / 2025년도 기금운용계획안(의안번호 2203520) / 가. 공무원연금기금 / 현안 질의,(10시42분),그러면 이게 타당성이 통과가 되면 바로 사업이 집행되어야 되는데 지금 미반영되면 또 사업이 늦어지니까 이 부분에 대해서 적극적으로 고려해 주십시오.
418,정기회,제11호,2024년 11월 14일(목),513,이상민,행정안전부장관,,0,"1,2,3",2025년도 예산안(의안번호 2203519) / 가. 행정안전부 소관 / 나. 중앙선거관리위원회 소관 / 다. 진실·화해를위한과거사정리위원회 소관 / 라. 인사혁신처 소관 / 마. 경찰청 소관 / 바. 소방청 소관 / 2025년도 기금운용계획안(의안번호 2203520) / 가. 공무원연금기금 / 현안 질의,(10시42분),"예, 잘 알겠습니다."
418,정기회,제11호,2024년 11월 14일(목),514,박정현,위원,(대전 대덕구),6808,"1,2,3",2025년도 예산안(의안번호 2203519) / 가. 행정안전부 소관 / 나. 중앙선거관리위원회 소관 / 다. 진실·화해를위한과거사정리위원회 소관 / 라. 인사혁신처 소관 / 마. 경찰청 소관 / 바. 소방청 소관 / 2025년도 기금운용계획안(의안번호 2203520) / 가. 공무원연금기금 / 현안 질의,(10시42분),"마지막으로 대전 자유회관인데요. 여기가 자유총연맹 대전시지부가 사용하는 곳이고 예전에 교도소가 있던 자리입니다. 그런데 여기가 오래되어 가지고 지금 정밀안전 등급이 D등급이 나왔고요. 실제로 3층·4층은 E등급이 나와서 지금 개보수를 하지 않으면 이 건물을 쓸 수가 없고, 이 건물이 중촌동 지역 주민들이 또 공유 공간으로 사용하는 공간입니다. 그래서 이 건물에…… 지금 한, 얼마 되지도 않아요. 21억밖에 안 됩니다. 21억 사업비 반영이 필요합니다. 적극적으로 검토해 주십시오."
418,정기회,제11호,2024년 11월 14일(목),515,이상민,행정안전부장관,,0,"1,2,3",2025년도 예산안(의안번호 2203519) / 가. 행정안전부 소관 / 나. 중앙선거관리위원회 소관 / 다. 진실·화해를위한과거사정리위원회 소관 / 라. 인사혁신처 소관 / 마. 경찰청 소관 / 바. 소방청 소관 / 2025년도 기금운용계획안(의안번호 2203520) / 가. 공무원연금기금 / 현안 질의,(10시42분),"예, 재정 당국과 잘 협의해 보겠습니다."
418,정기회,제11호,2024년 11월 14일(목),516,박정현,위원,(대전 대덕구),6808,"1,2,3",2025년도 예산안(의안번호 2203519) / 가. 행정안전부 소관 / 나. 중앙선거관리위원회 소관 / 다. 진실·화해를위한과거사정리위원회 소관 / 라. 인사혁신처 소관 / 마. 경찰청 소관 / 바. 소방청 소관 / 2025년도 기금운용계획안(의안번호 2203520) / 가. 공무원연금기금 / 현안 질의,(10시42분),"마지막으로 지역화폐 말씀을 안 드릴 수가 없고요. 지금 3년째 미반영이 됐지요. 예산 전체가 미반영이 돼서 겨우겨우 국회에서 살려서 지금 연명하는 방식으로 가고 있는데 앞서 여러 위원님께서도 말씀하셨고 장관께서도 몇 가지 우려에 대해서 말씀하셨는데 저는 어떤 정책도 100% 완벽한 정책은 없다고 생각하거든요. 다만 그 정책을 집행하는 현장의 목소리가 어떠냐, 현장에서 이 정책을 원하냐 안 원하냐가 굉장히 중요한데 이미 지난 국감에서 191개 지역화폐를 발행하는 지자체 중의 157개 지자체가 중앙정부의 지원이 필요하다고 얘기했고 나머지 지자체도 중앙정부 예산이 필요치 않다고 답변하지는 않았습니다. 답변을 안 했거나 다른 의견을 부대에서 달았거든요. 이러면 사실은 지방정부가 지금 안 그래도 예산이 부족해서 지역경제 살리는 데 어려운데 중앙정부에서 전향적으로 이 부분은 대응을 하셔야 되는 것 아닌가라는 생각이 들고요.
 또 한 축으로는 이 정책의 혜택을 받는 자영업·소상공인들이 이 정책 굉장히 요구하고 있습니다. 실제로 지금 보면 100만 명의 자영업자들이 문 닫고 있고 버티기 이제 더 이상 할 수가 없다, 그래서 포기다 이렇게 얘기하는 자영업자들이 많거든요. 모든 정책이, 지역화폐 정책만 자영업·소상공인을 지원하는 것은 아니지만 가장 적실한 정책이라고 생각하니까 이걸 요구하는 것 같습니다.
 지금 우려는 특정 지자체, 오히려 부자 지자체에 돈이 더 몰릴 거라는 우려를 말씀하시는데 이거는 이미 행안부에서 여러 지침으로 해결을 하고 있습니다. 올해도 인구감소지역에는 5%, 나머지 지역에는 2% 그리고 2021년의 경우도 교부세 불교부 단체에는 삼사 % 정도만 지원을 하겠다 이렇게 운영을 하고 있고 필요하면 지침에서 현장의 목소리를 더 담아서 추진할 수 있다라고 생각이 들거든요.
 그래서 지자체가 지금 어려운데 실제로 지역경제는 더 어렵기 때문에 지자체가 지역화폐라든지 재정 정책을 통해서 지역경제를 살릴 수 있도록 좀 전향적으로 이 부분을 검토해 주시면 좋겠습니다."
