session,session_type,meeting_no,date,speech_order,speaker_name,speaker_position,speaker_area,data_mem_id,agenda_item_orders,agenda_item_titles,agenda_item_times,speech_text
418,정기회,제13호,2024년 11월 28일(목),35,신정훈,위원장,(전남 나주시화순군),6713,"1,2,3,4,5,6,7,8,9,10,11,12,13,14,15,16,17,18,19,20,21,22,23,24,25,26,27,28,29,30,31,32,33,34,35,36,37,38,39,40,41,42,43,44,45,46,47,48,49,50,51,52,53,54,55,56,57,58,59,60,61,62,63,64,65,66,67,68,69,70,71",새마을금고법 일부개정법률안(이성권 의원 대표발의)(의안번호 2204228) / 새마을금고법 일부개정법률안(김상욱 의원 대표발의)(의안번호 2202621) / 새마을금고법 일부개정법률안(이성권 의원 대표발의)(의안번호 2204285) / 새마을금고법 일부개정법률안(윤건영 의원 대표발의)(의안번호 2201735) / 새마을금고법 일부개정법률안(박성민 의원 대표발의)(의안번호 2201692) / 새마을금고법 일부개정법률안(신정훈 의원 대표발의)(의안번호 2204978) / 새마을금고법 일부개정법률안(대안) / 여수·순천 10·19사건 진상규명 및 희생자 명예회복에 관한 특별법 일부개정법률안(김문수 의원 대표발의)(의안번호 2200872) / 여수·순천 10·19사건 진상규명 및 희생자 명예회복에 관한 특별법 일부개정법률안(주철현 의원 대표발의)(의안번호 2202374) / 여수·순천 10·19사건 진상규명 및 희생자 명예회복에 관한 특별법 일부개정법률안(용혜인 의원 대표발의)(의안번호 2203583) / 여수·순천 10·19사건 진상규명 및 희생자 명예회복에 관한 특별법 일부개정법률안(권향엽 의원 대표발의)(의안번호 2204406) / 여수·순천 10·19사건 진상규명 및 희생자 명예회복에 관한 특별법 일부개정법률안(대안) / 인구감소지역 지원 특별법 일부개정법률안(한병도 의원 대표발의)(의안번호 2200232) / 전자정부법 일부개정법률안(배준영 의원 대표발의)(의안번호 2203398) / 전자정부법 일부개정법률안(양부남 의원 대표발의)(의안번호 2203797) / 전자정부법 일부개정법률안(대안) / 지방공기업법 일부개정법률안(이상식 의원 대표발의)(의안번호 2202789) / 공무원 재해보상법 일부개정법률안(유용원 의원 대표발의)(의안번호 2200953) / 공무원 재해보상법 일부개정법률안(박대출 의원 대표발의)(의안번호 2201105) / 공무원 재해보상법 일부개정법률안(김상욱 의원 대표발의)(의안번호 2201700) / 공무원 재해보상법 일부개정법률안(강선영 의원 대표발의)(의안번호 2202589) / 공무원 재해보상법 일부개정법률안(권향엽 의원 대표발의)(의안번호 2203307) / 공무원 재해보상법 일부개정법률안(대안) / 공무원연금법 일부개정법률안(박대출 의원 대표발의)(의안번호 2201104) / 공무원연금법 일부개정법률안(김상욱 의원 대표발의)(의안번호 2201702) / 공무원연금법 일부개정법률안(강선영 의원 대표발의)(의안번호 2202590) / 공무원연금법 일부개정법률안(대안) / 국가공무원법 일부개정법률안(정부 제출)(의안번호 2201083) / 국가공무원법 일부개정법률안(양부남 의원 대표발의)(의안번호 2201234) / 국가공무원법 일부개정법률안(양부남 의원 대표발의)(의안번호 2201267) / 국가공무원법 일부개정법률안(김태년 의원 대표발의)(의안번호 2205131) / 국가공무원법 일부개정법률안(대안) / 지방공무원법 일부개정법률안(정부 제출)(의안번호 2201202) / 지방공무원법 일부개정법률안(양부남 의원 대표발의)(의안번호 2201236) / 지방공무원법 일부개정법률안(양부남 의원 대표발의)(의안번호 2201268) / 지방공무원법 일부개정법률안(김태년 의원 대표발의)(의안번호 2205136) / 지방공무원법 일부개정법률안(대안) / 재난 및 안전관리 기본법 일부개정법률안(정부 제출)(의안번호 2201324) / 재난 및 안전관리 기본법 일부개정법률안(박성훈 의원 대표발의)(의안번호 2203000) / 재난 및 안전관리 기본법 일부개정법률안(김선교 의원 대표발의)(의안번호 2203326) / 재난 및 안전관리 기본법 일부개정법률안(이달희 의원 대표발의)(의안번호 2205588) / 재난 및 안전관리 기본법 일부개정법률안(조은희 의원 대표발의)(의안번호 2205777) / 재난 및 안전관리 기본법 일부개정법률안(대안) / 자연재해대책법 일부개정법률안(정부 제출)(의안번호 2201199) / 공직선거법 일부개정법률안(한병도 의원 대표발의)(의안번호 2200354) / 공직선거법 일부개정법률안(한병도 의원 대표발의)(의안번호 2200816) / 공직선거법 일부개정법률안(채현일 의원 대표발의)(의안번호 2203628) / 공직선거법 일부개정법률안(대안) / 경비업법 일부개정법률안(한병도 의원 대표발의)(의안번호 2201298) / 경비업법 일부개정법률안(김석기 의원 대표발의)(의안번호 2201900) / 경비업법 일부개정법률안(김종양 의원 대표발의)(의안번호 2205734) / 경비업법 일부개정법률안(대안) / 경찰공무원법 일부개정법률안(한병도 의원 대표발의)(의안번호 2202548) / 도로교통법 일부개정법률안(박성훈 의원 대표발의)(의안번호 2203909) / 도로교통법 일부개정법률안(김종양 의원 대표발의)(의안번호 2204080) / 도로교통법 일부개정법률안(김종양 의원 대표발의)(의안번호 2203991) / 도로교통법 일부개정법률안(대안) / 총포·도검·화약류 등의 안전관리에 관한 법률 일부개정법률안(박정현 의원 대표발의)(의안번호 2202555) / 총포·도검·화약류 등의 안전관리에 관한 법률 일부개정법률안(고동진 의원 대표발의)(의안번호 2202452) / 총포·도검·화약류 등의 안전관리에 관한 법률 일부개정법률안(모경종 의원 대표발의)(의안번호 2202454) / 총포·도검·화약류 등의 안전관리에 관한 법률 일부개정법률안(박주민 의원 대표발의)(의안번호 2202534) / 총포·도검·화약류 등의 안전관리에 관한 법률 일부개정법률안(민홍철 의원 대표발의)(의안번호 2202574) / 총포·도검·화약류 등의 안전관리에 관한 법률 일부개정법률안(임이자 의원 대표발의)(의안번호 2202662) / 총포·도검·화약류 등의 안전관리에 관한 법률 일부개정법률안(진종오 의원 대표발의)(의안번호 2202880) / 총포·도검·화약류 등의 안전관리에 관한 법률 일부개정법률안(서일준 의원 대표발의)(의안번호 2203040) / 총포·도검·화약류 등의 안전관리에 관한 법률 일부개정법률안(박충권 의원 대표발의)(의안번호 2203939) / 총포·도검·화약류 등의 안전관리에 관한 법률 일부개정법률안(대안) / 소방공무원 보건안전 및 복지 기본법 일부개정법률안(이상식 의원 대표발의)(의안번호 2202021) / 소방공무원 보건안전 및 복지 기본법 일부개정법률안(이성권 의원 대표발의)(의안번호 2205432) / 소방공무원 보건안전 및 복지 기본법 일부개정법률안(대안) / 소방기본법 일부개정법률안(이상식 의원 대표발의)(의안번호 2202998),(10시18분),"수고하셨습니다.
 다음은 마지막으로 허석곤 소방청장 나오셔서 인사말씀해 주시기 바랍니다."
418,정기회,제13호,2024년 11월 28일(목),36,허석곤,소방청장,,0,"1,2,3,4,5,6,7,8,9,10,11,12,13,14,15,16,17,18,19,20,21,22,23,24,25,26,27,28,29,30,31,32,33,34,35,36,37,38,39,40,41,42,43,44,45,46,47,48,49,50,51,52,53,54,55,56,57,58,59,60,61,62,63,64,65,66,67,68,69,70,71",새마을금고법 일부개정법률안(이성권 의원 대표발의)(의안번호 2204228) / 새마을금고법 일부개정법률안(김상욱 의원 대표발의)(의안번호 2202621) / 새마을금고법 일부개정법률안(이성권 의원 대표발의)(의안번호 2204285) / 새마을금고법 일부개정법률안(윤건영 의원 대표발의)(의안번호 2201735) / 새마을금고법 일부개정법률안(박성민 의원 대표발의)(의안번호 2201692) / 새마을금고법 일부개정법률안(신정훈 의원 대표발의)(의안번호 2204978) / 새마을금고법 일부개정법률안(대안) / 여수·순천 10·19사건 진상규명 및 희생자 명예회복에 관한 특별법 일부개정법률안(김문수 의원 대표발의)(의안번호 2200872) / 여수·순천 10·19사건 진상규명 및 희생자 명예회복에 관한 특별법 일부개정법률안(주철현 의원 대표발의)(의안번호 2202374) / 여수·순천 10·19사건 진상규명 및 희생자 명예회복에 관한 특별법 일부개정법률안(용혜인 의원 대표발의)(의안번호 2203583) / 여수·순천 10·19사건 진상규명 및 희생자 명예회복에 관한 특별법 일부개정법률안(권향엽 의원 대표발의)(의안번호 2204406) / 여수·순천 10·19사건 진상규명 및 희생자 명예회복에 관한 특별법 일부개정법률안(대안) / 인구감소지역 지원 특별법 일부개정법률안(한병도 의원 대표발의)(의안번호 2200232) / 전자정부법 일부개정법률안(배준영 의원 대표발의)(의안번호 2203398) / 전자정부법 일부개정법률안(양부남 의원 대표발의)(의안번호 2203797) / 전자정부법 일부개정법률안(대안) / 지방공기업법 일부개정법률안(이상식 의원 대표발의)(의안번호 2202789) / 공무원 재해보상법 일부개정법률안(유용원 의원 대표발의)(의안번호 2200953) / 공무원 재해보상법 일부개정법률안(박대출 의원 대표발의)(의안번호 2201105) / 공무원 재해보상법 일부개정법률안(김상욱 의원 대표발의)(의안번호 2201700) / 공무원 재해보상법 일부개정법률안(강선영 의원 대표발의)(의안번호 2202589) / 공무원 재해보상법 일부개정법률안(권향엽 의원 대표발의)(의안번호 2203307) / 공무원 재해보상법 일부개정법률안(대안) / 공무원연금법 일부개정법률안(박대출 의원 대표발의)(의안번호 2201104) / 공무원연금법 일부개정법률안(김상욱 의원 대표발의)(의안번호 2201702) / 공무원연금법 일부개정법률안(강선영 의원 대표발의)(의안번호 2202590) / 공무원연금법 일부개정법률안(대안) / 국가공무원법 일부개정법률안(정부 제출)(의안번호 2201083) / 국가공무원법 일부개정법률안(양부남 의원 대표발의)(의안번호 2201234) / 국가공무원법 일부개정법률안(양부남 의원 대표발의)(의안번호 2201267) / 국가공무원법 일부개정법률안(김태년 의원 대표발의)(의안번호 2205131) / 국가공무원법 일부개정법률안(대안) / 지방공무원법 일부개정법률안(정부 제출)(의안번호 2201202) / 지방공무원법 일부개정법률안(양부남 의원 대표발의)(의안번호 2201236) / 지방공무원법 일부개정법률안(양부남 의원 대표발의)(의안번호 2201268) / 지방공무원법 일부개정법률안(김태년 의원 대표발의)(의안번호 2205136) / 지방공무원법 일부개정법률안(대안) / 재난 및 안전관리 기본법 일부개정법률안(정부 제출)(의안번호 2201324) / 재난 및 안전관리 기본법 일부개정법률안(박성훈 의원 대표발의)(의안번호 2203000) / 재난 및 안전관리 기본법 일부개정법률안(김선교 의원 대표발의)(의안번호 2203326) / 재난 및 안전관리 기본법 일부개정법률안(이달희 의원 대표발의)(의안번호 2205588) / 재난 및 안전관리 기본법 일부개정법률안(조은희 의원 대표발의)(의안번호 2205777) / 재난 및 안전관리 기본법 일부개정법률안(대안) / 자연재해대책법 일부개정법률안(정부 제출)(의안번호 2201199) / 공직선거법 일부개정법률안(한병도 의원 대표발의)(의안번호 2200354) / 공직선거법 일부개정법률안(한병도 의원 대표발의)(의안번호 2200816) / 공직선거법 일부개정법률안(채현일 의원 대표발의)(의안번호 2203628) / 공직선거법 일부개정법률안(대안) / 경비업법 일부개정법률안(한병도 의원 대표발의)(의안번호 2201298) / 경비업법 일부개정법률안(김석기 의원 대표발의)(의안번호 2201900) / 경비업법 일부개정법률안(김종양 의원 대표발의)(의안번호 2205734) / 경비업법 일부개정법률안(대안) / 경찰공무원법 일부개정법률안(한병도 의원 대표발의)(의안번호 2202548) / 도로교통법 일부개정법률안(박성훈 의원 대표발의)(의안번호 2203909) / 도로교통법 일부개정법률안(김종양 의원 대표발의)(의안번호 2204080) / 도로교통법 일부개정법률안(김종양 의원 대표발의)(의안번호 2203991) / 도로교통법 일부개정법률안(대안) / 총포·도검·화약류 등의 안전관리에 관한 법률 일부개정법률안(박정현 의원 대표발의)(의안번호 2202555) / 총포·도검·화약류 등의 안전관리에 관한 법률 일부개정법률안(고동진 의원 대표발의)(의안번호 2202452) / 총포·도검·화약류 등의 안전관리에 관한 법률 일부개정법률안(모경종 의원 대표발의)(의안번호 2202454) / 총포·도검·화약류 등의 안전관리에 관한 법률 일부개정법률안(박주민 의원 대표발의)(의안번호 2202534) / 총포·도검·화약류 등의 안전관리에 관한 법률 일부개정법률안(민홍철 의원 대표발의)(의안번호 2202574) / 총포·도검·화약류 등의 안전관리에 관한 법률 일부개정법률안(임이자 의원 대표발의)(의안번호 2202662) / 총포·도검·화약류 등의 안전관리에 관한 법률 일부개정법률안(진종오 의원 대표발의)(의안번호 2202880) / 총포·도검·화약류 등의 안전관리에 관한 법률 일부개정법률안(서일준 의원 대표발의)(의안번호 2203040) / 총포·도검·화약류 등의 안전관리에 관한 법률 일부개정법률안(박충권 의원 대표발의)(의안번호 2203939) / 총포·도검·화약류 등의 안전관리에 관한 법률 일부개정법률안(대안) / 소방공무원 보건안전 및 복지 기본법 일부개정법률안(이상식 의원 대표발의)(의안번호 2202021) / 소방공무원 보건안전 및 복지 기본법 일부개정법률안(이성권 의원 대표발의)(의안번호 2205432) / 소방공무원 보건안전 및 복지 기본법 일부개정법률안(대안) / 소방기본법 일부개정법률안(이상식 의원 대표발의)(의안번호 2202998),(10시18분),"존경하는 신정훈 행정안전위원회 위원장님 그리고 위원님 여러분!
 오늘 행정안전위원회에서는 소방공무원에 대한 역학조사를 보다 효과적으로 하는 소방공무원 보건안전 및 복지 기본법 일부개정법률안과 소방안전교육 대상을 확장하여 안전관리를 강화하는 내용의 소방기본법 일부개정법률안을 의결하여 주셨습니다.
 바쁘신 일정에도 불구하고 법안심사에 힘써 주신 위원님들께 진심으로 감사의 말씀을 드립니다.
 오늘 의결된 법안이 잘 시행될 수 있도록 후속조치에도 최선을 다하겠습니다.
 감사합니다."
418,정기회,제13호,2024년 11월 28일(목),37,신정훈,위원장,(전남 나주시화순군),6713,"1,2,3,4,5,6,7,8,9,10,11,12,13,14,15,16,17,18,19,20,21,22,23,24,25,26,27,28,29,30,31,32,33,34,35,36,37,38,39,40,41,42,43,44,45,46,47,48,49,50,51,52,53,54,55,56,57,58,59,60,61,62,63,64,65,66,67,68,69,70,71",새마을금고법 일부개정법률안(이성권 의원 대표발의)(의안번호 2204228) / 새마을금고법 일부개정법률안(김상욱 의원 대표발의)(의안번호 2202621) / 새마을금고법 일부개정법률안(이성권 의원 대표발의)(의안번호 2204285) / 새마을금고법 일부개정법률안(윤건영 의원 대표발의)(의안번호 2201735) / 새마을금고법 일부개정법률안(박성민 의원 대표발의)(의안번호 2201692) / 새마을금고법 일부개정법률안(신정훈 의원 대표발의)(의안번호 2204978) / 새마을금고법 일부개정법률안(대안) / 여수·순천 10·19사건 진상규명 및 희생자 명예회복에 관한 특별법 일부개정법률안(김문수 의원 대표발의)(의안번호 2200872) / 여수·순천 10·19사건 진상규명 및 희생자 명예회복에 관한 특별법 일부개정법률안(주철현 의원 대표발의)(의안번호 2202374) / 여수·순천 10·19사건 진상규명 및 희생자 명예회복에 관한 특별법 일부개정법률안(용혜인 의원 대표발의)(의안번호 2203583) / 여수·순천 10·19사건 진상규명 및 희생자 명예회복에 관한 특별법 일부개정법률안(권향엽 의원 대표발의)(의안번호 2204406) / 여수·순천 10·19사건 진상규명 및 희생자 명예회복에 관한 특별법 일부개정법률안(대안) / 인구감소지역 지원 특별법 일부개정법률안(한병도 의원 대표발의)(의안번호 2200232) / 전자정부법 일부개정법률안(배준영 의원 대표발의)(의안번호 2203398) / 전자정부법 일부개정법률안(양부남 의원 대표발의)(의안번호 2203797) / 전자정부법 일부개정법률안(대안) / 지방공기업법 일부개정법률안(이상식 의원 대표발의)(의안번호 2202789) / 공무원 재해보상법 일부개정법률안(유용원 의원 대표발의)(의안번호 2200953) / 공무원 재해보상법 일부개정법률안(박대출 의원 대표발의)(의안번호 2201105) / 공무원 재해보상법 일부개정법률안(김상욱 의원 대표발의)(의안번호 2201700) / 공무원 재해보상법 일부개정법률안(강선영 의원 대표발의)(의안번호 2202589) / 공무원 재해보상법 일부개정법률안(권향엽 의원 대표발의)(의안번호 2203307) / 공무원 재해보상법 일부개정법률안(대안) / 공무원연금법 일부개정법률안(박대출 의원 대표발의)(의안번호 2201104) / 공무원연금법 일부개정법률안(김상욱 의원 대표발의)(의안번호 2201702) / 공무원연금법 일부개정법률안(강선영 의원 대표발의)(의안번호 2202590) / 공무원연금법 일부개정법률안(대안) / 국가공무원법 일부개정법률안(정부 제출)(의안번호 2201083) / 국가공무원법 일부개정법률안(양부남 의원 대표발의)(의안번호 2201234) / 국가공무원법 일부개정법률안(양부남 의원 대표발의)(의안번호 2201267) / 국가공무원법 일부개정법률안(김태년 의원 대표발의)(의안번호 2205131) / 국가공무원법 일부개정법률안(대안) / 지방공무원법 일부개정법률안(정부 제출)(의안번호 2201202) / 지방공무원법 일부개정법률안(양부남 의원 대표발의)(의안번호 2201236) / 지방공무원법 일부개정법률안(양부남 의원 대표발의)(의안번호 2201268) / 지방공무원법 일부개정법률안(김태년 의원 대표발의)(의안번호 2205136) / 지방공무원법 일부개정법률안(대안) / 재난 및 안전관리 기본법 일부개정법률안(정부 제출)(의안번호 2201324) / 재난 및 안전관리 기본법 일부개정법률안(박성훈 의원 대표발의)(의안번호 2203000) / 재난 및 안전관리 기본법 일부개정법률안(김선교 의원 대표발의)(의안번호 2203326) / 재난 및 안전관리 기본법 일부개정법률안(이달희 의원 대표발의)(의안번호 2205588) / 재난 및 안전관리 기본법 일부개정법률안(조은희 의원 대표발의)(의안번호 2205777) / 재난 및 안전관리 기본법 일부개정법률안(대안) / 자연재해대책법 일부개정법률안(정부 제출)(의안번호 2201199) / 공직선거법 일부개정법률안(한병도 의원 대표발의)(의안번호 2200354) / 공직선거법 일부개정법률안(한병도 의원 대표발의)(의안번호 2200816) / 공직선거법 일부개정법률안(채현일 의원 대표발의)(의안번호 2203628) / 공직선거법 일부개정법률안(대안) / 경비업법 일부개정법률안(한병도 의원 대표발의)(의안번호 2201298) / 경비업법 일부개정법률안(김석기 의원 대표발의)(의안번호 2201900) / 경비업법 일부개정법률안(김종양 의원 대표발의)(의안번호 2205734) / 경비업법 일부개정법률안(대안) / 경찰공무원법 일부개정법률안(한병도 의원 대표발의)(의안번호 2202548) / 도로교통법 일부개정법률안(박성훈 의원 대표발의)(의안번호 2203909) / 도로교통법 일부개정법률안(김종양 의원 대표발의)(의안번호 2204080) / 도로교통법 일부개정법률안(김종양 의원 대표발의)(의안번호 2203991) / 도로교통법 일부개정법률안(대안) / 총포·도검·화약류 등의 안전관리에 관한 법률 일부개정법률안(박정현 의원 대표발의)(의안번호 2202555) / 총포·도검·화약류 등의 안전관리에 관한 법률 일부개정법률안(고동진 의원 대표발의)(의안번호 2202452) / 총포·도검·화약류 등의 안전관리에 관한 법률 일부개정법률안(모경종 의원 대표발의)(의안번호 2202454) / 총포·도검·화약류 등의 안전관리에 관한 법률 일부개정법률안(박주민 의원 대표발의)(의안번호 2202534) / 총포·도검·화약류 등의 안전관리에 관한 법률 일부개정법률안(민홍철 의원 대표발의)(의안번호 2202574) / 총포·도검·화약류 등의 안전관리에 관한 법률 일부개정법률안(임이자 의원 대표발의)(의안번호 2202662) / 총포·도검·화약류 등의 안전관리에 관한 법률 일부개정법률안(진종오 의원 대표발의)(의안번호 2202880) / 총포·도검·화약류 등의 안전관리에 관한 법률 일부개정법률안(서일준 의원 대표발의)(의안번호 2203040) / 총포·도검·화약류 등의 안전관리에 관한 법률 일부개정법률안(박충권 의원 대표발의)(의안번호 2203939) / 총포·도검·화약류 등의 안전관리에 관한 법률 일부개정법률안(대안) / 소방공무원 보건안전 및 복지 기본법 일부개정법률안(이상식 의원 대표발의)(의안번호 2202021) / 소방공무원 보건안전 및 복지 기본법 일부개정법률안(이성권 의원 대표발의)(의안번호 2205432) / 소방공무원 보건안전 및 복지 기본법 일부개정법률안(대안) / 소방기본법 일부개정법률안(이상식 의원 대표발의)(의안번호 2202998),(10시18분),"수고하셨습니다.
 이어서 법률안 상정 순서인데요."
