session,session_type,meeting_no,date,speech_order,speaker_name,speaker_position,speaker_area,data_mem_id,agenda_item_orders,agenda_item_titles,agenda_item_times,speech_text
418,정기회,제11호,2024년 11월 14일(목),1,신정훈,위원장,(전남 나주시화순군),6713,,,,"의석을 정돈해 주시기 바랍니다.
 성원이 되었으므로 제418회 국회(정기회) 제11차 행정안전위원회를 개회하겠습니다."
418,정기회,제11호,2024년 11월 14일(목),2,이광희,위원,(충북 청주시서원구),6570,,,,"위원장님, 진행발언 있습니다.
 지금 쉬었다가 하는 회의라서……"
418,정기회,제11호,2024년 11월 14일(목),3,신정훈,위원장,(전남 나주시화순군),6713,,,,지금 의사진행발언하시겠습니까?
418,정기회,제11호,2024년 11월 14일(목),4,이광희,위원,(충북 청주시서원구),6570,,,,"예, 그렇습니다."
418,정기회,제11호,2024년 11월 14일(목),5,신정훈,위원장,(전남 나주시화순군),6713,,,,"예, 이광희 위원님."
418,정기회,제11호,2024년 11월 14일(목),6,이광희,위원,(충북 청주시서원구),6570,,,,"청주 서원구 이광희입니다.
 오늘 회의는 정상적으로 진행되면 안 되는 이유를 말씀드리겠습니다.
 조지호 경찰청장이 취임 한 달 후였던 지난 9월 11일 금융노조 집회에 경찰은 방패로 집회 참가자를 밀치고 압박해서 부상을 입혔습니다. 박홍배 의원이 그 과정에서 부상을 입었습니다.
 우리 위원회는 현안 질의에서 혹은 국정감사에서 이 문제를 지적하고 사과와 재발 방지 대책을 강력하게 요구를 했습니다. 그런데 어느 누구도 사과하지 않았습니다. 오히려 국정감사 과정에서 서울청 경비계장은 국민의 대리인인 국회의원의 질의와 재발 방지 약속에 대해 성의 없이 답변하고 거짓말까지 하면서 국회를 모욕한 바 있습니다. 저는 이때 제대로 된 재발 방지 약속과 사과를 받아내지 못했기 때문에 지난 9일과 10일 사태가 발생했다고 생각합니다.
 지난 9일 윤석열 대통령 퇴진 총궐기에 특수진압복과 삼단봉 그리고 방패로 무장한 진압경찰을 투입하여 집회 참가자 10여 명을 연행을 하는 광경을 목격을 했습니다. 이 중 4명에 대해서 경찰은 구속영장을 신청했지만 모두 기각되고 오히려 경찰의 무리한 법 집행이 증명이 된 바 있습니다.
 또한 지난 10일 부경대에서 윤석열 퇴진 서명운동이라는 정당한 학생들의 정치 참여 행동을 한 학생 9명을 200여 명의 경력을 투입해 연행했습니다. 이는 우리 국민의 민주주의 의식을 경시하고 낮춰 보고 거의 경멸에 가깝게 한 행동이라고 저는 생각합니다.
 2016년 촛불혁명 당시 수백만 명이 광장에 나와도 평화롭고 안전한 집회 문화를 만들어 왔던 게 우리 국민이고 그 과정에서 함께했었던 게 경찰이었습니다. 국민이 함께 100만여 명이 넘게 모이는 것에 대해서 오히려 경찰은 최소한의 안전조치만으로도 우리는 함께 그 거대한 혁명을 일궈 낼 수 있었습니다.
 하지만 조지호 경찰청장이 취임한 이후 달라졌습니다. 국민의 입을 틀어막으려는 윤석열 정부의 기조에 맞춰 가고 있다고 저는 생각합니다.
 경찰의 비극적인 역사가 떠오릅니다. 조선총독부의 앞잡이로 독립운동가와 민중을 탄압한 경찰이 다시 독재에 부역하며 민주화운동과 민중을 탄압했던 역사로 이어졌습니다.
 경찰은 다시 공안 통치의 도구가 될 것인지, 정권의 몽둥이가 되어서 국민을 탄압할 것인지 조지호 청장은 결정하시길 바랍니다.
 오늘 이 자리에서 사과하고 재발 방지 약속을 하지 않는다면 경찰은 국민의 경찰임을 포기하는 것으로 간주하고 경찰청장의 진심 어린 사과가 있을 때까지, 재발 방지 약속을 할 때까지 모든 예산심의 절차를 중단할 것을 위원장님한테 강력하게 요청드립니다.
 이상입니다."
418,정기회,제11호,2024년 11월 14일(목),7,김상욱,위원,(울산 남구갑),6843,,,,저도 좀 의사진행발언하겠습니다.
418,정기회,제11호,2024년 11월 14일(목),8,신정훈,위원장,(전남 나주시화순군),6713,,,,"그러면 먼저 김상욱 위원님.
 이렇게 하겠습니다. 이거 끝도 없이 계속하는 것보다는요 야당에서 한두 분 그리고 여당에서 한두 분 이렇게 하고 정리를 좀 하겠습니다.
 김상욱 위원님."
418,정기회,제11호,2024년 11월 14일(목),9,김상욱,위원,(울산 남구갑),6843,,,,"울산 남구갑 김상욱입니다.
 이번 시위 과정에서 부상자가 발생을 하고 또 서로 간에 대치가 있었던 점은 참 안타까운 일인 건 분명한 사실인 것 같습니다.
 저도 지난번 행안위 전체회의 때 존경하는 민주당 위원님들 제기했던 문제에 대해서 도대체 어떤 일이 있었는지 저대로도 경찰관들 얘기도 들어 보고 여기저기 얘기를 좀 많이 들어 봤는데요.
 그 말씀을 좀 드리고 싶습니다. 안타까운 일을 정쟁에 이용하는 것은 국민들께 참 송구한 일이고 또 그 과정에서 다친 분들께도 송구한 일이라는 생각이 듭니다.
 이번 여러 명의 부상이 발생했던 이 사안을 보면 집회의 주최가 민주노총이었습니다. 특정 단체를 비하하는 것은 아닙니다만 우리 민주노총이 좀 늘 폭력적인 방법과 또 다수의 위력을 과시해 왔다는 것은 다수의 국민들께서 알고 있는 사실입니다.
 특정 단체를 비하하는 것은 아니지만 민주노총은 늘 다소 폭력적인 방법을 취해 왔고 그 과정에서 부상자나 아니면 좀 이렇게 다치는 사람들이 생기면 이것을 또 정치적 목적으로 이용을 해 온 전례가 있는 곳입니다.
 저도 전투경찰 생활을 해 봤지만 현장에 나가 있는 경찰들 참 두렵습니다. 시위대가 특히 이렇게 좀 폭력을 과시하거나 이런 시위대를 맞닥뜨리면 시위 진압경찰들도 상당한 신체의 위협을 느끼고 두려움에 빠지는 경우가 많습니다, 저도 그런 두려움을 느꼈었고. 그렇게 시위대가 폭력을 행사할 때 정말 최소한의 방어는 필요한 상황입니다.
 이번에 진압경찰들이 무장을 했다고 하는데 상대가 민주노총이 진행하는 집회에서 경찰이 최소한의 방어 도구조차 취하지 않는다면 그 현장에 있는 경찰들이 느끼는 두려움은 엄청날 것이라 생각합니다. 어떻게 보면 안전보호 장비를 착용한다는 것은 상식적인 조치이지 않는가라는 생각이 들고요.
 또 실질적으로 경찰들이 정말 많이 다쳤습니다. 그것도 사전에 약속된 집회 장소, 더해서 편의도 많이 봐줬음에도 불구하고 그런 약속들을 어겨서 좀 위력적인, 폭력적인 시위로 나가는 곳, 이것을 위력·폭력 시위로부터 시민들을 지키는 것도 경찰들의 역할입니다.
 그 역할을 수행하는 과정에서 경찰들이 105명이나 다쳤습니다. 내용을 보면 찰과상 35명, 타박상 25명, 염좌 8명, 호흡곤란 5명, 인대파열 4명, 우리 대한민국의 경찰관들이 보호장구를 갖췄음에도 불구하고 이렇게 많이 다쳤습니다. 그런데 이것을 경찰이 폭력진압을 했다라고 단정할 수 있을지 저는 의문입니다. 만약에 폭력진압을 했다면 시위대가 훨씬 많이 다쳤어야겠지요.
 그리고 또 진압을 했다면 예전에 약속되었던 시위 장소에 이런 집회·시위를 보장하지 않았어야 되는 문제인데 그런 문제가 아니라 약속된 집회·시위는 보장을 했는데 넘어서서 시민들께 위해가 가는 것을 막는 과정에서 경찰들이 보호장구를 착용했음에도 불구하고 이렇게 많이 다쳤습니다.
 그러면 저는 그렇게 생각합니다. 사태의 본질은 집회를 주최했던 측과 경찰에서 이를 관리하는 정보과에서 충분한 소통이 없었거나 또는 무리하게 집회를 추진했던 측의 책임도 분명히 있다고 생각을 합니다.
 그런데 그렇다고 그러면 저는 생각합니다. 이런 안타까운 일에 대해서 유감 표명을 해야 될 곳은 집회를 주최했던 측과 또 이를 관리하는 경찰 양쪽에서 유감 표명을 하면서 향후에는 집회에 참석하시는 분들에게 위해가 되는 일이나 또는 공무를 수행하는 경찰관들이 다수가 다치는 일이 발생하지 않도록 서로 간에 집회 장소와 집회 진행방향에 대해서 충분히 상의하고 논의하겠다라는 약속을 하는 것이 맞지 않냐는 생각입니다. 그것이 아니라 이것을 가지고 사과를 하라고 하는 것은 이 공무를 담당했던 경찰관들의 사기에도 지대한 영향을 미치는 일이고 문제가 있는 부분이라는 생각이 좀 들고요.
 저희가 지금 예산심의를 앞두고 있습니다. 예산심의 시간도 별로 없습니다. 자꾸 늦춰, 늦춰 해 버리면 2025년도 우리 행정안전부와 경찰·소방의 예산을 적절하게 심의할 수가 없습니다. 이 문제 때문에 우리 예산심의를 자꾸 미뤄서 될 문제는 아니라고 생각하고요.
 이 집회로 인해서 다친 부분들에 대해서는 양쪽에서 유감 표명을 하면 될 일이고, 우리는 우리 국회의원의 본연의 일인 예산심의에 집중해서 국가 예산이 낭비되지 않고 잘 사용되도록 우리 일을 했으면 좋겠습니다.
 이상입니다."
418,정기회,제11호,2024년 11월 14일(목),10,채현일,위원,(서울 영등포구갑),6576,,,,위원장님.
418,정기회,제11호,2024년 11월 14일(목),11,신정훈,위원장,(전남 나주시화순군),6713,,,,다음은 채현일 위원님 발언해 주시기 바랍니다.
418,정기회,제11호,2024년 11월 14일(목),12,채현일,위원,(서울 영등포구갑),6576,,,,"지난 12일 윤석열 정권 퇴진 집회에 참석한 조합원 4명에 대한 구속영장 신청이 모두 기각됐습니다. 구속할 필요성도, 타당성도 인정되지 않는다는 게 법원의 결론이었습니다. 지난 행안위 전체회의에서 조지호 청장은 경찰의 과잉진압을 극구 부정하고 사과까지 거부했지만 이제는 궁색한 변명이 됐습니다.
 윤석열 정권 퇴진 집회, 부경대 대학생 시위에서 보여 준 경찰의 모습은 그야말로 40년 전 1980년대 군사독재정권 시절을 연상케 합니다. 국민의 안전은 안중에도 없고 그저 권력의 심기와 안위를 지키고 김건희 여사를 보호하기 위해 공권력을 남용하고 더 나아가 국정농단, 정권의 위기를 모면하기 위한 공안정국을 조성한 것이라고 볼 수 있습니다. 지지율 17% 정부를 향한 국민의 분노, 공정과 상식, 자유민주주의를 향한 국민주권의 외침이 정녕 들리지 않는 겁니까?
 위원장님, 대한민국헌법 제21조는 모든 국민은 집회·결사의 자유를 가진다고 규정하고 있습니다. 법치주의 국가에서 헌법이란 그 어떤 법도 거스를 수 없는 최상위 법입니다. 국가의 어떤 공권력도 침범할 수 없는 최상의 가치입니다.
 헌법을 수호하고 국민의 권익과 집회·결사의 자유를 지키는 일은 국회의 당연한 책무입니다. 이에 우리 행정안전위원회 차원에서 경찰의 과잉·폭력진압에 대한 조지호 경찰청장의 진정성 있는 사과 그리고 재발방지를 명확히 다시 요구해야 합니다.
 그리고 향후에 공권력 남용에 대해서는 추후라도 반드시 책임을 물어야 한다는 말씀을 드립니다.
 이상입니다."
418,정기회,제11호,2024년 11월 14일(목),13,신정훈,위원장,(전남 나주시화순군),6713,,,,김종양 위원님 발언해 주십시오.
418,정기회,제11호,2024년 11월 14일(목),14,김종양,위원,(경남 창원시의창구),6801,,,,"사실 의사진행과 썩 관계도 없는 그런 내용 가지고 우리가 지난번에도 의사진행한다고 그러면서 제대로 예산심의도 못 하고 파행을 거쳤고 오늘 또 똑같은 문제를 가지고 이렇게 시작하는 것에 대해서 상당히 유감스럽게 생각을 합니다. 지금 일정이 촉박한데도 불구하고 우리 행안위 소관 예산심의도 못 하고 있는 데 대해서 정말 너무 안타깝다는 생각이 들고요.
 그리고 지금 야당 위원들이 주장하고 있는 집회 관련해서는 헌법상 보장된 집회·결사의 자유를 침해하는 것도 아닙니다. 신고한 집회에 대해서 하도록 허락을 했습니다. 했는데, 원래 내용대로 집회를 진행하지 않았기 때문에 수회에 걸쳐서 경고, 인내를 했는데도 불구하고 더 큰 위험을 예방하기 위해 가지고 부득불 경찰력을 행사한 거라고 봅니다.
 그러면 우리 경찰에게, 경찰청장한테 법대로 법을 집행하지 말라는 겁니까? 과격한 불법행위를 눈앞에 보고도 그냥 가만히 기다리고 때리면 맞고, 공권력이 그렇게 있으라는 겁니까? 왜 그렇게 민주당은 이중적 잣대를 보입니까?
 지금 우리 22대 국회에서 내가 가장 많이 듣는 말이 ‘법대로’입니다, ‘법대로’. 다수의 독주를 내세우기 위해 가지고 ‘법대로’를 핑계로 지금 마음대로 하고 있는 것 아닙니까. 정작 ‘법대로’를 해야 될 사람은 우리 경찰입니다, 경찰. 우리 국회에서는 다소 법대로 하지 않고 타협과 협상이 필요합니다. 그렇지만 경찰은 엄정한 법 집행이 요구되는 그런 위치에 있는 사람들입니다. 그런 사람한테 제발 제대로 법대로 엄격한 법 집행을 하라고 그렇게 이야기해야 될 텐데도 불구하고 수많은 군중들이 그렇게 경찰에 대해서 폭력을 행사하는 그것을 갖다가 그냥 맞고 있으라, 절대 시위 참가한 사람들한테는 어떤 위해·위력도 가하지 말라는 그런 이야기를 주문하고 있습니까.
 그리고 그 당시에 왜 보수 집회에 대해서는 느슨하게 하고 민주노총 집회에 대해서는 중무장한 사람들이 나왔냐고 그렇게 이야기하는데요. 저도 오랫동안 경찰 생활을 하면서, 집회 참가자들의 집회·시위 전력 등을 감안해 가지고 배치 인력이라든지 동원 장비라든지 이런 것을 결정합니다. 사실 잘 아시잖아요. 민주노총이 그간에 집회 신고해 가지고 단 한 번이라도 신고된 내용대로 집회를 한 적이 있습니까?
 그렇기 때문에 많은 인력을 거기에 배치를 했고, 그렇기 때문에 일반 시민이 보기에는 다소 무거운 그런 장비를 가지고 나왔다고 그렇게 봅니다. 그런 것을 이해하도록, 상대방에 대해서 설득을 하도록, 모르는 시민들한테 설득을 하도록 그렇게 해야 되지요.
 그런데도 불구하고 경찰에 대해서 일방적으로 그렇게……"
418,정기회,제11호,2024년 11월 14일(목),15,신정훈,위원장,(전남 나주시화순군),6713,,,,정리해 주시지요.
418,정기회,제11호,2024년 11월 14일(목),16,김종양,위원,(경남 창원시의창구),6801,,,,이상한 논리로 일제 경찰 운운하고 공안정국 운운하고 충돌을 유도했다는 둥 이상한 조짐이라는 둥……
418,정기회,제11호,2024년 11월 14일(목),17,이광희,위원,(충북 청주시서원구),6570,,,,다른 위원 얘기 하지 마세요. 그냥 본인 얘기 하세요.
418,정기회,제11호,2024년 11월 14일(목),18,조은희,위원,(서울 서초구갑),6629,,,,위원님 얘기 할 때 우리는 가만히 있었습니다.
418,정기회,제11호,2024년 11월 14일(목),19,김종양,위원,(경남 창원시의창구),6801,,,,"이런 식으로 이야기를 해서는 안 된다는 겁니다.
 우리 경찰한테 제발 앞으로 지역사회 공공의 안녕질서 유지를 위해서 엄정하게 법 집행을 하라고 그렇게………"
418,정기회,제11호,2024년 11월 14일(목),20,이광희,위원,(충북 청주시서원구),6570,,,,"아니, 내가 조은희 위원 얘기 안 하지 않았습니까. 왜 함부로 그렇게……
 위원장님, 저……"
418,정기회,제11호,2024년 11월 14일(목),21,정춘생,위원,(비례대표),6855,,,,"제가 얘기할게요, 이광희 위원님."
418,정기회,제11호,2024년 11월 14일(목),22,김종양,위원,(경남 창원시의창구),6801,,,,"그렇게 주문을 해 주시기 바랍니다.
 그리고 오늘 예산 관련해서 우리 행안위 소집한 것 아닙니까. 그러니까 빨리 예산심의하도록 그렇게 위원장님, 좀 당부를 드립니다.
 감사합니다."
418,정기회,제11호,2024년 11월 14일(목),23,신정훈,위원장,(전남 나주시화순군),6713,,,,다음은 정춘생 위원님 발언해 주시기 바랍니다.
418,정기회,제11호,2024년 11월 14일(목),24,정춘생,위원,(비례대표),6855,,,,"조국혁신당 정춘생입니다.
 오늘은 예산심의로 바로 들어갔으면 하는 바람이었는데요, 그럴 수 없음에 굉장히 유감을 표합니다.
 어제, 11월 13일은 전태일 열사 54주기입니다. 그리고 민주노총·한국노총은 늘 해마다 그 시기 앞두고 주말에는 항상 민주적으로, 평화적으로 집회를 해 왔습니다. 지난주 주말도 그 연장선의 집회였습니다.
 그리고 불법집회가 아니었고 엄연히 신고가 됐고요. 가능한 한 많은 사람들이 모이다 보니까 예상 인원보다 많이 왔던 겁니다. 그게 나쁜 것은 아니지 않습니까? 그것을 가지고 불법이라고 할 수는 없고요. 평화적으로 시위 현장에 들어가려고 하는 과정에서 이동식 바리케이드를 치고 진입을 막는 과정에서 벌어진 일입니다. 그런 부분을 불법집회 운운하고 이런 부분은 틀렸기 때문에 저는 바로잡고 싶고요.
 분명하게 우리가 영상으로도 많이 확인했지만 그 진압 과정에서 경찰들의 폭력적인 모습들이 많이 목격이 됐습니다. 그래서 우리 행안위에서는 국민의 생명과 안전을 보장하고 집회·시위의 자유를 보장한다는 의미에서 관련 예산들, 경찰의 진압과 관련된 예산들을 징벌적으로 삭감할 필요가 있다 이렇게 생각합니다.
 이상입니다."
418,정기회,제11호,2024년 11월 14일(목),25,양부남,위원,(광주 서구을),6848,,,,"자료 요청 하나 하겠습니다, 자료 요청."
418,정기회,제11호,2024년 11월 14일(목),26,신정훈,위원장,(전남 나주시화순군),6713,,,,자료 요청요?
418,정기회,제11호,2024년 11월 14일(목),27,양부남,위원,(광주 서구을),6848,,,,5초면 끝납니다.
418,정기회,제11호,2024년 11월 14일(목),28,신정훈,위원장,(전남 나주시화순군),6713,,,,"예, 그렇게 하십시오."
418,정기회,제11호,2024년 11월 14일(목),29,양부남,위원,(광주 서구을),6848,,,,"경찰에서 지난 9일 숭례문 집회 관련해서 6명에 대해서 구속영장을 신청했습니다. 모두 다 기각됐습니다.
 그래서 이 구속영장 신청이 과연 적정한지를 본 위원이 판단하고 싶어서 자료 요청을 했는데 경찰에서는 개인정보법 운운하면서 자료제출을 거부하고 있습니다. 이 자료를 좀 받아 주시기를 위원장님께 부탁드립니다.
 이상입니다."
418,정기회,제11호,2024년 11월 14일(목),30,신정훈,위원장,(전남 나주시화순군),6713,,,,"양부남 위원님 말씀하신 경찰의 지난 토요일 집회에 대한 관리 또 최종적으로 관계자 처리방침에 대한 관련된 절차가 정당했는지에 대해서 경찰이 충분히 소명해야 된다고 생각합니다. 관련해서 관련 자료 본 위원회에 제출해 주실 것을 말씀드립니다.
 제가 정리를 좀……"
418,정기회,제11호,2024년 11월 14일(목),31,조은희,위원,(서울 서초구갑),6629,,,,"위원장님, 저도 자료 요청 있습니다. 말씀하시고 저도 자료 요청하겠습니다."
