session,session_type,meeting_no,date,speech_order,speaker_name,speaker_position,speaker_area,data_mem_id,agenda_item_orders,agenda_item_titles,agenda_item_times,speech_text
418,정기회,제1호,2024년 9월 2일(월),496,신정훈,위원장,(전남 나주시화순군),6713,148,2023회계연도 결산(의안번호 2200051) / 가. 행정안전부 / 나. 중앙선거관리위원회 / 다. 진실·화해를위한과거사정리위원회 / 라. 인사혁신처 / 마. 경찰청 / 바. 소방청,,"그리고 다수의 국민들이 그런 문제에 대해서 인정하고 있음에도 불구하고 그런 파격적인 인사 채용의 어떤 변경안이 되려면 충분히 외부의 의견을 듣고 또 국회의 의견을 듣고 이 문제가 처리돼야 되는데도 불구하고 내부에서 이렇게 무리하게, 해서는 안 된다고 지금 국회에서 여러 차례 제기하고 있는데, 내부에서도 반발을 하고 이렇게 반대에 부딪쳐 가지고 보류될 사항을 왜 추진하고 있어요?"
418,정기회,제1호,2024년 9월 2일(월),497,김용빈,중앙선거관리위원회사무총장,,0,148,2023회계연도 결산(의안번호 2200051) / 가. 행정안전부 / 나. 중앙선거관리위원회 / 다. 진실·화해를위한과거사정리위원회 / 라. 인사혁신처 / 마. 경찰청 / 바. 소방청,,지금 말씀드린 대로 작년 저희 국정감사라든지 현안질의 시간에 국회에서도 이 문제에 대해서 왜 개방…… 시도상임위원을 내부 인사로만 채우느냐라는……
418,정기회,제1호,2024년 9월 2일(월),498,신정훈,위원장,(전남 나주시화순군),6713,148,2023회계연도 결산(의안번호 2200051) / 가. 행정안전부 / 나. 중앙선거관리위원회 / 다. 진실·화해를위한과거사정리위원회 / 라. 인사혁신처 / 마. 경찰청 / 바. 소방청,,그게 문제의 본질입니까?
418,정기회,제1호,2024년 9월 2일(월),499,김용빈,중앙선거관리위원회사무총장,,0,148,2023회계연도 결산(의안번호 2200051) / 가. 행정안전부 / 나. 중앙선거관리위원회 / 다. 진실·화해를위한과거사정리위원회 / 라. 인사혁신처 / 마. 경찰청 / 바. 소방청,,"예, 그 부분 때문에……"
418,정기회,제1호,2024년 9월 2일(월),500,신정훈,위원장,(전남 나주시화순군),6713,148,2023회계연도 결산(의안번호 2200051) / 가. 행정안전부 / 나. 중앙선거관리위원회 / 다. 진실·화해를위한과거사정리위원회 / 라. 인사혁신처 / 마. 경찰청 / 바. 소방청,,그게 문제의 본질이에요?
418,정기회,제1호,2024년 9월 2일(월),501,김용빈,중앙선거관리위원회사무총장,,0,148,2023회계연도 결산(의안번호 2200051) / 가. 행정안전부 / 나. 중앙선거관리위원회 / 다. 진실·화해를위한과거사정리위원회 / 라. 인사혁신처 / 마. 경찰청 / 바. 소방청,,"예, 맞습니다."
418,정기회,제1호,2024년 9월 2일(월),502,신정훈,위원장,(전남 나주시화순군),6713,148,2023회계연도 결산(의안번호 2200051) / 가. 행정안전부 / 나. 중앙선거관리위원회 / 다. 진실·화해를위한과거사정리위원회 / 라. 인사혁신처 / 마. 경찰청 / 바. 소방청,,무슨 소리예요?
418,정기회,제1호,2024년 9월 2일(월),503,김용빈,중앙선거관리위원회사무총장,,0,148,2023회계연도 결산(의안번호 2200051) / 가. 행정안전부 / 나. 중앙선거관리위원회 / 다. 진실·화해를위한과거사정리위원회 / 라. 인사혁신처 / 마. 경찰청 / 바. 소방청,,"아니, 그 지적을 받았기 때문에, 법상·제도상 열려 있는 것이니까 그러면 열어서 내부 인사와 외부 인사를 가리지 말고 적임자를 선정하는 것도 어떠냐라는 식의 제도 개선안이 마련된 것뿐이고요.
 지금 위원장님한테 말씀드렸다시피 이게 확정적인 안이 아니라고 제가 말씀드리지 않았습니까? 그리고……"
418,정기회,제1호,2024년 9월 2일(월),504,신정훈,위원장,(전남 나주시화순군),6713,148,2023회계연도 결산(의안번호 2200051) / 가. 행정안전부 / 나. 중앙선거관리위원회 / 다. 진실·화해를위한과거사정리위원회 / 라. 인사혁신처 / 마. 경찰청 / 바. 소방청,,"보류하셔야 됩니다. 지금 거기에 대한 충분한 근거 또 여론 그것 일방적으로 해석해 가지고 그런 무리한 일을 하다가 내부에서부터 반발에 지금 직면해 있는데 그런 정치적인…… 엄정한 헌법기관으로서 중립성을 유지하고 있는 것이 외부 인사를 채용함으로써 발생할 수 있는 우려와 국민적 오해에 대해서 정말 신중한, 신중한 검토를 다시 한번 촉구합니다."
418,정기회,제1호,2024년 9월 2일(월),505,김용빈,중앙선거관리위원회사무총장,,0,148,2023회계연도 결산(의안번호 2200051) / 가. 행정안전부 / 나. 중앙선거관리위원회 / 다. 진실·화해를위한과거사정리위원회 / 라. 인사혁신처 / 마. 경찰청 / 바. 소방청,,"예, 알겠습니다. 위원장님 충분한 우려를 잘 받아들이고 있습니다."
418,정기회,제1호,2024년 9월 2일(월),506,조은희,위원,(서울 서초구갑),6629,148,2023회계연도 결산(의안번호 2200051) / 가. 행정안전부 / 나. 중앙선거관리위원회 / 다. 진실·화해를위한과거사정리위원회 / 라. 인사혁신처 / 마. 경찰청 / 바. 소방청,,이 부분에 대해서 의사진행발언……
418,정기회,제1호,2024년 9월 2일(월),507,신정훈,위원장,(전남 나주시화순군),6713,148,2023회계연도 결산(의안번호 2200051) / 가. 행정안전부 / 나. 중앙선거관리위원회 / 다. 진실·화해를위한과거사정리위원회 / 라. 인사혁신처 / 마. 경찰청 / 바. 소방청,,이것은 조금 넘어가시지요.
418,정기회,제1호,2024년 9월 2일(월),508,조은희,위원,(서울 서초구갑),6629,148,2023회계연도 결산(의안번호 2200051) / 가. 행정안전부 / 나. 중앙선거관리위원회 / 다. 진실·화해를위한과거사정리위원회 / 라. 인사혁신처 / 마. 경찰청 / 바. 소방청,,다음에 말씀드리겠습니다. 좀 일방적인 것 같아서 그렇습니다.
418,정기회,제1호,2024년 9월 2일(월),509,신정훈,위원장,(전남 나주시화순군),6713,148,2023회계연도 결산(의안번호 2200051) / 가. 행정안전부 / 나. 중앙선거관리위원회 / 다. 진실·화해를위한과거사정리위원회 / 라. 인사혁신처 / 마. 경찰청 / 바. 소방청,,"저는 일방적이라고 생각하지 않습니다. 이 문제는 다시 안건을 가지고 충분히 토론하겠다면 또 그런 자리를 만들 수 있도록 그렇게 하겠습니다. 다시 한번 국회, 국민들의……"
418,정기회,제1호,2024년 9월 2일(월),510,조은희,위원,(서울 서초구갑),6629,148,2023회계연도 결산(의안번호 2200051) / 가. 행정안전부 / 나. 중앙선거관리위원회 / 다. 진실·화해를위한과거사정리위원회 / 라. 인사혁신처 / 마. 경찰청 / 바. 소방청,,그런데 위원장님께서 일부 위원의 질의에 지금 가르마를 타시기 때문에 그렇습니다.
418,정기회,제1호,2024년 9월 2일(월),511,신정훈,위원장,(전남 나주시화순군),6713,148,2023회계연도 결산(의안번호 2200051) / 가. 행정안전부 / 나. 중앙선거관리위원회 / 다. 진실·화해를위한과거사정리위원회 / 라. 인사혁신처 / 마. 경찰청 / 바. 소방청,,"간사님, 지금 위원장이 최소한의, 이 문제에 대해서 답변을 하는 과정에서 답변을 못 하셨고 거기에 따르는 위원장으로서 제 이야기를 하는 겁니다. 사회자가 이 정도, 위원장이 위원장으로서 회의 진행권도 없다면 위원장 왜 합니까?
 다음 진행하도록 하겠습니다.
 다음은 존경하는 이달희 위원님 토론해 주시기 바랍니다."
418,정기회,제1호,2024년 9월 2일(월),512,이달희,위원,(비례대표),6767,148,2023회계연도 결산(의안번호 2200051) / 가. 행정안전부 / 나. 중앙선거관리위원회 / 다. 진실·화해를위한과거사정리위원회 / 라. 인사혁신처 / 마. 경찰청 / 바. 소방청,,"지방시대를 열어 가는 국민의힘 이달희 국회의원입니다.
 장관님, 요즘 대구·경북 지역민들이 관심이 많은 이슈에 대해서 제가 질문을 좀 하겠습니다.
 (영상자료를 보며)
 정부가 지금 미래지향적 지방행정체제 개편을 준비하고 있지요?"
418,정기회,제1호,2024년 9월 2일(월),513,이상민,행정안전부장관,,0,148,2023회계연도 결산(의안번호 2200051) / 가. 행정안전부 / 나. 중앙선거관리위원회 / 다. 진실·화해를위한과거사정리위원회 / 라. 인사혁신처 / 마. 경찰청 / 바. 소방청,,"예, 그렇습니다."
418,정기회,제1호,2024년 9월 2일(월),514,이달희,위원,(비례대표),6767,148,2023회계연도 결산(의안번호 2200051) / 가. 행정안전부 / 나. 중앙선거관리위원회 / 다. 진실·화해를위한과거사정리위원회 / 라. 인사혁신처 / 마. 경찰청 / 바. 소방청,,"도표 보시는 것처럼 전국적으로 지자체들이 다양한 형태의 행정체제 개편을 시도하고 있습니다. 행정체제 개편은 지방을 좀 더 큰 도시로 만들고 글로벌 경쟁력을 가지게 하는 세계적인 추세입니다. 프랑스도 2016년에 22개의 레지옹을 500만 메가시티로 해서 13개로 이렇게 통합한 예가 있고 그래서 글로벌 경쟁력을 높인 경우가 있습니다.
 우리나라는 지금 수도권 일극체제라 지방은 소멸하고 또 수도권의 과중한 집중으로 인해서 집값 상승하고 삶의 질 저하되고 이게 바로 인구 소멸의, 감소의 가장 핵심 원인으로 지금 자리 잡고 있습니다. 그래서 이 문제를 해결하기 위해서 국제적인 경쟁력을 갖춘 거점 도시들을 만들어서 수도권 일극체제에서 전국을 다극체제로 바꿔야 한다는 그런 여론들이 많아서 이 운동이 지금 시작된 것 같습니다.
 장관님께서도 대구·경북 행정 통합이 정부가 구상하는 행정체제 개편에 부합하다 이렇게 말씀하신 적도 있고요. 또 대구·경북의 행정 통합은…… 지금 부산·경남도 논의 중이다가 조금 중지하고 있고 대전·충남도 이렇게 중지하고 있는 게 사실이지요?"
418,정기회,제1호,2024년 9월 2일(월),515,이상민,행정안전부장관,,0,148,2023회계연도 결산(의안번호 2200051) / 가. 행정안전부 / 나. 중앙선거관리위원회 / 다. 진실·화해를위한과거사정리위원회 / 라. 인사혁신처 / 마. 경찰청 / 바. 소방청,,"예, 그렇습니다."
418,정기회,제1호,2024년 9월 2일(월),516,이달희,위원,(비례대표),6767,148,2023회계연도 결산(의안번호 2200051) / 가. 행정안전부 / 나. 중앙선거관리위원회 / 다. 진실·화해를위한과거사정리위원회 / 라. 인사혁신처 / 마. 경찰청 / 바. 소방청,,"대구·경북이 잘되면 이런 행정 통합의 견인차 역할을 할 수 있을 것이라고 생각됩니다. 
 그런데 최근에 우리 대구·경북의 행정 통합을 보면 2019년부터 대구·경북은 시도가 TF를 만들어서 추진해 오다 민선 8기 때 조금 주춤했습니다. 그리고 지난 5월에 경북도지사랑 대구시장이 이건 통합해야 우리 지역의 발전과 대한민국 전체의 발전이 있을 수 있다 해서 다시 시작했습니다. 그리고 대통령께서도 대구·경북 행정 통합에 적극 지원하라는 뉴스가 여러 번 나왔었습니다. 그리고 장관님께서도 6월 4일 날 장관님 그리고 지방시대위원장, 시장 그리고 도지사 이렇게 합쳐서 4자 회담을 하셨지요?"
418,정기회,제1호,2024년 9월 2일(월),517,이상민,행정안전부장관,,0,148,2023회계연도 결산(의안번호 2200051) / 가. 행정안전부 / 나. 중앙선거관리위원회 / 다. 진실·화해를위한과거사정리위원회 / 라. 인사혁신처 / 마. 경찰청 / 바. 소방청,,예.
418,정기회,제1호,2024년 9월 2일(월),518,이달희,위원,(비례대표),6767,148,2023회계연도 결산(의안번호 2200051) / 가. 행정안전부 / 나. 중앙선거관리위원회 / 다. 진실·화해를위한과거사정리위원회 / 라. 인사혁신처 / 마. 경찰청 / 바. 소방청,,거기에서 아주 적극 지원하겠다고 말씀하셨는데 지금 심정은 어떠십니까?
418,정기회,제1호,2024년 9월 2일(월),519,이상민,행정안전부장관,,0,148,2023회계연도 결산(의안번호 2200051) / 가. 행정안전부 / 나. 중앙선거관리위원회 / 다. 진실·화해를위한과거사정리위원회 / 라. 인사혁신처 / 마. 경찰청 / 바. 소방청,,더 잘 아시겠습니다만 지금 통합 논의가 약간 지지부진한 상황입니다. 그래서 조금 답답한 상황인데요. 그렇다고 해서 중앙정부가 너무 주도권을 쥐고서 하기보다는 그 두 자치단체가 먼저 큰 틀을 합의해 주면 그 이후에는 저희가 중앙정부에서 할 수 있는 최선을 다해서 지원을 하려고 생각을 하고 있습니다.
418,정기회,제1호,2024년 9월 2일(월),520,이달희,위원,(비례대표),6767,148,2023회계연도 결산(의안번호 2200051) / 가. 행정안전부 / 나. 중앙선거관리위원회 / 다. 진실·화해를위한과거사정리위원회 / 라. 인사혁신처 / 마. 경찰청 / 바. 소방청,,"장관님, 이렇게 몇 가지 포인트에서 두 시도가 조정되지 않는 사안이 있지 않습니까?"
418,정기회,제1호,2024년 9월 2일(월),521,이상민,행정안전부장관,,0,148,2023회계연도 결산(의안번호 2200051) / 가. 행정안전부 / 나. 중앙선거관리위원회 / 다. 진실·화해를위한과거사정리위원회 / 라. 인사혁신처 / 마. 경찰청 / 바. 소방청,,예.
418,정기회,제1호,2024년 9월 2일(월),522,이달희,위원,(비례대표),6767,148,2023회계연도 결산(의안번호 2200051) / 가. 행정안전부 / 나. 중앙선거관리위원회 / 다. 진실·화해를위한과거사정리위원회 / 라. 인사혁신처 / 마. 경찰청 / 바. 소방청,,그 사안이 한 서너 가지 되는 줄 아는데 어떤 거라고 알고 계십니까?
418,정기회,제1호,2024년 9월 2일(월),523,이상민,행정안전부장관,,0,148,2023회계연도 결산(의안번호 2200051) / 가. 행정안전부 / 나. 중앙선거관리위원회 / 다. 진실·화해를위한과거사정리위원회 / 라. 인사혁신처 / 마. 경찰청 / 바. 소방청,,"지금 통합되는, 명칭이 어떻게 될지 모르겠습니다마는 통합되는 청사를 몇 개를 어디에 둘 것이냐의 문제가 있고요. 그다음에 시군의 기능과 역할을 어떻게 할 것이냐, 이 두 가지가 지금 가장 큰 쟁점으로 알고 있습니다."
418,정기회,제1호,2024년 9월 2일(월),524,이달희,위원,(비례대표),6767,148,2023회계연도 결산(의안번호 2200051) / 가. 행정안전부 / 나. 중앙선거관리위원회 / 다. 진실·화해를위한과거사정리위원회 / 라. 인사혁신처 / 마. 경찰청 / 바. 소방청,,"이런 난항이 이렇게 조금, 잘 오다가 마지막 단계에서 조율 단계에 있습니다. 그런데 이럴 때에는 중앙정부가 무조건 합쳐서 와라보다는 중앙정부가 나서서 적극 조율해야 되지 않나 싶습니다.
 그리고 여러 가지 특례나 이런 부분도 잘 마련하셔서 양 기관 그리고 시도민들에게 제안을 잘 해서 이 부분을 조정해야 된다고 생각하는데요. 대구·경북 행정 통합 추진에 있어서 장관님 생각하고 계신 로드맵을 좀 알려 주시기 바랍니다."
418,정기회,제1호,2024년 9월 2일(월),525,이상민,행정안전부장관,,0,148,2023회계연도 결산(의안번호 2200051) / 가. 행정안전부 / 나. 중앙선거관리위원회 / 다. 진실·화해를위한과거사정리위원회 / 라. 인사혁신처 / 마. 경찰청 / 바. 소방청,,아까 위원님 말씀하신 그 4자 회동 당시에 올 연말 내지는 내년 초까지는 법안을 통과를 시키고 그다음에 26년 지방선거 때부터 통합자치단체가 출범한다라는 거였습니다. 그래서 지금 말씀 주신 바와 같이 통합의 이니셔티브와 자율성을 침해하지 않는 한도 내에서 중앙정부가 할 수 있는 일이 보다 적극적으로 무엇이 있을까 깊이 고민을 좀 더 해 보겠습니다.
418,정기회,제1호,2024년 9월 2일(월),526,이달희,위원,(비례대표),6767,148,2023회계연도 결산(의안번호 2200051) / 가. 행정안전부 / 나. 중앙선거관리위원회 / 다. 진실·화해를위한과거사정리위원회 / 라. 인사혁신처 / 마. 경찰청 / 바. 소방청,,"지금 이제부터 고민하시는 건가요? 그동안 마련된, 제가 보니까……"
418,정기회,제1호,2024년 9월 2일(월),527,이상민,행정안전부장관,,0,148,2023회계연도 결산(의안번호 2200051) / 가. 행정안전부 / 나. 중앙선거관리위원회 / 다. 진실·화해를위한과거사정리위원회 / 라. 인사혁신처 / 마. 경찰청 / 바. 소방청,,그동안 저희 생각은 갖고 있습니다만……
418,정기회,제1호,2024년 9월 2일(월),528,이달희,위원,(비례대표),6767,148,2023회계연도 결산(의안번호 2200051) / 가. 행정안전부 / 나. 중앙선거관리위원회 / 다. 진실·화해를위한과거사정리위원회 / 라. 인사혁신처 / 마. 경찰청 / 바. 소방청,,"248가지의 특례를, 지금 대구·경북에 그 특례가 주어지면 따라오는 다른 시도도 똑같이 적용되는 것 아닙니까?"
418,정기회,제1호,2024년 9월 2일(월),529,이상민,행정안전부장관,,0,148,2023회계연도 결산(의안번호 2200051) / 가. 행정안전부 / 나. 중앙선거관리위원회 / 다. 진실·화해를위한과거사정리위원회 / 라. 인사혁신처 / 마. 경찰청 / 바. 소방청,,"예, 그렇습니다."
418,정기회,제1호,2024년 9월 2일(월),530,이달희,위원,(비례대표),6767,148,2023회계연도 결산(의안번호 2200051) / 가. 행정안전부 / 나. 중앙선거관리위원회 / 다. 진실·화해를위한과거사정리위원회 / 라. 인사혁신처 / 마. 경찰청 / 바. 소방청,,중앙정부의 권한이 지방정부로 많이 이관되는 게 중심이지요?
418,정기회,제1호,2024년 9월 2일(월),531,이상민,행정안전부장관,,0,148,2023회계연도 결산(의안번호 2200051) / 가. 행정안전부 / 나. 중앙선거관리위원회 / 다. 진실·화해를위한과거사정리위원회 / 라. 인사혁신처 / 마. 경찰청 / 바. 소방청,,그렇습니다.
418,정기회,제1호,2024년 9월 2일(월),532,이달희,위원,(비례대표),6767,148,2023회계연도 결산(의안번호 2200051) / 가. 행정안전부 / 나. 중앙선거관리위원회 / 다. 진실·화해를위한과거사정리위원회 / 라. 인사혁신처 / 마. 경찰청 / 바. 소방청,,이 자리를 빌려서 대구·경북 시도민들께 행안부장관님으로서 적극적인 의지를 표명해 주시기 바랍니다.
418,정기회,제1호,2024년 9월 2일(월),533,이상민,행정안전부장관,,0,148,2023회계연도 결산(의안번호 2200051) / 가. 행정안전부 / 나. 중앙선거관리위원회 / 다. 진실·화해를위한과거사정리위원회 / 라. 인사혁신처 / 마. 경찰청 / 바. 소방청,,"지금 대구·경북의 통합은 여러 가지 상징적인 의미가 많습니다. 첫째는 광역자치단체 간의 첫 번째 통합이 될 것이고요, 된다면. 그다음에 우리 모두가 인식하고 있는 수도권 원극체제를 대구·경북의 통합으로서 다극체제로 전환할 수 있는 시발점이 되는 대한민국의 굉장히 상징적인 사건입니다. 그래서 일단 지역이 주도권을 쥐고서 통합을 잘 추진해 주신다면 저희 중앙행정부에서도 대한민국의 앞날이 걸린 문제이기 때문에 최선을 다해서 지원과 협조, 협력을 다할 것임을 다시 한번 약속을 드리겠습니다."
418,정기회,제1호,2024년 9월 2일(월),534,이달희,위원,(비례대표),6767,148,2023회계연도 결산(의안번호 2200051) / 가. 행정안전부 / 나. 중앙선거관리위원회 / 다. 진실·화해를위한과거사정리위원회 / 라. 인사혁신처 / 마. 경찰청 / 바. 소방청,,"장관님, 맞습니다. 대구·경북의 행정 통합은 단순한 두 지역의 문제가 아닙니다. 대한민국의 미래가 걸린 국가균형발전을 위한 미래지향적 지방행정체제 개편의 시작이 될 수 있도록 장관님께서 적극 지원 역할 부탁드립니다."
418,정기회,제1호,2024년 9월 2일(월),535,이상민,행정안전부장관,,0,148,2023회계연도 결산(의안번호 2200051) / 가. 행정안전부 / 나. 중앙선거관리위원회 / 다. 진실·화해를위한과거사정리위원회 / 라. 인사혁신처 / 마. 경찰청 / 바. 소방청,,"예, 알겠습니다."
418,정기회,제1호,2024년 9월 2일(월),536,이달희,위원,(비례대표),6767,148,2023회계연도 결산(의안번호 2200051) / 가. 행정안전부 / 나. 중앙선거관리위원회 / 다. 진실·화해를위한과거사정리위원회 / 라. 인사혁신처 / 마. 경찰청 / 바. 소방청,,이상입니다.
418,정기회,제1호,2024년 9월 2일(월),537,신정훈,위원장,(전남 나주시화순군),6713,148,2023회계연도 결산(의안번호 2200051) / 가. 행정안전부 / 나. 중앙선거관리위원회 / 다. 진실·화해를위한과거사정리위원회 / 라. 인사혁신처 / 마. 경찰청 / 바. 소방청,,"수고하셨습니다.
 다음은 존경하는 배준영 위원님 토론해 주시기 바랍니다."
418,정기회,제1호,2024년 9월 2일(월),538,배준영,위원,(인천 중구강화군옹진군),6700,148,2023회계연도 결산(의안번호 2200051) / 가. 행정안전부 / 나. 중앙선거관리위원회 / 다. 진실·화해를위한과거사정리위원회 / 라. 인사혁신처 / 마. 경찰청 / 바. 소방청,,"소방청장님, 제가 한번 가정을 해 보겠습니다.
 (영상자료를 보며)
 만약에 우리 국회의사당에 불이 나서 말입니다. 창문을 열고 바깥으로 뛰어내려야 되는 상황이 되면 소방서에서 안전매트를 깔 텐데요. 그러면 저희가 뛰어내려야 되지 않습니까. 그런데 얼마 전에 부천에서 일어났던 사건을 상기해 보면 저희가 뛰어내리기가 좀 어려울 것 같습니다. 왜냐하면 그게 제대로 우리를 보호해 줄지 믿음이 안 가거든요.
 그래서 신뢰게임이라고 들어 보셨는지 모르겠는데 트러스트 폴(Trust Fall)이라고 그러는데 이렇게 가슴에 손을 얹고 눈을 감고 뒤로 넘어지는데 누군가 잡아 줄 믿음이 있으면 그렇게 넘어지는데 못 그럴 것 같아요.
 그래서 이것은, 물론 소방청에서 소방안전개선추진단 구성해서 실효적인 개선 대책을 마련한다, 에어매트 표준 매뉴얼 마련한다고 하지만 이거야말로 정말 국민들에게 대책을 세운 다음에 소상히 설명해 주고 또 이게 얼마나 안전한지 설명을 제대로 하지 않으면 정말 큰일 날 것 같습니다.
 그래서 여러 위원님들이 많은 말씀을 하셨지만 제가 말씀드리는 거고요. 많은 시민들이, 저도 마찬가지지만, 떨어졌는데 뒤집히는 거 보고 아마 경악을 했을 거고 그다음 분이 또 떨어지셨지 않습니까?
 그래서 18년 동안 매뉴얼이 없었다는 건데 제가 시민으로서 좀 궁금한 걸 물어볼게요. 매트가 있는데 제대로 된 매트라면 옆에서 잡을 필요가 없는 거지요. 어떻습니까?"
418,정기회,제1호,2024년 9월 2일(월),539,허석곤,소방청장,,0,148,2023회계연도 결산(의안번호 2200051) / 가. 행정안전부 / 나. 중앙선거관리위원회 / 다. 진실·화해를위한과거사정리위원회 / 라. 인사혁신처 / 마. 경찰청 / 바. 소방청,,"예, 그렇습니다. 저희들이 가지고 있는 매트 종류가 세 종류가 있는데요. 가장 간단한 것은 대원들이 잡고 이동하는 간편한 식이 있고 두 번째는 공기 봄베를 넣어 가지고 바람을 넣는 방식이 있고 이 같은 경우는 펌프를 이용해서 공기를 주입하는 방식이 있습니다.
 인천에서 사용한 것은……"
418,정기회,제1호,2024년 9월 2일(월),540,배준영,위원,(인천 중구강화군옹진군),6700,148,2023회계연도 결산(의안번호 2200051) / 가. 행정안전부 / 나. 중앙선거관리위원회 / 다. 진실·화해를위한과거사정리위원회 / 라. 인사혁신처 / 마. 경찰청 / 바. 소방청,,잡을 필요가 없었던 거지요?
418,정기회,제1호,2024년 9월 2일(월),541,허석곤,소방청장,,0,148,2023회계연도 결산(의안번호 2200051) / 가. 행정안전부 / 나. 중앙선거관리위원회 / 다. 진실·화해를위한과거사정리위원회 / 라. 인사혁신처 / 마. 경찰청 / 바. 소방청,,"예, 세 번째 것에 해당되고 잡을 필요가 없는 매트입니다."
