session,session_type,meeting_no,date,speech_order,speaker_name,speaker_position,speaker_area,data_mem_id,agenda_item_orders,agenda_item_titles,agenda_item_times,speech_text
419,임시회,제1호,2024년 12월 13일(금),816,신정훈,위원장,(전남 나주시화순군),6713,1,현안 질의,(10시06분),"아니, 계엄령에 대한 법률적인 판단 하셨어요, 안 하셨어요?"
419,임시회,제1호,2024년 12월 13일(금),817,고기동,행정안전부장관직무대행,,0,1,현안 질의,(10시06분),사무실로 와서 헌법은 찾아봤습니다. 이게 타당한지 상당히 고민이 됐습니다.
419,임시회,제1호,2024년 12월 13일(금),818,신정훈,위원장,(전남 나주시화순군),6713,1,현안 질의,(10시06분),"장관께 어떤 건의라든가 의견을 전해 준 적이 있어요, 없어요?"
419,임시회,제1호,2024년 12월 13일(금),819,고기동,행정안전부장관직무대행,,0,1,현안 질의,(10시06분),특별히 없습니다.
419,임시회,제1호,2024년 12월 13일(금),820,신정훈,위원장,(전남 나주시화순군),6713,1,현안 질의,(10시06분),"보충질의하겠습니다.
 용혜인 위원님 질의해 주시기 바랍니다."
419,임시회,제1호,2024년 12월 13일(금),821,용혜인,위원,(비례대표),6697,1,현안 질의,(10시06분),"시간 멈춰 주시고, 최창복 경비안전계장님 앞으로 나와 주십시오.
 국회가 계엄 해제를 의결하면 헌법에 따라 대통령은 즉각 계엄 해제를 해야 합니다. 내란수괴 윤석열이 3시간 반을 더 버틴 후에야 계엄을 해제를 했어요. 그 시간 동안 뭘 했냐, 2차 계엄을 준비한 것 같습니다. 오늘 본회의에서 관련된 문건도 공개가 된다고 하던데요. 그 시간에 국회에서는 철수하던 수방사 계엄군이 국회로 재진입을 시도합니다. 알고 계시지요?"
419,임시회,제1호,2024년 12월 13일(금),822,최창복,서울특별시경찰청경비안전계장,,0,1,현안 질의,(10시06분),7명 정도가 밖에서 있었던 걸 알고 있습니다.
419,임시회,제1호,2024년 12월 13일(금),823,용혜인,위원,(비례대표),6697,1,현안 질의,(10시06분),"1시 46분경에 국회경비부대장이 ‘다시 지금 현 시간 7문 쪽에서 군부대 들어오려고 하는데 확인 부탁드린다’라고 이야기하니까 안전계장이 ‘군 관련자 진입 조치하라’라고 이야기합니다. 
 국회가 계엄 해제를 의결한 상황이었습니다. 아무리 아둔한 지휘관이라고 해도 그 상황에서 수방사 병력을 다시 국회로 진입시킨다라는 것은 2차 계엄을 염두에 두지 않고는 불가능한 판단이라고 저는 생각합니다. 다시 재진입시킨 것 누구의 판단이었습니까? 본인의 판단이었습니까, 위에서 지시가 있었습니까?"
419,임시회,제1호,2024년 12월 13일(금),824,최창복,서울특별시경찰청경비안전계장,,0,1,현안 질의,(10시06분),제 판단은 아니었습니다마는……
419,임시회,제1호,2024년 12월 13일(금),825,용혜인,위원,(비례대표),6697,1,현안 질의,(10시06분),누구의 지시가 있었습니까?
419,임시회,제1호,2024년 12월 13일(금),826,최창복,서울특별시경찰청경비안전계장,,0,1,현안 질의,(10시06분),그것까지는 정확히 기억 못 하겠습니다.
419,임시회,제1호,2024년 12월 13일(금),827,용혜인,위원,(비례대표),6697,1,현안 질의,(10시06분),기억 못 하십니까?
419,임시회,제1호,2024년 12월 13일(금),828,최창복,서울특별시경찰청경비안전계장,,0,1,현안 질의,(10시06분),청장님일 것으로 생각은 하는데요. 그 부분에 대해서는……
419,임시회,제1호,2024년 12월 13일(금),829,용혜인,위원,(비례대표),6697,1,현안 질의,(10시06분),서울청장이 현장에 있었습니까?
419,임시회,제1호,2024년 12월 13일(금),830,최창복,서울특별시경찰청경비안전계장,,0,1,현안 질의,(10시06분),"예, 저희 등 뒤에 계셨습니다. 한 3m 정도 떨어져……"
419,임시회,제1호,2024년 12월 13일(금),831,용혜인,위원,(비례대표),6697,1,현안 질의,(10시06분),"그러면 구두로 지시를 했을 것이다라는 거지요, 청장이?"
419,임시회,제1호,2024년 12월 13일(금),832,최창복,서울특별시경찰청경비안전계장,,0,1,현안 질의,(10시06분),"예, 그렇습니다."
419,임시회,제1호,2024년 12월 13일(금),833,용혜인,위원,(비례대표),6697,1,현안 질의,(10시06분),"윤석열이 ‘국회 하나 못 막냐’라는 질책을 하면서 결심실에 들어갔다라는 이야기가 있으니 계엄군으로 국회를 진압하고 계획을 하고 있다라는 합리적인 의심을 할 수밖에 없습니다. 결심실 상황을 몰라도 사실은 그 상황에서 2차 계엄이 가능하다라는 것은 본회의장에 있는 저도 생각했었고 아마 현장에 있는 많은 국민들도 그런 판단을 하셨을 거예요.
 그런데 경찰이 그냥 군인들에게 계엄 해제 의결 이후에 다시 국회의 문을 열어 준 겁니다. 그게 말이 된다고 생각하십니까?"
419,임시회,제1호,2024년 12월 13일(금),834,최창복,서울특별시경찰청경비안전계장,,0,1,현안 질의,(10시06분),"위원님, 바로 직전에 군인들이 돌아가기 위해서 차를 타러 지금 모이고 있다는 무전이 나옵니다. 아마, 저도 비슷하게 생각을 했고……"
419,임시회,제1호,2024년 12월 13일(금),835,용혜인,위원,(비례대표),6697,1,현안 질의,(10시06분),"5분 전에 나갔던 군인들이 재진입한다는 경비부대장의 무전이 있었잖아요. 그리고 5분 동안 말 없다가 다시 물어보니까 그렇게 대답하신 거잖아요, 진입 허가하라고."
419,임시회,제1호,2024년 12월 13일(금),836,최창복,서울특별시경찰청경비안전계장,,0,1,현안 질의,(10시06분),그러니까 나가는 과정이었고요. 그 사이에 보면 국회에서 버스를 타고 같이 간다는 얘기가 있었습니다.
419,임시회,제1호,2024년 12월 13일(금),837,용혜인,위원,(비례대표),6697,1,현안 질의,(10시06분),"그게 말이 되냐고 묻는 거예요. 국회에서 계엄 해제를 의결했고 그 현장에 있던 모든 국민들과 의원들이 다 2차 계엄에 대한 우려를 하고 있었습니다. ‘과연 계엄 해제를 의결했다고 해서 저 내란수괴가 그 계엄 해제 의결을 따를 것인가, 이미 헌정질서를 문란하게 한 사람이’라는 걱정들을 다 하고 있을 때 경찰이 다시 군인한테 길을 열어 준 거라고요, 국회에 진입하는. 그 판단이 적절했냐라고 여쭙는 거예요."
419,임시회,제1호,2024년 12월 13일(금),838,최현석,서울특별시경찰청장직무대행,,0,1,현안 질의,(10시06분),"위원님, 그건 제가 좀 말씀을 드려도 될까요?"
419,임시회,제1호,2024년 12월 13일(금),839,용혜인,위원,(비례대표),6697,1,현안 질의,(10시06분),"아니요, 괜찮습니다.
 저는 군인들이……
 (발언시간 초과로 마이크 중단)
 (마이크 중단 이후 계속 발언한 부분)
당시 무장하고 있었고 그 상황에서 경찰이, 국회경비대장이 애초에 국회를 틀어막은 것 그리고 헬기에서 떨어지는 군인들을 보고만 있었던 것도 황당하지만 계엄 해제 의결 이후에 군인들의 재진입을 경찰이 다시 허락한 것도 정말 납득하기가 어렵다라고 생각하고요. 2차 쿠데타 시도가 있을 수 있다는 것을 모든 국민들이 뻔히 알고 있을 만큼 우려가 되는 상황에서 군인들을 다시 들어가게 한 것이고, 저는 경찰들 역시 어디까지 알고 있었고 무엇을 결정했던 것인지 끝까지 진상규명 필요하다고 생각합니다. 국회 국정조사가 광범위한 규모로 많은 진상을 규명할 수 있도록 열려야 된다는 말씀 마지막으로 드립니다. 
 이상입니다."
419,임시회,제1호,2024년 12월 13일(금),840,신정훈,위원장,(전남 나주시화순군),6713,1,현안 질의,(10시06분),"서울청 경비계장, 용혜인 위원님 말씀에 기억이 안 난다고 그랬는데 군 관련자 진입 조치하는 그 결정, 상당히 간단한 결정이 아닐 것 같은데요. 누구로부터 지시받은 거 기억 안 나십니까?"
419,임시회,제1호,2024년 12월 13일(금),841,최창복,서울특별시경찰청경비안전계장,,0,1,현안 질의,(10시06분),제가 판단할 수 있는 사항은 아닌데 누군가가 그것……
419,임시회,제1호,2024년 12월 13일(금),842,신정훈,위원장,(전남 나주시화순군),6713,1,현안 질의,(10시06분),그러니까요. 본인이 판단해서 자의적으로 할 수 있는 일은 아니지요?
419,임시회,제1호,2024년 12월 13일(금),843,최창복,서울특별시경찰청경비안전계장,,0,1,현안 질의,(10시06분),"예, 그렇습니다."
419,임시회,제1호,2024년 12월 13일(금),844,신정훈,위원장,(전남 나주시화순군),6713,1,현안 질의,(10시06분),그러니까 누군가의 판단에 의해서 했는데 그게 기억이 안 난다 그러시는데 최소한 그 중요한 이야기를 전화로 받든 아니면 다른 통신기록으로 받든 간에 기억이 나야 되는 내용이에요.
419,임시회,제1호,2024년 12월 13일(금),845,최창복,서울특별시경찰청경비안전계장,,0,1,현안 질의,(10시06분),전화로 한 것이 아니고 등 뒤에서 말씀을 하셨던 거기 때문에 아마 정황상 청장님이었을 것 같다라고 저는……
419,임시회,제1호,2024년 12월 13일(금),846,신정훈,위원장,(전남 나주시화순군),6713,1,현안 질의,(10시06분),등 뒤에서요?
419,임시회,제1호,2024년 12월 13일(금),847,최창복,서울특별시경찰청경비안전계장,,0,1,현안 질의,(10시06분),"예, 제 앉아 있는 자리가 청장님으로부터 직선거리로는 한 3m 정도가 되고요."
419,임시회,제1호,2024년 12월 13일(금),848,신정훈,위원장,(전남 나주시화순군),6713,1,현안 질의,(10시06분),본인이 그때 당시에 있었던 장소가 어디입니까?
419,임시회,제1호,2024년 12월 13일(금),849,최창복,서울특별시경찰청경비안전계장,,0,1,현안 질의,(10시06분),"경비상황실입니다, 8층의. 집회관리상황실입니다."
419,임시회,제1호,2024년 12월 13일(금),850,신정훈,위원장,(전남 나주시화순군),6713,1,현안 질의,(10시06분),"들어가 주시기 바랍니다.
 다음은 채현일 위원님 질의해 주시기 바랍니다."
419,임시회,제1호,2024년 12월 13일(금),851,채현일,위원,(서울 영등포구갑),6576,1,현안 질의,(10시06분),"잠깐만요, 멈춰 주세요.
 수방사 대테러특임대가 어떤 일을 하는 데는 알고 계셔요, 계장님?"
419,임시회,제1호,2024년 12월 13일(금),852,최창복,서울특별시경찰청경비안전계장,,0,1,현안 질의,(10시06분),상식적인 선으로 정도 알고 있습니다.
419,임시회,제1호,2024년 12월 13일(금),853,채현일,위원,(서울 영등포구갑),6576,1,현안 질의,(10시06분),"뭐 하는 데라고 생각하세요? 테러라는 말이 들어갔는데 국회가 테러를 진압할 공간인가요?
 아니, 그러니까 상식적으로 수방사 대테러특임대라고 지칭을 하고 수방사 관련 도착하게 되면 바로 출입할 수 있도록 조치해라, 수방사 군인들 국회 안으로 진입 완료했다…… 그 당시에 국회는 난리였습니다. 헬기가 내리고 계엄군 280여 명이 헬기 동원해서 국회 경내 진입하고 진입하는 유리문 다 깨지고 충돌이 났어요.
 그때 상황실에서 TV 보고 있지 않았어요?"
419,임시회,제1호,2024년 12월 13일(금),854,최창복,서울특별시경찰청경비안전계장,,0,1,현안 질의,(10시06분),죄송하지만 저는 TV가 근처에 있기는 했지만……
419,임시회,제1호,2024년 12월 13일(금),855,채현일,위원,(서울 영등포구갑),6576,1,현안 질의,(10시06분),"그 상황을 몰랐어요, 국회 상황?"
419,임시회,제1호,2024년 12월 13일(금),856,최창복,서울특별시경찰청경비안전계장,,0,1,현안 질의,(10시06분),TV를 볼 수 있는 여건이……
419,임시회,제1호,2024년 12월 13일(금),857,채현일,위원,(서울 영등포구갑),6576,1,현안 질의,(10시06분),"국회 상황을 몰랐냐고요, 그러니까."
419,임시회,제1호,2024년 12월 13일(금),858,최창복,서울특별시경찰청경비안전계장,,0,1,현안 질의,(10시06분),"국회 앞에, 여기에 망을 친……"
419,임시회,제1호,2024년 12월 13일(금),859,채현일,위원,(서울 영등포구갑),6576,1,현안 질의,(10시06분),"국회에서 이렇게 충돌이 일어나고 그런 상황을 알고 있었어요, 계장님?"
419,임시회,제1호,2024년 12월 13일(금),860,최창복,서울특별시경찰청경비안전계장,,0,1,현안 질의,(10시06분),국회 경내의 상황은 몰랐습니다.
419,임시회,제1호,2024년 12월 13일(금),861,채현일,위원,(서울 영등포구갑),6576,1,현안 질의,(10시06분),그 비상계엄 선포 담화문 읽어 보셨어요?
419,임시회,제1호,2024년 12월 13일(금),862,최창복,서울특별시경찰청경비안전계장,,0,1,현안 질의,(10시06분),사후에 읽어 봤습니다.
419,임시회,제1호,2024년 12월 13일(금),863,채현일,위원,(서울 영등포구갑),6576,1,현안 질의,(10시06분),"거기에, 국회는 범죄자 집단의 소굴인가요?"
419,임시회,제1호,2024년 12월 13일(금),864,최창복,서울특별시경찰청경비안전계장,,0,1,현안 질의,(10시06분),그렇게 생각하지 않습니다.
419,임시회,제1호,2024년 12월 13일(금),865,채현일,위원,(서울 영등포구갑),6576,1,현안 질의,(10시06분),"자유민주주의 체제 전복을 기도하고 붕괴시키는 괴물이다, 동의하세요?"
419,임시회,제1호,2024년 12월 13일(금),866,최창복,서울특별시경찰청경비안전계장,,0,1,현안 질의,(10시06분),동의하지 않습니다.
419,임시회,제1호,2024년 12월 13일(금),867,채현일,위원,(서울 영등포구갑),6576,1,현안 질의,(10시06분),"그것 윤석열이라는 사람의 혼자만의 상상인 거예요. 그것을 경찰청, 특히 계장님은 서울청장님의 지시를 받았다 하지만 충실하게 부화수행한 겁니다, 내란죄의 부화수행.
 박현수 경찰국장님 잠깐 나와 주십시오. 나오면서 들으십시오.
 경찰국장님은 지금 이 비상계엄을 언제 알았나요?"
419,임시회,제1호,2024년 12월 13일(금),868,박현수,행정안전부경찰국장,,0,1,현안 질의,(10시06분),저도 집에서 TV를 보고 알게 됐습니다.
419,임시회,제1호,2024년 12월 13일(금),869,채현일,위원,(서울 영등포구갑),6576,1,현안 질의,(10시06분),"경찰국의 설립 취지가 뭐예요, 경찰국의 설립 취지?"
419,임시회,제1호,2024년 12월 13일(금),870,박현수,행정안전부경찰국장,,0,1,현안 질의,(10시06분),기본적으로 경찰의 인사와 자치경찰 지원……
419,임시회,제1호,2024년 12월 13일(금),871,채현일,위원,(서울 영등포구갑),6576,1,현안 질의,(10시06분),"경찰에 대한 민주적 통제, 그러니까 그전에 이것 설립하면서 엄청난 후유증이 있었지요? 사상 초유의 총경회의가 있었고 경찰의 독립성·중립성 훼손하고 권력을 경찰이 장악한다, 옛날 내무부 치안본부 체제로 간다, 그런데 그런 우려가 경찰이 권력의 주구가 되는 현실이 된 겁니다. 그것에 대해서 어떻게 생각합니까?"
419,임시회,제1호,2024년 12월 13일(금),872,박현수,행정안전부경찰국장,,0,1,현안 질의,(10시06분),전에 이상민 장관님께서 수차례 말씀하셨지만 경찰국의 임무가 경찰을 장악한다 이런다기보다는 장관이 갖고 있던 그 당시 법령상의 어떤 권한들을 수행하기 위한 그런 기구였습니다. 그래서 인사라든가 자치경찰 지원 이런 업무에 저희는……
419,임시회,제1호,2024년 12월 13일(금),873,채현일,위원,(서울 영등포구갑),6576,1,현안 질의,(10시06분),"경찰국이 설치가 되고 행안부에 경찰국 되면서 경찰을, 경찰청을 권력의 입맛에 맞게 장악하고 그러한 후유증이 이번에 여지없이 경찰청장·서울청장이 직전에 구속되는 아주 비극적인 상황이 된 겁니다. 경찰국이 폐지되어야 되는 당연한 이유 중의 하나입니다.
 알겠습니다."
419,임시회,제1호,2024년 12월 13일(금),874,신정훈,위원장,(전남 나주시화순군),6713,1,현안 질의,(10시06분),다음은 윤건영 위원님 질의해 주시기 바랍니다.
419,임시회,제1호,2024년 12월 13일(금),875,윤건영,위원,(서울 구로구을),6687,1,현안 질의,(10시06분),"구로을의 윤건영입니다.
 차장님께 여쭙겠습니다.
 차장께서는 조금 전에 방첩사와 경찰, 소위 말하는 체포조 관련해서 실무자끼리 통화만 있었다라는 식으로 답변을 했습니다. 맞지요?"
419,임시회,제1호,2024년 12월 13일(금),876,이호영,경찰청장직무대행,,0,1,현안 질의,(10시06분),"예, 그렇게 보고는 들었는데 그게 구체적으로 어떤 경위로 어느 때 몇 시에 했는지가 아직 파악 전이라고 말씀드렸습니다."
419,임시회,제1호,2024년 12월 13일(금),877,윤건영,위원,(서울 구로구을),6687,1,현안 질의,(10시06분),"그런데 본 위원에게 제보 들어온 바에 따르면요, 정확하게 답변하셔야 됩니다. 당일 날 12월 3일 날 영등포서 경력 10명을 체포조로 투입했다는 겁니다. 즉 국회 수소충전소 앞에서 영등포서 경력 10명이 주요 국회의원을 체포할 목적으로 방첩사 인원을 대기했는데 그 장소가 바로 국회 앞 수소충전소라는 겁니다. 국회 앞 수소충전소에서 방첩사 인원을 대기하다가 계엄 해제가 선포되는 와중에 방첩사가 늦게 도착하면서 그 계획이 무산됐다라는 겁니다. 알고 계십니까?"
419,임시회,제1호,2024년 12월 13일(금),878,이호영,경찰청장직무대행,,0,1,현안 질의,(10시06분),그것은 제가 전혀 모르고요. 그것 파악해 보겠습니다.
419,임시회,제1호,2024년 12월 13일(금),879,윤건영,위원,(서울 구로구을),6687,1,현안 질의,(10시06분),그러면 이 회의가 끝나기 전까지 영등포서에 연락을 해서 10명의 인원이 체포조 목적으로 당일 날 12월 3일 날 국회 수소충전소 앞으로 출동했는지를 확인해서 본 위원에게 알려 주십시오.
419,임시회,제1호,2024년 12월 13일(금),880,이호영,경찰청장직무대행,,0,1,현안 질의,(10시06분),"예, 알겠습니다. 지금 파악을……"
419,임시회,제1호,2024년 12월 13일(금),881,윤건영,위원,(서울 구로구을),6687,1,현안 질의,(10시06분),"바로 지금 조치하시고, 뒤에서 나가서 조치할 수 있도록 하십시오. 만약에 경찰 경력이 아무리 부당한 방첩사의 지시라 할지라도 그에 부화뇌동해서 국회의원 체포조를 운용했다면 이건 심각한 문제가 되는 겁니다.
 차장님, 바로 확인해서 국회 행안위에 제출해 주시기 바랍니다, 회의 끝나기 전까지."
419,임시회,제1호,2024년 12월 13일(금),882,이호영,경찰청장직무대행,,0,1,현안 질의,(10시06분),"예, 파악해 보겠습니다, 바로."
419,임시회,제1호,2024년 12월 13일(금),883,윤건영,위원,(서울 구로구을),6687,1,현안 질의,(10시06분),"좋습니다.
 그리고 오늘 여러 위원님들이 이야기하셨지만 실제로 비상계엄 해제 선포권을 가지고 있는 그리고 헌법에 보장되어 있는 국회의 권능을 막고 국회의원 출입을 막았던 것은 실질적으로 경찰입니다, 그게 누구의 지시든 간에. 그리고 오늘 이 자리에는 그 업무를 담당했던 경비안전계장을 비롯해서 실제로 그런 일에 가담했을 것으로 의혹을 받고 있는 101단장―오늘 출석하지는 않았습니다―이런 분들이 현직에서 일을 보고 있습니다.
 차장님, 제 생각에는 내란에 적극적으로 가담하든 아니면 모르고 가담하든 아니면 지시에 따라 가담하든 가담했던 사람들에 대해서는 정확하게 직무 정지가 내려져야 된다고 생각합니다. 차장님 생각은 어떻습니까?"
419,임시회,제1호,2024년 12월 13일(금),884,이호영,경찰청장직무대행,,0,1,현안 질의,(10시06분),위원님 말씀에 일부 공감은 하고요. 다만 이제 수사가 진행 중에 있어서 그 진행 상황에 따라서……
419,임시회,제1호,2024년 12월 13일(금),885,윤건영,위원,(서울 구로구을),6687,1,현안 질의,(10시06분),"수사가 아무리 진행 중이더라도요, 국민한테 총부리를 겨눈 군인을 보호한 게 경찰입니다. 그 경찰을, 경찰 병력을 가동·운용했다면 책임을 정확하게 지셔야지요. 말로 책임질 게 아니지 않습니까?"
419,임시회,제1호,2024년 12월 13일(금),886,이호영,경찰청장직무대행,,0,1,현안 질의,(10시06분),"그래서 서울 한꺼번에, 다 경비부서만 관련돼 있어서 서울 치안 문제도 있고 그래서 순차적으로 수사 결과에 따라서 조치할 예정입니다."
419,임시회,제1호,2024년 12월 13일(금),887,윤건영,위원,(서울 구로구을),6687,1,현안 질의,(10시06분),"경비 담당하고 있는 한 사람이 직무 정지가 된다고 해서 수도 서울의 경비가 무너집니까, 차장님?"
419,임시회,제1호,2024년 12월 13일(금),888,이호영,경찰청장직무대행,,0,1,현안 질의,(10시06분),제가 하여튼 수사 결과에 따라서 조치를 검토하겠습니다.
419,임시회,제1호,2024년 12월 13일(금),889,윤건영,위원,(서울 구로구을),6687,1,현안 질의,(10시06분),"수사 결과에 따라서 할 게 아니라 지금 당장 할 수 있는 조치를 취하셔야지요. 그게 공정이고 정의인 겁니다. 그게 비겁하지 않은 거고요, 차장님."
419,임시회,제1호,2024년 12월 13일(금),890,이호영,경찰청장직무대행,,0,1,현안 질의,(10시06분),"예, 검토해 보겠습니다."
419,임시회,제1호,2024년 12월 13일(금),891,윤건영,위원,(서울 구로구을),6687,1,현안 질의,(10시06분),검토 결과를 보고해 주십시오.
419,임시회,제1호,2024년 12월 13일(금),892,신정훈,위원장,(전남 나주시화순군),6713,1,현안 질의,(10시06분),"차장님, 지금 존경하는 윤건영 위원님이 지적하신 내용은 검토하고 미룰 일이 아닙니다.
 지금 이미 국회경비단장이 어떻게 돼 있지요?"
419,임시회,제1호,2024년 12월 13일(금),893,이호영,경찰청장직무대행,,0,1,현안 질의,(10시06분),국회경비대장은 지금 대기 발령됐습니다.
419,임시회,제1호,2024년 12월 13일(금),894,신정훈,위원장,(전남 나주시화순군),6713,1,현안 질의,(10시06분),대기 발령됐지요?
419,임시회,제1호,2024년 12월 13일(금),895,이호영,경찰청장직무대행,,0,1,현안 질의,(10시06분),예.
419,임시회,제1호,2024년 12월 13일(금),896,신정훈,위원장,(전남 나주시화순군),6713,1,현안 질의,(10시06분),국회경비단장을 지휘했던 사람이 서울청 경비안전계장입니다. 거기를 지휘했던 서울청장이 있고 본청장이 있을 겁니다. 최소한 지금 이 서울청의 지휘망 녹취록 내용만 보더라도 당장 직무 정지를 내려야 될 상황이라고 생각합니다. 어떻게 생각하세요?
419,임시회,제1호,2024년 12월 13일(금),897,이호영,경찰청장직무대행,,0,1,현안 질의,(10시06분),"그건 검토해 보겠습니다. 왜냐하면 경무관 이상은 제가 정부 인사 결재권이 없어서, 인사권이. 그래서 지금……"
419,임시회,제1호,2024년 12월 13일(금),898,신정훈,위원장,(전남 나주시화순군),6713,1,현안 질의,(10시06분),"우선 그러면 본인의 판단을 이야기해 보세요, 의견을."
419,임시회,제1호,2024년 12월 13일(금),899,이호영,경찰청장직무대행,,0,1,현안 질의,(10시06분),저는 나오는 대로 사실 확인이 되면 조치는 해야 된다고 생각은 합니다. 다만 인사……
419,임시회,제1호,2024년 12월 13일(금),900,신정훈,위원장,(전남 나주시화순군),6713,1,현안 질의,(10시06분),조사 상황이 끝나기 전이라도 이와 같은 지휘망 녹취록을 보고는 더 이상 저희 국회는 그 당사자가 이 경찰 병력을 동원할 수 있는 그런 위치에 있어서는 안 된다고 생각합니다. 신속한 조치를 해 주시고 국회에 보고해 주시기 바랍니다.
419,임시회,제1호,2024년 12월 13일(금),901,이호영,경찰청장직무대행,,0,1,현안 질의,(10시06분),알겠습니다.
419,임시회,제1호,2024년 12월 13일(금),902,신정훈,위원장,(전남 나주시화순군),6713,1,현안 질의,(10시06분),다음은 모경종 위원님 질의해 주시기 바랍니다.
419,임시회,제1호,2024년 12월 13일(금),903,모경종,위원,(인천 서구병),6786,1,현안 질의,(10시06분),"인천 서구병 검단에서 온 모경종입니다.
 행안부차관님."
